rating,review
5,hàng đẹp vừa đúng dáng người lần này đặt trễ nhưng hên hàng giao nhanh đúng lúc vừa ý cực kỳ shipper thân thiện sẽ tiếp tục ủng hộ shop nhiều hơn
5,vải đẹp rất thoải mái khi mặc bên ngoài phải mua
5,dây đeo thể điều chỉnh phù hợp chất liệu chất lượng cao chất liệu mềm mại thoải mái ok đẹp
5,chất liệu cung được
5,đẹp lắm mọi người nên mua nha tay áo dây thun hơi chật mình đem thay dây thun ok
5,váy đẹp nhé lần sau ủng hộ shop nữa
1,shop giao hàng đểu mua áo dài tay lại gui ngắn tay nhan tin không trả lời shop vô trách nhiệm mọi người nên tránh không mua shop này
1,shop giao hàng đểu hàng nhận thực tế khác với hàng đăng bán nhan tin khong rep trả loi shop không uy tín
5,váy vải hơi thô nhưng với giá 3 mấy nghìn thì 1 lựa chọn hoàn hảo tốt so với giá tiền ủng hộ shop
5,áo đẹp lắm nha mọi người vải đẹp chất vải dầy giao hàng nhanh shop uy tín mọi người nên mua nhưng hơi rộng xíu hợp với giá tiền shipper vui tính nữa
5,chất liệu được sử dụng trông rất chắc chắn dễ sử dụng dịch vụ của cửa hàng rất tốt chiếm được cảm tình của khách hàng đề xuất cửa hàng này
5,đồ rất tốt mình thích lắm mình mua nhiều lần ở cửa hàng này rồi mà chất lượng vẫn như ngày nào
5,chất liệu co giãn mặc thoái mái
5,thiết kế che bụng tôn dáng phong cách thường ngày dễ dàng phối đồ đầm dài tạo vẻ thanh lịch màu đen phối đồ dễ dàng
5,thiết kế phong cách nữ thần đầm dáng a tôn dáng phong cách thường ngày dễ dàng phối đồ đầm phiên bản hàn quốc thời trang
5,chất liệu thun dày co giãn vải rủ
5,váy suông dáng dài rộng thoải mái mặc ở nhà đi chơi đều được đáng tiền
5,ok nha ca nhà
4,kiểu dáng đặc màu trắng giao màu đen
5,giao hàng nhanh đồ đẹp ủng hộ shop dài dài
5,shop yêu ơi mẫu mã hàng chất liệu thì đẹp đó nhưng cái shop giao cho e không đúng màu hy vọng shop khắc phục vấn đề này
5,chất lượng vải tốt mặc vào rất nhẹ nhàng thoải mái rất mát ok
5,vải dày dáng đẹp lắm mọi người nên ủng hộ shop nhé mình sẽ mua thêm màu xanh haha
5,quyết định rinh 2 em cho đủ màu thay đổi đầm xuất sắc lắm shop uiii mình sẽ ủng hộ shop dài dài nhé
2,gửi nhầm màu
5,chất liệu ok rất tuyệt lần sau mua ủng hộ sốp cho sốp 5 sao síp nhiệt tình
5,thun thiết kế hoa tuyệt đẹp thanh lịch nữ tính chất liệu mềm mại thoáng khí
5,nhận được hàng đóng gói đầy đủ cẩn thận hàng đúng quảng cáo đúng mẫu
1,mọi người mua đồ shop này nên cân nhắc kỹ treo đầu dê bán thịt chó
5,váy linh hoạt phù hợp với nhiều dịp đẹp nha
5,với giá tiền như vầy thì chất vải không đòi hỏi như vầy ổn vải thun co giãn người trung niên mặc ok đóng gói cẩn thận kèm theo thắt lưng
5,chúc đại gia đình một buổi ca hát giao lưu âm nhạc vui vẻ các anh chị các bạn nhé
5,đẹp vai thun nhjmạc dáng dẹp 63 không xxl hơi rộng
5,hàng ok đúng như mô tả đóng gói cẩn thận giao hàng nhanh chóng chất lượng tốt mua lần 2 cho shop 5 sao hình ảnh nhận xu
3,nhận được trong tình trạng tốt nhưng vật liệu rất mỏng thể nhìn xuyên qua đường may không được khâu tốt n
1,không giống hình đầm không xoè vải mỏng xấu không biết để làm gì
5,không chấp nhận được
5,5 sao để lấy xu vải mỏng quá không nên mua
5,đẹp á mọi người mà phần mút của váy mỏng quá phần chân váy cũng quá mỏng cần thêm lớp lót chứ mỏng quá
5,rẽ đẹp nên mua ạ
4,đầm nhẹ nhàng thoáng mát cổ áo vuông thanh lịch lý tưởng cho các dịp thường ngày chân váy dài ngang đầu gối phù hợp cho mùa hè đầm thật dáng không đẹp như hình
5,chất liệu thun mỏng
5,đặt chiếc đầm này lần thứ n rồi chất phi bóng đẹp ôm body giống y như ảnh luôn xuất sắc lắm mọi người nên mua thử
5,giao hàng nhanh vải rất ok không dày cũng không mỏng váy dài như hình quảng cáo
5,vải đẹp co giãn mình 1m6 mặc dài tới mắt cá shop hỗ trợ nhiệt tình
5,mặc ôm đẹp thấy mọi người khen nên đánh liều mua hok hề thất vọng sản phẩm dài tới bắp chân nhé mng yên tâm mua nha
5,váy mặc siêu xinh mặc lên chân dài miên man nên 1 chiếc trong tỷ đồ con gái akiki
5,đẹp không lối thoát đẹp không đường về đẹp quên sầu nha mấy bà đầm lên dáng ok lắm sexy mà vẫn không hở hang chút chỉ thừa không đáng kẻ mua được cái váy ưng ý gì đâu nà giá sale siêu ngon
5,vải vật liệu tốt thoải mái cho thời tiết nóng dễ dàng để ăn mặc2
5,chiều dài váy hoàn hảo phù hợp với mùa hè dáng váy cổ điển phù hợp với thời gian rảnh
5,đầm đẹp khá ưng ý
5,đầm đẹp lắm vải dầy dặn
3,chất liệu chất liệu vải quá tệ đừờng may ẩ nói chung đặt hàng lần đầu tiên thấy không hài lòng với sản phẩm
5,chất vải mềm đẹp 36kg mặc hơi rộng
5,chất lượng kỹ thuật tuyệt vời hình dáng aline tôn dáng vải mềm mại nhẹ nhàng đầm thời trang thoải mái
5,thiết kế lỏng lẻo thoải mái hoàn hảo cho ngày hè hoàn hảo cho ngày hè dễ dàng phối đồ hình dáng aline tôn dáng
5,đầm ok nha 1m50 50kg sz l vừa nha mọi người mặc lên ôm người thon ra được xíu ai ốm hơn xíu mặc lên chắc sẽ okla hơn á
5,giao hàng nhanh đúng vảy đẹp xinh giống hình ảnh
5,vải đẹp đường may chắc chắn
5,áo váy hợp với giá tiền mua tặng bé sinh nhật nhận đúng ngày luôn bé thích lắm
5,hàng tốt chất vải đẹp lắm nên mua nha mọi người shop cute nữa cơ hội lại ủng hộ tiếp ε
5,tiền nào của đó
5,đầm vừa đẹp mặc mát chất liệu vải đẹp nên mua
5,đầm đẹp nên mua
5,phong cách vintage dễ thương hoàn hảo cho chuyến đi biển mùa hè chất liệu mỏng nhẹ đáng yêu thiết kế cổ vậy quyến rũ
5,đa dạng thích hợp cho mọi dịp chất liệu mỏng nhẹ đáng yêu chất liệu mềm mại thoải mái
5,vải đẹp lắm nha mặc rất mát
5,chất liệu tốt
4,thiết kế hoa đẹp mắt nhưng đường may bị nhăn quá
5,hàng ok co giãn tốtnen mua nhe rất hài lòng
5,váy đẹp lắmcả nhà vào mua ủng hộ shop nhéem mua sẽ còn ủng hộ nữa
5,chưa hài lòng lắm
3,không được hài lòng lắm
1,không đẹp vải thường
5,váy mặc đẹp thoải mái chất vải oke phù hợp ở nhà đi biển hay dạo phố rất nên mua
5,vải dày xinh rẻ độ co giãn tốt nên mọi người mua khỏi sợ chật hình ảnh chỉ mang tính chất nhận xu
5,đả nhận được hàng rất ưng ý mẩu mả đẹp dáng chuẩn mặc rất vừa ý sẻ giới thiệu cho bb cùng mua đánh giá cho shop 5 sao
5,váy đẹp mềm mịn mặc lên chuẩn dáng shop giao nhanh tư vấn nhiệt tình sẽ ủng hộ khi nhu cầu
5,đúng mẫu giao hàng nhanh lần sau ủng hộ shop tiếp tận năm sao
5,váy dáng suông tay dài bo tay chất len gân siêu dày mặc mùa đông cũng ok nè giá hợp lý váy đẹp tôn dáng
5,chất cũng khá dày dặn không mỏng lắm đâu ạ nói chung ưng cảm ơn shop
5,ảnh bà hàng nhận được rất khác nhau nha không phải len đâu nhưng với giá này thì không đòi hỏi gì hơn
4,vải không co giãn mặc khó chịu chất xấu
5,vải hơi mỏng
5,đặt mẫu này giao mẫu khác sao vậy ạmong shop khắc phục lỗi này
5,shop ơi mình dặn caro mà sao giao cho mình màu trắng shop còn caro không ạ nếu còn cho em đặt váy caro cảm ơn shop ạ nếu không còn thì thôi ạ thank shop hàng dùng cũng rất đẹp
5,tiền nào của nấy váy hợp giá tiền không mong chờ gì nhiều hơn vào cái váy giá tầm này vải mỏng nói chung ok
5,áo kiểu giống hình vải mỏng phù hợp giá tiền mình mặc phía ngoài đồ bơi nên khá ok hình mang tính chất nhận xu
5,rộng quá chất vải hơi mỏng nhìn thấu cả nội y luôn mua về mặc làm đồ ngủ thì ok còn đi ra ngoài vẫn quên đi
5,dáng chữ a tôn dáng phù hợp với nhiều dáng người khác nhau vải mỏng nhẹ cho mùa hè tay áo phồng thanh lịch thiết kế dễ thương hợp thời trang cổ áo polo thêm phần phong cách dây rút eo thể điều chỉnh để vừa vặn hoàn hảo
5,anh nói gì cũng làm nè anh cho gì cũng uống nè rồi đó thấy chưa dị ứng rồi đó
5,không bao gồm nhưng nếu 4 tuổi thể mặc bởi vì nó một chiếc váy trẻ em vải in rất mỏng
5,hàng đẹp 65kg mặc vẫn vừa nhe mình sợ hụt hẫng nhưg không rất đẹp nên mua nha đág đồng tiền
5,chi tiết cổ sọc độc đáo vải mềm mịn thoải mái thiết kế tay ngắn linh hoạt
5,kết cấu gân thời trang váy bodycon tôn dáng thiết kế tay ngắn đa năng
5,hàng quốc tế nên sẽ giao hơi lâu vải len đẹp lắm kiểu màu của váy cũng chuẩn như hình shop đăng nữa mình xem đánh giá để mua thôi à lần đầu mua của shop mà thấy hài lòng lắm luôn sẽ quay lại mua đồ của shop nữa
5,váy cũng được mà bị rách shop giao hàng cẩu thả
5,đẹp lắm ạ như hình mỗi tội giao hơi lâu
5,váy aline thanh lịch sành điệu
5,đầm khá ổn vải thun hơi nóng o dây thắt eo như mẫu nhưng vẫn đẹp
5,giao hàng nhanh đóng gói cẩn thận chất lượng hàng tốt sẽ tiếp tục ủng hộ shop
5,yêu nó rất nhiều
5,váy xinh lắm mọi người với giá này thì quá ok nên mua nhaaa
5,dáng đầm khỏi chê luôn ạ mặc dự sinh nhật mà ai cũng khen tôn dáng lắm ai chưa mua thì nên mua liền đi ạ không hối hận đâu
5,thích hợp cho mùa hè trang phục bãi biển đẹp vật liệu chất lượng cao nhìn thoải mái phong cách phong cách y2k phong cách thích hợp cho các kỳ nghỉ bãi biển
5,nhìn thoải mái phong cách trang phục bãi biển đẹp thích hợp cho mùa hè thích hợp cho kỳ nghỉ bãi biển hình dáng quyến rũ
3,màu sắc không giống hình chụp quảng cáo đặt hồng đỏ đậm lại nhận được hồng phấn không xứng với giá tiền bỏ ra sẽ không đặt lại hàng của shop 1 lần nào nữa
1,họ gửi thứ hoàn toàn khác nhau
5,hàng khuyến mại siêu rẻ mà quà đáng iu giao rất nhanh rất hài lòng chất mát co giãn tốt
5,thành công
5,hàng quá đẹp quá ok luôn nhé mọi người xứng đáng 5 sao
2,giao hàng không đúng order mua màu trắng mà gởi màu đen
5,đầm rất dễ thương vải mềm mịn đúng dáng đường may tỉ mỹ rất hài lòng
4,giao hàng nhanh chóng thích hợp cho phụ nữ ngoại cỡ vải thoải mái thoáng khí nhưng chất liệu không tốt vì nó giống như một loại vật liệu đồng phục học sinh
5,váy đẹp lắm luôn cả nhà ơi nên mua
5,giao không đúng mẫutệ
5,chất liệu vải cao cấp dễ mặc sức cs hút của phái nữ
5,đầm của túi tiền ok lắm mọi người ơimjk sẽ ủng hộ shop
5,tiền nào của đó thôi đi sửa lại thể mặc đi cà phê sáng cũng được
5,hoàn hảo cho các dịp mùa hèhoàn hảo cho các dịp mùa hèmàu xanh quân đội đa năng
5,vải đẹp dễ thương
5,đóng gói giao hàng nhanh váy đẹp y hình chỉ điều nhìn trên hình giống màu be nhưng nhận hàng lại màu hồng hơi thất vọng xiu nhưng hàng đẹp nên cũng không saocho shop 5 sao nhé
5,thoải mái cho cả thai kỳ sau sinh thiết kế thời trang thanh lịch hoàn hảo cho việc mặc đi làm chất liệu chất lượng cao màu hồng đẹp
1,gửi lời đến shop thứ 1 bên shop giao hàng sai mô tả không giống hình nhé thứ 2 vải quá mỏng không tưởng nổi thứ 3 hàng gửi vào xa mà khi đóng gói lại không kiểm tra hàng cần xem lại quy trình làm việc nếu không mẫu hoặc hết thì vui lòng phải gọi điện báo khách hàng đâu thể muốn giao giao được ạ mất uy tính
5,cổ tay chật
4,vải đẹp
5,giao hang khong dung nhu mau kieu dang qua xau khong vua y
5,dat hang nay giao hang khaclam an vay ai mua nua
5,váy xinh như hình chất vải mềm đóng gói cẩn thận mua sale nên quá rẻ so với chất lượng giao hàng hơi lâu
5,rẻ mà đẹp nha
5,hàng đẹp được mua giá rẽ ứ chi thích vải mềm ok dây kéo cũng dễ kéo
5,làm biếng đánh giá mà nhận hàng phải vào đánh giá cho shop đóng gói cẩn thận gói hàng hàng chứ đóa nhìn gói hàng cảm tình với shop liền luôn ah chưa mặc thử nhưng rất hài lòng đặt tối sáng giao
4,không nhu hình ngắn quá thấy dai mới mua dai chút nữa thì đẹp giao hang dễ thương bọc hàng cũng được
4,vải nhìn không giống hình nhìn không đẹp
1,gửi sai loại xin vui lòng gửi lại
5,đẹp lắm cực kỳ hài lòng vải cũng mềm mát nữa má mình mê tít không biết nói gì cho hết chữ nữa
5,đầm đúng màu nhưng không dài như ảnh chất thun lạnh
5,váy dễ thương cho các dịp bình thường
5,váy ok với giá tiền này
5,tay ngắn phù hợp mùa hè
4,chờ hàng quá lâu giao hàng ổn váy chất thun không mềm giặt xong hy vọng mềm hơn xl mặc vừa
5,vải thun không quá dày không mỏng tạm được số với giá tiền kiểu dáng xoè mình thích dài hơn tí nữa đẹp
5,hoàn hảo cho các dịp trang trọng đầm đa năng cho văn phòng tiệc tùng hình dáng aline tôn dáng thiết kế thanh lịch phong cách
5,không thấp nhưng khá dễ thương
5,chất liệu dày vừa vặn khuyên bạn nên mua cho ai thân đồng hồ cát
5,vật liệu tốt
5,chất lượng tốt không dơi
5,đẹp lắm nha mấy bồ ôm sát eo tôn dáng cực kì vải hơi mỏng nhưng nhìn chung đẹp
5,nhận được nhiều lời khen khi mặc nó nhận được nhiều lời khen khi mặc nó nhận được nhiều lời khen khi mặc nó nhận được nhiều lời khen khi mặc nó nhận được nhiều lời khen khi mặc nó nhận được nhiều lời khen khi mặc nó nhận được nhiều lời khen khi mặc nó
5,chất liệu vải mát co giãn mặc ôm body shop giao hàng nhanh đầy đủ
5,đệp vc không lộ áo kia nhía hihi mình cái áo 400 giống vậy mà nhìn n không khác gi
5,đầm chất vải cũng được nhưng đầm nhìn rất nhỏ nhờ vải thun giãn nhiều nên mặc cũng được nói chung giá này thì ok rồi không đò hỏi hơn
5,chất liệu mềm mại thoáng khí hoàn hảo cho mùa hè đầm dài chân gây ấn tượng túi rộng tiện lợi chất liệu mềm mại thoáng khí hoàn hảo cho mùa hè túi rộng tiện lợi hoàn hảo cho mùa hè hoàn hảo cho mùa hè hoàn hảo cho mùa hè
5,toàn bo rát dep vai cang tuyet voi phièn bàn rát mong
5,hình để kiểu giao mãu kiểu khác thất vọng shop
5,giao không đúng mẫu
5,vải hơi nóng dayf nhưng không sao phù hợp với giá tiền mặc rất ôm tôn dáng nên mua nhé mọi người
5,đẹp dã man chất đẹp mát mịn tôn dáng cái eo ngoài nó bé xíu luôn ấy sexy lắm shop ơi bắt đền shop đó
5,nếu kết style này rồi thì khuyên nên mua nhé vải đẹp mặc mát phù hợp mùa hè dáng cực đỉnh
5,đầm đẹp lên dáng khá xinh shop giao siêu nhanh trong vòng 1 nốt nhạc rep tin nhắn nhanh cho shop 5 sao nhé
5,rẻ mà đẹp chất lượng không ngờ nha cả nhàhên mua được loại hàng mình tìm mua thêm vài cái
5,đầm rất đẹp mà rẻ nữa bạn nào 50 ký mặc ok mình 52 ký mặc ôm nhé giao hàng nhanh chóng hài lòng
5,váy xinh giá rẻ mặc tôn dáng mình mua 3 cái của shop nhưng mặc cái này thấy đẹp nhất lần sau sẽ lại ủng hộ shop
5,lý tưởng cho trang phục thai sản phù hợp cho phụ nữ cỡ lớn thiết kế thanh lịch theo phong cách thái
4,hàng mình nhận về bị lỗi khá nhiều đường chỉ ở cổ lỏng lẻo nhăn dúm vào tay áo thì bị lộ vải thừa nhưng khi nhắn tin cho shop được giải quyết ổn tuy shop giải quyết hơi lâu nhưng vải áo thì rất ok so với giá săn sale thì quá rẻ nên vẫn chấp nhận được
5,chất liệu thoải máinói chung giá tiền đó ok rồi
5,hàng gửi y hình chuẩn size giá rẻ nếu đi may thì số tiền này không đủ tiền công nhìn áo thì bình thường nhưng măc lên rất đẹp mình không nghĩ với giá tiền này mà áo mặc laj đẹp vâhj sẽ ủng hộ shop dài dài
5,đầm xinh lắm nha mọi người bầu mặc thoải mái luôn ạ ai bầu to cũng mặc vừa nên mua vải cũng rất ok nha shop nc dễ thương nữa 5 sao không tiếc
5,váy xinh lắm nha rẻ mà đẹp quá ạ cảm ơn shop sẽ ủng hộ dài dài
5,đồ đẹp lắm mọi người ạ
5,đầm đẹp mà giao hàng hơi lâu
5,váy đẹp lắm ạ váy phồng xinh lắm áa váy chất lượng lắm
5,đồ đẹp lắm shop
5,vật liệu chất lượng cao váy đa năng cho mọi dịp phù hợp cho mọi giai đoạn của thai kỳ vải mềm thoáng khí vải mềm thoáng khí váy bầu thời trang thoải mái
5,sản phẩm chất lượng tốt đồ đến mặc vừa vặn vải hơi thô giặt chắc sẽ mềm hơn
5,thiết kế cổ polo tôn dáng đầm bầu thời trang thoải mái
5,vải không co giãn
5,bầu 66kg nha 4 tháng nè mặc thoai mái đầm mát cực kì lun á
5,hàng tặng kèm khi mua đầm mình cũng không xài dây thun nhỏ xíu hàmàu nâu đẹp
5,chờ thời gian sử dụng sẽ đánh giá sau được sẽ ủng hộ lần mua lần sau
5,màu nâu đẹp đơn giản nhưng phong cách
5,hơi dẹp
5,mua kiểu này giao kiểu khác đánh giá sao đây
5,đồ siêu đẹp nhận hàng thích lắm luôn gói hàng kĩ giao hàng nhanh nữa không chê chỗ nào được giá cả hợp lý nữa
5,chất liệu hơi mỏng
5,áo mặc rất đẹp nha vải mỏng mát rất ưng ý đặt thêm vài mẫu khác từ shop hy vọng sẽ đẹp
5,thiết kế hoa đẹp váy đa năng cho các sự kiện ngoài trời gấu áo bèo đáng yêu hoàn hảo cho các bữa tiệc mùa hè thiết kế cổ o tôn dáng
5,váy hơi dày nhưng dày đẹp
5,vải hơi mỏng chất vải không được mềm
5,phải nói 1 từ đẹp giá rẻ dáng đẹp cho shop 5sao
5,giao không đúng mẫu thể đổi được không
5,xuất sắc luôn ạ
5,đầm đẹp nhưng khác với mẫu cổ áo đơn giản không kiểu như hình chụp
5,10đ cho sự tuyệt vời hàng quá đp
5,vượt sức mong đợi rẻ đẹp cảm ơn shop nhé lần sau mình ủng hộ tiếp ạ chất vải dày dặn mặc lên dáng lắm
5,thoải mái đẹp mắt chất liệu mềm mại thoải mái màu nâu đẹp thiết kế dễ thương cho bé gái
5,đầm đẹp giống hình nên mua giao hàng khá nhanh mình đặt lớn hơn sze nên hơi tiếc mắc công phải đi sửa đang đặt thêm 3 sản phẩm từ cửa hàng này
5,đẹp chât liẹu thun
5,váy đẹp
5,phù hợp với nhiều dịp dễ mặc chất liệu mịn mềm hiệu ứng giảm cân
5,đầm xinh lắm ạ nhưng mà điều cổ vuông chứ không phải cổ trái tim như ảnh dây chun hơi bó gây khoe chịu xíu
5,đẹp ok
5,mình thích lắm váy đẹp chất liệu vải ok
3,bộ bài tây mạ vàng bài tây may mắn bộ bài tây mạ vàng bài tây may mắn
5,chất liệu mát nhẹ dễ thương
5,mong manh sexy phù hợp với người body đẹp
5,đẹp xuất sắc hình
5,đầm thời trang với chi tiết vai đính hạt hoàn hảo cho một buổi tối ra ngoài
5,80 ka mà cũng ra gì đấy
5,hàng như hình shop uy tín hình ảnh mang tính chất nhận xu
5,vật liệu xem thông qua
5,bắt mắt in động vật thiết kế eo cao hoàn hảo cho các chuyến đi biển kỳ nghỉ
5,hàng như hình nè đóng hàng xin lu sò lắm nha nói chung ổn chất thun dày không xịn nhưng vừa túi tiền
5,đóng gói cẩn thận giao hàng nhanh nhân viên tư vấn vui vẻ nhiệt tình thank shop
5,đầm xinh giao nhanh nửa
5,váy cực kì xinh luôn shop ơi vải dày dặn lắm nha
5,tốt chất lượng đẹp lắm á mua tặng sinh nhật người yêu phải gọi hết nước chấm
5,được đẹp huhuhu mình tưởng mk đặt cái này áo rồi nhưng mà kp huhuh
5,hàng đẹp y hình rất xuất sắc cảm ơn shop
5,được
5,giao hàng nhanh vật liệu mềm không nếp nhăn đề nghị
5,đầm bền với đường may chắc chắn váy đa năng cho các dịp khác nhau đầm bền với đường may chắc chắn
5,kiểu đầm xoè tôn dáng dễ dàng mặc phối đồ kiểu dáng tôn dáng cho mọi vóc dáng thiết kế thời trang phong cách
5,dễ dàng mặc phối đồ đầm bền với đường may chắc chắn thiết kế thời trang phong cách phù hợp với vóc dáng cỡ lớn
5,không rơi vải rất tốt
5,chất liệu siêu vừa ý luôn sản phẩn rất ổn hơn nhiều so với giá đóng gói giao hàng nhanh rất thích
5,nên mua
5,đẹp lắm luôn ôm body vòng nào ra vòng đó
5,áo rất ok nên mua
5,đẹp ôm sát người
5,vải hơi mỏng màu đen chắc không sao bầu nên mặc mát cũng được
4,rộng quá
5,thiết kế không tay đáng yêu mẫu hoa đẹp hoàn hảo cho mùa xuân mùa hè
5,chất liệu lanh
5,đặt đồ vừa rẻ vừa được tặng quà ưng hết sức
4,mặc vừa vì hàng giãn nhưng xòe ít hơn với hình ảnh quảng cáo giá này dùng tạm
5,hàng dày chất thun không phải voan hoa giống hình nhưng không xoè bằng ảnh
5,vải mỏng không chỉ thừa màu ở hình mình chụp bị nhạt hơn ở ngoài vải ở ngoài cũng nhạt hơn trong hình mẫu mặc nhé
5,rất đẹp chất vải đẹp
5,đam rất đẹp mua được giá rẻ nữa cả on shop
5,hình ảnh mang tính chất minh họa shop giao hàng nhanh áo vải đẹp
5,rất đẹp nên mua
5,sản phẩm giống y hình
5,từ ngày biết tới shop này hao ví lắm luôn bán đồ đẹp lại rẻ nữa mình rất ưng ý vải siêu đẹp mặc lên xinh xỉu lại tôn dáng
5,đầm xinh mặc vừa giá cũng rẻ nói chung ok lắm shop tư vấn nhiệt tình giao hàng lẹ 10đ
5,chất liệu mỏng kém chất lượng với mức giá này tổng thể ok cho mặc giản dị
5,vật liệu mềm mại thoải mái
5,giao hàng siêu nhanh dịch vụ siêu tốt sẽ trở lại
5,hàng đến giao hàng nhanh hoàn tiền cho người bán
5,không đẹp giá trên lazada khá cao so với hàng việt nam cân nhắc khi mua
5,váy xinh lắm nha shop váy giống như trong hình ạ váy mới mua đem đi giặt không ảnh nên lấy ảnh khác
5,đầm đẹp mẫu đi hình giá rẻ nữa mọi người nên mua nè
5,giao hàng nhanh đúng hàng đúng mẫu đẹp tuyệt vời cho 5 sao
5,dễ thương giá cả vậy hợp lí chắc vải thun co giãn mặc thoải mái lần đầu mua ở shop cũng ưng bụng kkkk
5,đầm rẻ quá đẹp
5,chất vải không đẹp lắm cổ may hơi lệch dáng suông không đẹp như mẫu
5,chất rất đẹp hợp giá tiền sz thoải mái rất vừa vặn shop ship siêu nhanh
4,chất liệu mát thì mát nhưng đường may hơi xấu rút nói chung không ưng lắm
5,váy áo sơ mi thời trang bông mềm mại thoải mái
5,rất dài
5,họa tiết trơn phong cách họa tiết trơn phong cách
1,pha ke thấy gớm
5,thun cotton nhưng mà mình không hài lòng một điểm ở tay bị rách hơi nhiều chỉ thừa vẫn ai thích mặc ôm thì lẽ ổn còn ai thích rộng thì nên cân nhắc
5,kiểu dáng giao hàng nhanh hành y hình chất vải dầy dặn đóng gói tốt
5,lần này mua cho nhỏ em gái nó thích lắm luôn ý shop bán đồ rẻ mà xinh nhamang
5,đầm đẹp lắm í ưng quá trời luôn lần sau ủng hộ shop tiếp nha chú ship cx thân thiện nửa xứng đáng 5 sao
5,mua 2 lần ổn nhà
3,giống hình
5,thiết kế thanh lịch nữ tính họa tiết chấm bi đẹp nhẹ nhàng thoáng khí váy đa năng phù hợp cho mọi dịp
