rating,review
5,lý tưởng cho việc mặc hàng ngày lý tưởng cho việc mặc hàng ngày vải thoáng khí thoải mái vải thoáng khí thoải mái
5,vừa vặn
5,chất lượng tốt công việc tốt giá rẻ giao hàng được coi nhanh chóng bởi vì vận chuyển từ nước ngoài phải mất thời gian
3,giao số lượng đủ đúng màu tuy nhiên sản phẩm vải mỏng quá mà ghi mặc đi làm công sở không được mọi người cân nhắc mua á
5,mỏng như giấy dán tường thật vải này không biết mặc được mấy lần không mua lần 2
5,giao hàng nhanh chóng dễ chịu hàng chất lượng phù hợp với giá mua
5,vải rất mỏng màu chưa đúng như màu quảng cáo chưa đúng với gì mong đợi tạm bằng lòng
5,phong cách chất liệu cao cấp cho độ bền chất liệu mềm mịn mang lại sự thoải mái giá trị tuyệt vời cho giá cả thiết kế ống rộng cho vẻ ngoài thời trang
5,chất liệu cao cấp cho độ bền vải thoải mái nhẹ giá trị tuyệt vời cho giá cả chất liệu mềm mịn mang lại sự thoải mái
5,thiết kế phong cách với họa tiết sọc hoàn hảo cho các hoạt động thể thao yêu thích chất liệu thoải mái này vải thoáng khí giữ cho bạn mát mẻ
5,hàng khá ok sẽ mua lần sau nữa shop phục vụ tốt shipper thân thiện
5,quần dày dặn nha mà lớp lót nỉ nên hơi nóng mặc mùa lạnh lẽ ok
5,đáng tiền nhất mình từng mua trên mạng chất nỉ dày giữ nhiệt tốt form dáng chuẩn đường máy kỹ shop giao hàng nhanh đóng gói cẩn thận
5,mua đồ trên mạng hơi bị sợ mà may quá cũng ưng ý chất liệu đẹp mặc cũng ổn đẹp phết mình mặc mọi người đều khen chấm 10 điểm giao nhanh
5,chất liệu vải mềm mịn đẹp
5,chất liệu dày dặn bền bỉ đa năng thoải mái túi hộp tiện lợi
5,đường may chắc chắn thiết kế 6 nút thời trang dáng rộng thoải mái phù hợp cho mọi mùa
5,thiết kế ống rộng đường may chắc chắn thiết kế 6 nút thời trang chất liệu kaki bền
5,màu khaki tạo điểm nhấn thời thượng màu khaki tạo điểm nhấn thời thượng màu khaki tạo điểm nhấn thời thượng màu khaki tạo điểm nhấn thời thượng màu khaki tạo điểm nhấn thời thượng
5,hoàn hảo cho mùa hè quần ống rộng thời trang đa dụng phổ biến
5,dây thắt lưng co giãn cho sự vừa vặn thoải mái quần short đa năng cho nhiều dịp khác nhau
5,dễ dàng kết hợp với các trang phục khác nhau dễ dàng kết hợp với các trang phục khác nhau
5,tuyệt vời cho người yêu bóng rổ hoàn hảo cho ngày hè nóng bức
5,vải hơi dày chất lượng tạm ổn số với giá tiền mặc rồi sẽ đánh giá tiếp
5,dễ dàng kết hợp với các trang phục khác nhau
5,quần ngắn hơn 6cm so với bảng sai số chất thì quá mỏng không giống ảnh của shop đưa lên xấu tệ không nên mua nhé
5,tiền nào của đó form quần giống trong hình nhưng không thoải mái khi mặc
5,hoàn hảo cho mặc hàng ngày bền không phai màu chất liệu thoáng khí nhẹ nhàng đa dạng dễ phối đồ giá trị tuyệt vời cho giá tiền hoàn hảo cho vẻ ngoài thể thao thông thường
5,độ bền phù hợp cho mùa hè sự thoải mái hoàn hảo cho trang phục làm việc thường ngày phong cách thiết kế phong cách đơn giản
5,hoàn hảo cho công việc hoặc các dịp thường ngày hoàn hảo cho công việc hoặc các dịp thường ngày chất liệu chất lượng cao dễ kết hợp với các loại áo khác nhau quần làm việc tuyệt vời cho công trường xây dựng
4,túi quần may âu quá vừa vặn hoàn hảo với dây rút thể điều chỉnh vừa vặn hoàn hảo với dây rút thể điều chỉnh khóa kéo tiện lợi
5,lý tưởng cho thanh thiếu niên tuổi trẻ lý tưởng cho mặc trong mùa hè dễ dàng kết hợp với nhiều trang phục khác nhau chỉ tiếc mình vải hội mỏng
5,quần jogger thời trang giặt mau khô mặc thời tiết lạnh ok lắm nha
5,chất lượng vừa phải giá trị tốt cho tiền giao hàng nhanh gói vừa phải
5,đa dụng cho mặc hàng ngày lý tưởng cho thời tiết nóng phù hợp cho nhiều dịp chi tiết lưới thông thoáng
5,thích hợp cho không khí nóng
5,hàng đẹp chất lượng giá cả ổn giao hàng hơi lâu nhưng nhận hàng rất đẹp
5,tay nghề xuất sắc thiết kế chân rộng thoải mái quần yếm phong cách nhật bản cổ điển thoải mái hợp thời trang đa năng dễ dàng tạo kiểu
5,chiều cao cân nặng quần đẹp mặc rộng rãi thoải mái ok
5,quần mặc thoải mái vải hơi ráp shop chuẩn bị hàng nhanh nhưng bên ship hơi bất ổn
5,mát mẻ thoải mái trong thời tiết nóng thiết kế đơn giản thời trang thoải mái lựa chọn màu vàng độc đáo
5,hàng cũng tạm ổn nha mọi người tiền nào của đó thôi cá nhân tui thấy vải nóng í đáy hơi phồng nhìn ngộ ngộ sao í
5,lựa chọn màu vàng độc đáo thời trang thoải mái chất liệu denim cao cấp thiết kế đơn giản mát mẻ thoải mái trong thời tiết nóng
5,sự thoải mái vừa vặn đẹp chất lượng số với giá mua giao hàng nhanh nhân viên giao hàng tốt
5,vl
5,tạm được đồ máy đường chỉ ẩu quá
5,chất liệu dày dặn bền bỉ đa năng thoải mái túi hộp tiện lợi
5,quần không túi sau túi hộp túi chéo nông không đủ sâu
5,yêu nó thoải mái phù hợp cạnh eo đàn hồi dễ dàng chăm sóc bảo trì bền lâu dài bền lâu dài thiết kế thoải mái phong cách
5,màu đen trông đẹp sành điệu đáng giá màu đen trông đẹp sành điệu đáng giá màu đen trông đẹp sành điệu đáng giá màu đen trông đẹp sành điệu đáng giá màu đen trông đẹp phong cách đáng giá
5,vải mỏng thoải mái
5,quần ok
5,hàng đẹp đúng như hình 5 sao
4,thiết kế phong cách đơn giản món quà hoàn hảo cho gia đình bạn bè dễ dàng phối với bất kỳ trang phục nào
5,lựa chọn tuyệt vời cho nam thanh niên vừa vặn thông thường cho vẻ ngoài thoải mái họa tiết logo thêm nét thời trang
5,hoàn hảo cho các buổi đi chơi bình thường họa tiết logo thêm nét thời trang đa năng dễ dàng tạo kiểu
5,thiết kế thời trang phổ biến phù hợp cho mùa hè lựa chọn tuyệt vời cho nam thanh niên phù hợp cho mùa hè lựa chọn tuyệt vời cho nam thanh niên
5,hoàn hảo cho các buổi tập gym logo reebok phong cách thiết kế thời trang hợp xu hướng
5,túi khóa kéo tiện lợi thiết kế thời trang hợp xu hướng vải co giãn bền
5,lý tưởng cho các hoạt động thể thao lý tưởng cho các hoạt động thể thao
4,vải mỏng giá tiền rẻ đi theo chất lượng mặc tạm thôi không được dày dặn lắm
5,vải thường màu không hẳn đen nó xám xám
5,phù hợp cho nam trung niên dây chun co giãn tạo sự thoải mái dây chun co giãn tạo sự thoải mái
5,tốt đẹp ok cho 5 sao
5,giá trị lớn cho tiền
5,vải co giãn cho vừa vặn hoàn hảo thoải mái khi mặc cả ngày giá trị tuyệt vời cho giá cả
5,giá trị tuyệt vời cho giá cả cạp cao thoải mái hình dáng tôn dáng phong cách
5,chất liệu khá ổn 1m70 nhưng ống quần hơi rộng nhưng bù lại hơi ngắn nữa
5,phù hợp tuyệt vời cảm thấy thoải mái vật liệu khô nhanh
5,vải khô nhanh phong cách chức năng tuyệt vời cho người bơi lội năng động
5,chất liệu nỉ
5,chất liệu không rõ lắm không được mềm mại như cotton cưng
5,thời trang hàn quốc thời thượng phù hợp cho mọi dịp chất liệu cao cấp phù hợp cho mọi dịp
5,chất liệu cao cấp phù hợp cho mọi dịp chất liệu cao cấp chất liệu cao cấp
5,đặt được quần mặc vừa khít không thừa thiếu tý nào chất vải cũng đẹp nữa sẽ ủng hộ shop lần sau
5,chất vải mát mềm
5,nó to lắm á tui mập tui mua to nhất mà vẫn thấy nó rộng vải này mỏng mát lắm á nên mua thử
5,phong cách quần short đa năng cho nhiều dịp khác nhau vừa vặn hoàn hảo cho các buổi đi chơi bình thường lựa chọn tuyệt vời cho thời trang mùa hè thiết kế in hình hoạt hình độc đáo vải chất lượng cao dáng rộng để tăng thêm sự thoải mái đúng mà cũng không đúng mẫu hoàn hảo cho các buổi đi chơi bình thường
5,hoàn hảo cho các buổi đi chơi thường ngày lựa chọn tuyệt vời cho thời trang mùa hè độ rộng vừa phải mang lại sự thoải mái quần short thời trang thoải mái
5,giá trị tuyệt vời cho giá tiền lựa chọn tuyệt vời cho thời trang mùa hè quần short thời trang thoải mái
5,chất liệu khá ổn 1m70 nhưng ống quần hơi rộng nhưng bù lại hơi ngắn nữa
5,được nhưng vải hơi mỏng
5,giao hàng nhanh đóng gói cẩn thận giá rẻ hàng tốt 5
5,quần đẹp may chắc chắn với giá tiền này thì quá rẻ cảm ơn shop chúc shop bán hàng may mắn lưu ý người mua nên giảm đi một sai thì ok
5,hu hu sai lớn quá ùi người 70kg cao 1m70 thì nên lấy l được ui nhé mấy a e chứ lấy xl lớn lắm trước khi gửi mong shop tư vấn dùm nhé shop nước ngoài gửi tới mình nhận khá lâu
5,hàng nhanh
4,chất liệu vãi hơi mỏng tí nhưng ok
5,hàng không đúng với mẫu quá tệ
5,giá trị tuyệt vời cho giá thành giao hàng nhanh chóng đóng gói cẩn thận quần short linh hoạt cho mọi dịp dễ dàng kết hợp với nhiều trang phục khác nhau tặng shop 5
5,vừa vặn thoải mái chất lượng tuyệt vời giá trị tuyệt vời cho giá thành
5,ok phù hơp với giá thành
5,nhận hàng từ shop rất nhanh rất tuyệt vời chúc shop luôn đông khách
5,em mua lần này lần thứ 5 rồi ạ mọi người nên mua nha vải mềm đẹp mặc thoải mái lần sau sẽ ủng hộ tiếp
5,chất liệu mượt mà nhẹ nhàng chất liệu mượt mà nhẹ nhàng vải thoáng mát thoải mái
5,hàng giống hình form hơi rộng nên ai không thích form rộng thì không nên mua mặc thoải mái hoàn hảo cho các hoạt động thể thao phù hợp với nhiều loại cơ thể
5,tạm được
5,thiết kế thời trang với ba sọc phù hợp với nhiều loại cơ thể phù hợp hoàn hảo cho các buổi tập luyện
5,hoàn hảo cho các hoạt động thể thao thoải mái phong cách phù hợp với nhiều loại cơ thể lý tưởng cho cả trường học tập thể dục
1,không nên mua
5,vừa vặn tạo dáng thon gọn chất liệu chất lượng cao
5,chiều dài phù hợp với mắt cá chân lý tưởng cho trang phục hàng ngày vải mềm mại thoải mái thiết kế hiện đại thời thượng
5,đồ giống mô tả đóng gói kĩ giao hàng nhanh sẽ ủng hộ tiếp
5,quần thời trang thoải mái lý tưởng cho trang phục thường ngày vật liệu chất lượng cao phù hợp cho mọi mùa
5,đa năng dễ dàng tạo kiểu vật liệu chất lượng cao vật liệu chất lượng cao hoàn hảo cho các hoạt động ngoài trời
5,thiết kế thời trang hợp xu hướng thiết kế thời trang hợp xu hướng đa năng dễ dàng tạo kiểu đa năng dễ dàng tạo kiểu đa năng dễ dàng tạo kiểu thiết kế thời trang hợp xu hướng thiết kế thời trang hợp xu hướng
5,thời trang thoải mái vừa vặn co dãn tốt vải nhanh khô nhẹ thoáng khí thiết kế linh hoạt cho mọi dịp hoàn hảo cho mùa hè chất liệu cao cấp ảnh không liên quan
5,chất liệu không ưng lắm khoá mới khéo 1 lần hỏng nhưng với giá tiền này thì mình cũng không dám đòi hỏi quá nhiều ảnh mang tính chất nhận xu
5,đơn giản thanh lịch thời trang thoải mái thiết kế linh hoạt cho mọi dịp vừa vặn co dãn tốt
5,chất liệu dày dặn bền bỉ
5,shop giao hàng nhanh giá cả hợp lí ạ
1,hàng không giống mô tả không co giãn được mặc chật không thể mặc được
5,ok mua lần hai chuẩn như hình ảnh quảng cáo
5,nhận hàng đúng màu chất vải tẩm ổn mình mặc xl hơi bé
5,hoàn hảo cho các dịp bình thường trang trọng
5,kiểu dáng thời trang trẻ trung
5,vải chất lượng cao để bền chất liệu nhẹ thoáng khí hoàn hảo cho thể thao hoạt động ngoài trời vải nhanh khô một điểm cộng
1,nói nói chung không giống quảng cáo sự thật thì xấu rất xấu khi nhận được hàng cảm thấy vô cùng thất vọng như mình bị lừa
5,quần short thời trang hợp mốt quần short đa năng cho các dịp khác nhau quần short đa năng cho các dịp khác nhau
5,tất cả đều tốt
5,hoàn hảo cho thể thao giải trí tuyệt vời cho cả nam nữ vừa vặn hoàn hảo với eo co giãn
5,chất liệu vải chất lượng cao phù hợp cho cả bé trai bé gái sự thoải mái thiết kế đơn giản thanh lịch vừa vặn phong cách hợp thời trang
5,ổn
5,vải mỏng lắm nha thiết kế ống rộng cho vẻ ngoài thời trang đơn giản nhưng thời trang hình ảnh chỉ mang tính chất nhận xu
3,vải không đứng như mẫu mặc nhìn giống quần mặc ở nhà hơn lười trả hàng nên nhận luôn
5,hàng ok tưởng giao lâu
5,hình ảnh đúng mẫu nhưng chê nha quần vải mỏng bóng giặt để lên sào khi quần khô mỏng thấy xuyên suốt
5,quần đẹp y như hình co giản thoải mái
5,quần đẹp chất vải co giãn tốt mặc rất thích rất hài lòng với shop nha dịp sẽ ủng hộ shop
5,hoàn hảo cho các chuyến đi chơi mùa hè dây thắt lưng co giãn cho sự vừa vặn hoàn hảo
5,hoàn hảo cho thời tiết lạnh hơn giá trị tuyệt vời cho giá cả
5,quần short kaki chất lượng cao thiết kế ôm sát chất liệu kaki co giãn thoải mái khi mặc cả ngày cảm ơn do man rất nhiều
5,chất liệu kaki co giãn thoải mái khi mặc cả ngày giá trị tuyệt vời cho giá cả phiên bản nâng cấp phong cách
5,vải khá tệ giặt 1 lần bạc màu form không được đẹp
5,chất lượng tuyệt vời chất lượng tuyệt vời chất lượng tuyệt vời chất lượng tuyệt vời chất lượng tuyệt vời chất lượng tuyệt vời
5,chất lượng tuyệt vời chất lượng tuyệt vời chất lượng tuyệt vời chất lượng tuyệt vời chất lượng tuyệt vời chất lượng tuyệt vời
5,vừa vặn hoàn hảo cho vẻ ngoài thời thượng chất liệu mềm mịn co giãn bền lâu bền
5,quần short thời trang thoải mái thoải mái khi mặc suốt ngày
5,hàng đẹp giá rẻ hơn thị trường rất nhiêu mọi người nên mua ạ
5,sự thoải mái
5,lý tưởng cho cả nam nữ lý tưởng cho cả nam nữ phong cách thời trang hiện đại phong cách thời trang hiện đại phong cách thời trang hiện đại phong cách thời trang hiện đại
5,chất nỉ bông không gạch ngang như hình nha giãn tốt rẻ
4,quần vậy rồi phản quang ở đâu sai mẫu ròi mà cũng may mặc được shipper ok giao hàng nhanh cho shop 4sao
5,chất liệu mượt mà nhẹ nhàng chất liệu mượt mà nhẹ nhàng vải thoáng mát thoải mái
5,giao hàng nhanh đúng quảng cáo
5,vật liệu chất lượng cao vừa vặn hoàn hảo thời trang thoải mái hoàn hảo cho mọi dịp vải co giãn linh hoạt
5,vải quần mỏng đường may đẹp kiểu dáng phù hợp không co dãn lắm phù hợp với giá tiền
5,quần vải mỏng chất lượng hợp giá tiền ra màu hàng quốc tế nên hơi lâu hình ảnh mang tính chất nhận xu
5,nhận hàng đúng màu mình đặt vải mền độ giãn nhẹ với số tiền bỏ ra thì nhận được quần như vậy ok
5,rất phù hợp cho tập luyện chiều dài hoàn hảo cho một cái nhìn hợp thời trang thiết kế thời trang cho một cái nhìn thể thao lý tưởng cho chạy chạy bộ
5,giao hàng nhanh sẽ ủng hộ tiếp vào lần tới hình ảnh chỉ minh hoạ
5,thiết kế phong cách hợp thời trang giá trị tuyệt vời cho giá cả vừa vặn thoải mái cho mọi mùa
5,bền lâu dài dễ dàng phối với các trang phục khác vừa vặn thoải mái cho mọi mùa
5,thích hợp cho mặc hàng ngày thể thao túi thuận tiện để lưu trữ sử dụng bền lâu dài tay nghề chất lượng cao
5,quần short thời trang thoải mái phong cách đơn giản tối giản phong cách đơn giản tối giản vải nhanh khô một điểm cộng quần short thời trang thoải mái
5,quần không chất lượng để bán trên mall mình hay mua ở cửa hàng mall vì nghĩ chất lượng hơn các shop bình thường thất vọng không biết loại vải gì lun tua vải sau 1 lần giặt
5,hoàn hảo cho trang phục mùa hè phong cách đơn giản tối giản
5,phù hợp tuyệt vời phong cách mỏng lỏng lẻo quần short đa năng cho mặc giản dị vải khô nhanh một lợi thế
5,ôm vừa vặn thoải mái ôm vừa vặn thoải mái giá trị tuyệt vời cho giá tiền lý tưởng cho các hoạt động thể thao
5,thời trang thoải mái thiết kế đa năng cho cả nam nữ hoàn hảo cho việc mặc hàng ngày
5,dày dặn hợp với chất lượng
5,nói chung tiền nào của đó hình ảnh mang tính chất minh họa thôi
5,dễ dàng so sánh với quần áo khác vật liệu chất lượng cao cho độ bền dịp không mặc giá trị đồng tiền
5,dễ dàng để so sánh với quần áo khác chọn để mặc vào một dịp không ăn mặc quần short phong cách thanh lịch thoải mái
5,đặt hàng 5 mặt hàng chỉ nhận được 4 mặt hàng không hoàn thành số lượng vải may chất lượng kém
5,hàng đúng quảng cáo chất liệu mát dùng tốt trong tầm giá mọi người nên mua
5,nhận hàng ok tặng shop năm sao hài lòng
5,dễ dàng kết hợp với bất kỳ trang phục nào thoải mái khi đeo cả ngày hoàn hảo cho các chuyến đi biển quần short thời trang phong cách đường phố màu xanh rêu thời trang
5,vải mát mẻ thoải mái quần short đa năng cho mọi dịp dễ dàng kết hợp với bất kỳ trang phục nào thoải mái khi đeo cả ngày vải rất mỏng nha
5,thiết kế chân rộng hợp thời trang vải thoáng khí eo cao cho một cái nhìn tâng bốc
5,thiết kế đơn giản phong cách vải cotton thoải mái dễ dàng kết hợp với nhiều loại áo khác nhau quần ống rộng thoải mái
5,màu khaki tạo điểm nhấn thời thượng dễ dàng kết hợp với nhiều loại áo khác nhau mát mẻ thoáng khí cho mùa hè vải cotton thoải mái hoàn hảo cho các dịp bình thường lựa chọn tuyệt vời cho phụ nữ ngoại cỡ
5,kiểu dáng đẹp chất liệu vải oki chất lượng phù hợp với giá tiền 5 sao
5,chưa mặc chưa biết như thế nào hàng đẹp
5,vừa vặn thoải mái rộng rãi chất liệu nhẹ thoáng khí dễ dàng kết hợp với các trang phục khác nhau vải nhanh khô cho ngày hè nóng bức
5,hoàn hảo cho thể thao hoạt động ngoài trời chất lượng tuyệt vời với giá cả phải chăng vải mịn mềm
5,chiều cao cân nặng chất vải pha nilon ít nhẵn đường chỉ khá tốt sờ chất vải khá mát hình in nhiệt nên bảo quản phải cận thận
5,chất lượng tuyệt vời với giá cả phải chăng dễ dàng kết hợp với các trang phục khác nhau vải nhanh khô cho ngày hè nóng bức
5,hoàn hảo cho mùa hè thoải mái với kiểu dáng rộng rãi quần short đi biển thời trang
5,sự thoải mái vải mềm
5,ok hàng đúng như quảng cáo ok hàng đúng như quảng cáo tặng shop 5sao
5,đa năng thời trang chất liệu cao cấp bền lâu bền giá trị tuyệt vời cho tiền chuyên nghiệp thanh lịch
5,cửa hàng này ok chất lượng tốt giao hàng nhanh đóng gói tốt rất tốt chắc chắn sẽ trợ cấp cho cửa hàng này cảm ơn bạn rất nhiều
5,giao hàng nhanh
5,hoàn hảo cho trang phục thường ngày hợp thời trang hoàn hảo cho trang phục thường ngày hợp thời trang
5,quần đẹp lắm nhé giá còn mềm hơn nhiều so với shop khác shop làm việc nhanh chóngg rất đáng 5 saoo
5,hoàn hảo cho trang phục thường ngày hợp thời trang
5,quân theo ảnh nắp tui sau thưc tế thì không
5,chất liệu ok
5,vải bền chắc cho mặc hàng ngày thích hợp cho các buổi dạo chơi mùa hè dễ dàng kết hợp với các trang phục khác nhau
5,bán đổ đểu toàn lừa đảo thôi quần l quá đểu số vớ tiến mua
5,thoải mái ok vừa vặn ok độ bền chưa biết
5,chất liệu vải thoáng khí thoải mái thiết kế in hình độc đáo thời trang
5,hàng dày dặn vừa đẹp phù hợp quần jean thời trang thoải mái form suông thoải mái cho việc mặc cả ngày kỹ thuật tuyệt vời chú trọng đến chi tiết màu đen cổ điển cho diện mạo bất hủ kỹ thuật tuyệt vời chú trọng đến chi tiết thiết kế ống rộng thời thượng quần jean chất lượng cao với giá cả phải chăng quần jean chất lượng cao với giá cả phải chăng vừa vặn hoàn hảo chất lượng tuyệt vời quần jean linh hoạt cho mọi dịp
5,cao 1m63 nặng 55kg mặc 29 vừa y nè giao hàng cực nhanh phần cạp nó hơi ngắn so với tưởng tượng của tui còn lại thì chất đẹp dáng lên ổn lắm
5,quần được may cẩn thận chắc chắn đường chỉ đều đẹp lên form rất vừa vặn dáng baggy suông mặc hack dáng tốt giao hàng nhanh shop tư vấn nhiệt tình
5,chất lượng tốt giá rẻ đây một trăm sao để đi đến ngôi sao để được nó đến 100 điểm đầy đủ 5 sao
5,gói chất lượng tốt của hộp giao hàng tốt với cửa hàng này trong một thời gian dài cửa hàng này chưa bao giờ thất vọng
5,chất liệu hàng ok xin cảm ơn nhiều nhiều lắm đó mai mốt sẽ mua thêm nữa nhé
5,chất liệu mỏng
5,màu giặt trung bình trông hợp thời trang vải co giãn tốt giá trị tuyệt vời cho giá cả
5,chiều cao cân nặng đẹp
5,chất vải xịn sò lắm quần form đẹp
5,hàng không đúng sai đặt 34 mà sai thật chỉ 30 yêu cầu trả hàng
5,quần kaki pha poly hơi mỏng mềm ống nhỏ nhiều chỉ thừa không quá rộng co giãn đùi to nên cân nhắc
5,chất liệu nhẹ thoải mái phù hợp cho cả nam nữ kiểu quần ống rộng mang lại vẻ ngoài thời trang
5,giao nhầm màu
3,nhận hàng hơi thất vọng chờ giao hàng lâu không giống quảng cáo
5,vải hơi mỏng chút giao hàng nhanh nhìn mẫu đẹp ship thân thiện vui tính
5,chất liệu nhanh khô điểm cộng chất liệu mềm mại thoáng khí chất liệu nhanh khô điểm cộng chất liệu mềm mại thoáng khí
5,quần jean nam màu xanh dương đẹp lắm xai 36 to lắm không biết mặc vừa không nữa
5,thiết kế rộng rãi thời trang vải denim chất lượng cao giá trị tuyệt vời cho giá cả bền không phai màu
5,bền không phai màu 
5,vải thoáng khí cho thông gió tốt hơn vừa vặn tuyệt vời đa năng cho các môn thể thao khác nhau
5,các mặt hàng nhận được hôm nay đóng gói đẹp chất liệu tốt sẽ kiểm tra nếu hàng hóa sẽ mua lại
5,chất liệu
5,vải ok mặc đẹp rộng giãn thoáng mát cho shop 5 sao
5,chất liệu
5,hang tốt thì mình thấy nó cũng thể làm được gì cho nó lành bác chém gió thì
5,hàng ok nha bạn mình cũng thể làm được gì cho nó lành bác sơn tùng
5,chất lượng tốt giá rẻ đây một trăm sao để đi đến ngôi sao để được nó đến 100 điểm đầy đủ 5 sao
5,thoải mái khi mặc cả ngày lý tưởng cho các hoạt động thể thao vải co giãn cao
5,thoải mái khi mặc suốt cả ngày tính nhanh khô ấn tượng tính nhanh khô ấn tượng
5,độ bền tốt thoải mái thoải mái vừa vặn giao hàng nhanh chóng
5,vải mỏng như quần mặc thể dục
