rating,review
4,shop giao hàng nhanh đóng gói cẩn thận áo cũng được đẹp nhưng không được dày quá mặc không ấm cho lắm phải mặc thêm áo khoác bên ngoài mới giữ được ấm
4,vỏ nhìn vẻ rất môi trường cute nhé cơ mà mã qr nhưng dùng zalo hay wechat đều không thể quét ra được không biết phải hàng pha ke khum
4,nón phong cách phù hợp đi biển nhưng dễ bám bẩn
4,khá hài lòng nhưng mắc dù áo hơi bánh bèo không đúng phong cách của mình lắm
4,hàng ổn trong tầm giá
4,hàng đúng nhưng nhận hơi lâu
4,quần hơi cứng
4,màu nó bị sao ý hình như không phải màu trắng nhìn ở ngoài cũng không phải màu xám
4,áo mặc ổn chất hơi nóng chút xíu nhưng dày bền cũng không quá khó chịu túi ngực tiện để đồ chống được nước nhẹ nên thể dùng để đi mưa nhỏ
4,hàng khá ok
4,kính đẹp chống nắng tốt nhưng tròng kính hơi dễ trầy
4,ok trong tam gia giao hang dung henda 10 tran ghi 12 ban ok
4,hơi xỉn màu
4,giày thì cx đẹp độ bền chưa bt nhưng giây giày hơi ngắn
4,hàng ổn trong tầm giá
4,shop giao hàng khá nhanh áo vải gió mỏng nhưng sẽ hơi nóng còn khá nhiều chỉ thừa chất lượng như vậy so với giá tiền khá phù hợp
5,hoàn hảo cho trang phục thường ngày hợp thời trang hoàn hảo cho trang phục thường ngày hợp thời trang
5,thoải mái cho các hoạt động giải trí ngoài trời
5,mua lần thứ 2 rất ưng hài lòng hàng xịn sò nhưng áp voucher nên giá rất tốt sẽ ủng hộ shop lâu dài hàng giao nhanh đẹp giá đang đc seo nên mua đc rẻ quá cảm ơn shop mọi người nên mua ạ sẽ ủng hộ shop tiếp
5,áo đẹp xịn cực luôn cảm ơn shop nhiều nha ủng hộ shop dài dài ạ
5,cổ áo polo cổ điển vải hơi mỏng tí nhưng mặc lên form đẹp nói chung ok
5,phù hợp cho mọi dịp dễ dàng phối đồ linh hoạt thiết kế thời trang phong cách thời trang hàn quốc chất lượng
5,ok hàng đúng như quảng cáo ok hàng đúng như quảng cáo tặng shop 5sao
5,giá trị tuyệt vời cho giá cả hoàn hảo cho mọi dịp trang trí phong cách với stick dễ thương vật liệu chất lượng cho độ bền thiết kế dễ thương hợp thời trang thoải mái mặc quanh năm dễ dàng kết hợp với các trang phục khác nhau tùy chọn màu nâu đa năng
5,thoải mái thoáng khí chi tiết thêu tinh xảo hoàn hảo cho trang phục hàng ngày thiết kế cổ tròn thời trang hoàn hảo cho trang phục hàng ngày
5,quần siêu mỏng nhìn bên đây thấy bên kia vải nhanh khô tiện dụng chất liệu nhẹ thoáng khí
5,dễ phối với nhiều trang phục khác nhau xu hướng nổi tiếng trên mạng xã hội thoải mái khi mang xu hướng nổi tiếng trên mạng xã hội
5,vật liệu cotton chất lượng cao thiết kế thời trang cho đứa trẻ nhỏ màu xanh lá cây nâu đẹp mắt
5,màu vàng thời trang giao hàng nhanh chóng chất liệu denim bền thiết kế ống rộng màu vàng thời trang
5,người việt nên ủng hộ hàng việt chất vải oki săn đc hàng giá rẻ quá chừng nchung ưng hết sức sẽ lại ủng hộ shop
5,vật liệu nhanh khô thoải mái thời trang thiết kế bền chắc phong cách đa dụng cho mọi ngày
5,hàng nhìn đẹp hàng đầy đủ mà giá lại rẻ tuyệt vời
5,nhìn cũng đẹp nhưg thuộc dạg siêu siêu mỏng vải nhanh khô tiện dụng thoải mái suốt cả ngày
5,cung cấp độ ẩm lâu dài nuôi dưỡng làm sống lại làn da thẩm thấu nhanh vào da nhẹ nhàng không nhờn
5,oke đẹp giống như quảng cáo xin cảm ơn shop
5,hoàn hảo cho các hoạt động ngoài trời bền lâu dài vật liệu thoáng khí giúp bạn mát mẻ vành rộng cung cấp bóng mát tuyệt vời
5,dễ mặc phù hợp với nhiều dịp chất liệu vải cao cấp
5,đầm xoè chất umi dày dặn đẹp vải umi mềm mịn kèm gắn cổ đầm túi dáng dài qua gối che khuyết điểm chân nên mua nha mọi người
5,đầm chất vải cũng được nhưng đầm nhìn rất nhỏ nhờ vải thun giãn nhiều nên mặc cũng được nói chung giá này thì ok rồi không đò hỏi hơn
5,hoàn hảo cho lối sống năng động hoàn hảo cho lối sống năng động chất lượng tuyệt vời với giá cả phải chăng
5,rất ok sẽ ủng hộ shop tiếp
5,hoàn hảo cho các hoạt động ngoài trời
5,chat lieu vai wa te khuyen shop dang hinh anh len dung voi thuc te nha te wa
5,thoáng khí nhẹ nhàng thiết kế camo thời trang thiết kế unisex dành cho cả nam nữ
5,dễ dàng kết hợp với các trang phục khác nhau thoải mái mặc quanh năm trang trí phong cách với stick dễ thương thoải mái mặc quanh năm dễ dàng kết hợp với các trang phục khác nhau
5,chất liệu cao cấp phong cách đa năng phù hợp cả nam nữ giao hàng nhanh chóng đáng tin cậy
5,đường may chắc chắn ít chỉ thừa nhìn chung với giá 1 trăm mấy mà được chiếc quần như vậy thì quá tốt rồi
5,vật liệu cứng tốt dễ mặc với dây kéo ở cuối quần một số túi zip nhỏ
5,thiết kế mới phong cách thời trang hiện đại
5,chất vải khá ok 1 lớp nhưng không mỏng không lộ mấy
5,váy rất đẹp chất liệu vải rất mềm mại xúc cảm rất tốt đơn giản đáp ứng cũng không thành vấn đề mặc vào liền đặc biệt khí chất độ thoải mái
5,đa năng thời trang chất liệu cao cấp bền lâu bền giá trị tuyệt vời cho tiền chuyên nghiệp thanh lịch
5,thuận tiện dễ mang theo cánh rộng thể điều chỉnh để chống nắng chống tia cực tím hiệu quả thuận tiện dễ mang theo chống tia cực tím hiệu quả thích nó
5,hàng màu đẹp nhung không lì như miêu tả vẫn cho shop 5 sao
5,ổn áp lần đầu mua nên sẽ xem xét lại ủng hộ shop góp ý thêm đồ của shop thể nào lm dịu mùi đồ lại đc không mở ra mùi đồ nồng dạng hắc hắc gây khó chịu
5,đầm thời trang với chi tiết vai đính hạt hoàn hảo cho một buổi tối ra ngoài
5,giao hàng rất nhanh đẹp giống hình giá lại rẻ mọi người mua thì an tâm vì shop làm ăn chuẩn
5,đúng mẫu giao hàng nhanh lần sau ủng hộ shop tiếp tận năm sao
5,nhẹ thoáng khí vừa vặn hoàn hảo chất liệu da bền thiết kế hợp thời trang
5,vận chuyển trong thời gian quy định chất lượng tốt dễ sử dụng
5,nón đẹp nha chất lượng tốt giá cả hợp lí giao hàng nhanh hợp phong cách
5,giày đẹp nhưng shop giao nhầm màu cho mình mình đặt xanh nhưng giao màu nâu
5,quần dài thể thao túi khoá kéo tiện lợi shop nói vải dù nhưng thấy vải hơi giốg quẩn tây hơn giá rẻ nên cũng không biết bền không
5,ok lắm ạ nên mua
5,hoàn hảo cho các hoạt động ngoài trời giao hàng nhanh đóng gói tốt
5,nhận được hàng đóng gói cẩn thận nhìn vẻ chắc chắn chưa sử dụng lúc nào sử dụng sẽ phản hồi nhé
5,mong manh sexy phù hợp với người body đẹp
5,đẹp nha vải dày hình in nét mua đồ bên shop không biết lần thứ bao nhieu luôn nhưng shop này uy tín mẫu nào hot trend đều hết á
5,giao hàng nhanh đồ đẹp hơn so với giá tiền ôm body lắm nên mua 1 chiếc để mặc nhiều dịp
5,áo dày dặn hình in đẹp hoạ tiết dễ thương nên mua nha mọi người
5,đa năng thời trang chất liệu cao cấp bền lâu bền giá trị tuyệt vời cho tiền chuyên nghiệp thanh lịch
5,không hình ảnh của mũ ở đây nên mình dùng tạm mũ này chất dày dặn ok lắm giá rẻ nhất nhưng chất lượng lại ok nhất luôn
5,chiều cao cân nặng nhận hàng hỏi lâu vì hàng nước ngoài chất nỉ dầy dặn tốt giao hàng đúng như hình sẽ ủng hộ tip mọi người nên mua nhe
5,mua lần thứ 2 rất ưng hài lòng hàng xịn sò nhưng áp voucher nên giá rất tốt sẽ ủng hộ shop lâu dài hàng giao nhanh đẹp giá đang đc seo nên mua đc rẻ quá cảm ơn shop mọi người nên mua ạ sẽ ủng hộ shop tiếp
5,xịn mình dùng ok hợp
5,đầm chất vải cũng được nhưng đầm nhìn rất nhỏ nhờ vải thun giãn nhiều nên mặc cũng được nói chung giá này thì ok rồi không đò hỏi hơn
5,thoải mái ngay cả trong ngày bận rộn thoải mái ngay cả trong ngày bận rộn phù hợp cho mùa xuân thiết kế mũi giày nhọn sang trọng tuyệt vời cho giờ làm việc dài
5,quần kaki pha poly hơi mỏng mềm ống nhỏ nhiều chỉ thừa không quá rộng co giãn đùi to nên cân nhắc
5,đẹp chất liệu mịn co dãn tốt thoải mái
5,nhận được hàng đặt từ người bán cảm ơn bạn rất nhiều
5,hàng chính hãng giao cũng khá nhanh đóng gói hànsng cẩn thận hỗ trợ khách hàng nhiệt tình
5,quá đẹp luôn mua đi chờ gì nữa
5,khóa kéo an toàn đáng tin cậy chất liệu cao cấp nhiều ngăn kéo tiện lợi phong cách hàn quốc thời thượng
5,rất đẹp mang vào êm chân vượt qua cả mong đợi đáng mua nha
5,thiết kế hàn quốc sang trọng hoàn hảo cho vẻ ngoài thời trang sang trọng
5,hoàn hảo cho việc sử dụng hàng ngày lựa chọn tuyệt vời cho phong cách tối giản chất liệu da pu mịn
5,vải dày dáng đẹp lắm mọi người nên ủng hộ shop nhé mình sẽ mua thêm màu xanh
5,hàng bên anh chị gửi cho em không phải chiếc quần e đặt
5,thiết kế tai gấu dễ thương
5,phù hợp giá mềm
5,thích dây rút thể điều chỉnh được thiết kế thời trang thực dụng chất liệu thoáng mát thoải mái mũ đa năng dành cho cả nam nữ
5,vải kaki dày form dáng suông không quá rộng
5,hoàn hảo cho lối sống năng động hoàn hảo cho lối sống năng động chất lượng tuyệt vời với giá cả phải chăng
5,quân theo ảnh nắp tui sau thưc tế thì không
5,vật liệu mềm mại thoải mái mũ trùm đầu tiện lợi cho ngày mưa mát mẻ thoải mái thiết kế thêu độc đáo
5,áo ok lắm nha
