rating,review
1,chất liệu đat màu đen giao màu đỏ vải xấu bần tiện chắc chắn ai mua cũng sẽ hối hận
1,kính vừa đeo gãy không đáng tiền
1,giao hàng không như trong hình shop này lừa đảo treo đầu dê bán thịt chó mọi người không nên mua đặt hàng shop này
1,chất lượng tệ không bao giờ mua lại của shop này như kiểu hàng fake ý
1,chất lượng kém bị đứt chỉ 1 đoạn dài đóng gói sơ sài
1,giầy xấu méo tả đk luôn
1,cổ áo bị lỗi
1,shop không trả lời tin nhắn dịch vụ khách hàng rất tệ
1,shop giao sai hàng em nhắn tin shop không trả lời ạ
1,hàng không đúng mẫu không tốt chút nào
1,sai lầm hàng không giống mẫu chất vải siêu xấu giao sai màu không bao giờ lần 2 mọi người không nên mua shop này
1,treo đầu dê bán thịt chó bán 1 đường giao 1 ngõ hàng giao thì không đúng mãi nt shop không trả lời mọi người nên né cái shop này ra tui đặt áo khoác mà giao cái áo thun… tui nhận hàng vì tội a ship bơ gia hàng nắng non… tui chê cái shop này nha shop gì mà tệ hại
1,cũng được giao hàng hơi chậm dịch vụ giao không giao theo giờ hẹn của khách nói tóm lại dịch vụ giao hàng quá tệ
1,mòn mỏi chờ đợi kết quả đây ạ shop làm ăn cái dell nào lại tệ đến vậy phấn phủ đó mà giao cái l gì thế kia mọi người đừng nên mua đồ của shop này
1,không nên mua
1,giao sai màu không giống như mẫu
1,vải thun không phải lụa nhé lừa đảo khách hàng váy xấu tệ
1,chất liệu đat màu đen giao màu đỏ vải xấu bần tiện chắc chắn ai mua cũng sẽ hối hận
1,giao hang sai san pham lua doi khach hang thi danh gia san pham cai gi
1,cũng được giao hàng hơi chậm dịch vụ giao không giao theo giờ hẹn của khách nói tóm lại dịch vụ giao hàng quá tệ
1,chất lượng giày kém mĩnh mua trả lại hàng mở gian hàng chính hãng nhưng lại bán hang gia
1,giao như l vậy đặt áo thun ra áo gì không biết shop làm ăn rất không được kiểu dáng sai chất liệu xấu
1,chất liệu đat màu đen giao màu đỏ vải xấu bần tiện chắc chắn ai mua cũng sẽ hối hận
1,hàng quâ tệ đặt màu đen giao áo nữa màu xanh kiểu dángsai hình
1,chất liệu đat màu đen giao màu đỏ vải xấu bần tiện chắc chắn ai mua cũng sẽ hối hận
1,không thấy hiệu quả chán
1,không thấy hiệu quả chán
1,đặt hàng sai 37 giao 38 không còn dám mua nữa
1,đặt hàng sai 37 giao 38 không còn dám mua nữa
1,chất liệ uvải xấu tệ
1,vải thun không phải lụa nhé lừa đảo khách hàng váy xấu tệ
1,xấu nó vải thun nóng chứ không như mô tả không nên mua
1,sai mấu ib shop k trả lời
1,giầy dỏm không phải hàng fila thất vọng
1,cổ áo bị lỗi
1,giao hang sai san pham lua doi khach hang thi danh gia san pham cai gi
1,chất lượng tệ không bao giờ mua lại của shop này như kiểu hàng fake ý
1,vải thun không phải lụa nhé lừa đảo khách hàng váy xấu tệ
1,sai mấu ib shop k trả lời
1,đặt hàng sai 37 giao 38 không còn dám mua nữa
1,giầy xấu méo tả đk luôn
1,không đáng để mua dù rẻ vì không đúng như quảng cáo
1,sai mấu ib shop k trả lời
1,hàng rất mỏng không đáng đễ bỏ tiền ra mua rất hối hận khi mua giao hàng rất chậm
1,shop giao sai hàng em nhắn tin shop không trả lời ạ
1,đặt đen giao trắng dặn đi dặn lại cũng giao trắng không tôn trọng khách hàng tệ
1,ghi tặng cốc mà giao hàng không cốc shop làm ăn kém uy tín
1,đặt hàng sai 37 giao 38 không còn dám mua nữa
1,chất liệu đat màu đen giao màu đỏ vải xấu bần tiện chắc chắn ai mua cũng sẽ hối hận
1,đặt hàng sai 37 giao 38 không còn dám mua nữa
1,chất lượng giày kém mĩnh mua trả lại hàng mở gian hàng chính hãng nhưng lại bán hang gia
1,sai lầm hàng không giống mẫu chất vải siêu xấu giao sai màu không bao giờ lần 2 mọi người không nên mua shop này
1,áo cho con nít mặc treo hình đẹp mà bán áo thấy gớm vải xấu mỏng như tờ giấy trắng áo thì nhỏ không nên mua nha mấy má
1,giầy dỏm không phải hàng fila thất vọng
1,chất liệu đat màu đen giao màu đỏ vải xấu bần tiện chắc chắn ai mua cũng sẽ hối hận
1,đặt hàng sai 37 giao 38 không còn dám mua nữa
1,chất liệu đat màu đen giao màu đỏ vải xấu bần tiện chắc chắn ai mua cũng sẽ hối hận
1,chất lượng kém
1,bán đồ không uy tín hình ảnh hàng hoá khác xa nhau chất liệu kiểu dáng xấu quá thất vọng chất liệu mô tả đầm voan hàng gửi lại thun kiểu dáng khác xa với hình hoàn toàn
1,đặt hàng sai 37 giao 38 không còn dám mua nữa
1,không thấy hiệu quả chán
1,giầy xấu méo tả đk luôn
1,chất liệu đat màu đen giao màu đỏ vải xấu bần tiện chắc chắn ai mua cũng sẽ hối hận
1,nhìn 2 mẫu khác nhau quá shop bán không uy tín shop làm ăn chán quá shop lừa đảo anh em né shop này ra nha đang hình bán hình khác lửa đảo nhé mọi người
1,áo đúng màu đúng kiểu chất len mỏng thô nhão nói chung so chất lượng với giá bán thì đắt chất lượng không tốt mua một lần không lần hai
1,quần xấu khác xa so với quảng cáo quảng cáo 1 đằng giao hàng 1 nẻo nhìn quả quần chán thật đánh giá 1 sao ai ý định mua thì nên cân nhắc
1,áo quá xấu mỏng không xứng với giá tiền
1,cũng được giao hàng hơi chậm dịch vụ giao không giao theo giờ hẹn của khách nói tóm lại dịch vụ giao hàng quá tệ
1,giao như l vậy đặt áo thun ra áo gì không biết shop làm ăn rất không được kiểu dáng sai chất liệu xấu
1,không thấy hiệu quả chán
1,giầy k giống như trong hình xấu
1,hàng chất cực xấu xù không giống mô tả
1,sai mấu ib shop k trả lời
1,giao sai hàng
1,hàng quâ tệ đặt màu đen giao áo nữa màu xanh kiểu dángsai hình
1,đặt hàng sai 37 giao 38 không còn dám mua nữa
1,giao hang sai san pham lua doi khach hang thi danh gia san pham cai gi
1,chất liệu đat màu đen giao màu đỏ vải xấu bần tiện chắc chắn ai mua cũng sẽ hối hận
1,sai mẫu thất vọng quá
1,vải thun không phải lụa nhé lừa đảo khách hàng váy xấu tệ
2,mình đang dùng hàng chính hãng vì nhỡ nên mua trên mạng ai ngờ lại hàng fake nên phải vứt bỏ cả 2 hộp đi rồi
2,màu không giống form nhỏ hơn hình
2,cái nắp chai sao vặn ra được với lại sài cái mùi của nó không giống mấy chai trước mình mua nói chung không dám sài lên mặt cũng không dám mua lần nữa
2,kính râm nhìn sang nhưng chất lượng nhựa rất kém lỏng lẻo mắt kính dấu hiệu sắp bị bong ra shipper giao hàng cũng lâu
2,quần như cc đéo đúng như trong ảnh
2,đá được 4 trận bay luôn đế
2,quá tệ không mùi hương gì hết
2,áo mỏng quá chất lượng kém giá cao
2,hàng chẳng giống ai cho 2 sao chất liệu còn lại thì cực ẹ
2,mỏng
2,thật sự brand này làm đồ rất mỏng không đáng giá mấy trăm nghìn trở lên đâu ạ mẫu thì giống ảnh còn vải thì ối giồi ơi chỉ một lớp mỏng nhìn xuyên thấu chất thì mặc nóng lắm không nên mua
2,shop đưa nhầm áo không ạ sao áo trên hình một kiểu mà ngoài đời 1 kiểu ạ
2,áo khoác mùi hóa chất nhẹ giặt không hết hoàn toàn
2,mua hàng cẩn thận shop này lừa đảo bán hàng toàn giao thiếu hàng nếu lỡ mua nhớ quay lại video
2,đóng gói cẩn thận giao hơi lâu tròng kính nhựa không phải pha lê gọng kính thì lỏng lẻo
2,đặt màu đen giao màu xám shop này hay thật
2,tiền nào của nấy chất lượng tạm thôi không lung linh như mô tả
2,đặt 2đ vàng trắng mà giao luôn 2đ màu trắng làm ăn như ri ai đặt hàng nũa
2,giao hàng không đúng màu gọi dt thì không nge
2,che không hết hình xăm vẫn còn thấy
2,nói giao hình mũi tên nhưng không đúng kiểu
2,ủa em zai 38 mà giao 35 sao vậy ạ đổi lại dùm em với
2,áo rất mỏng chất lượng vải kém
2,áo nhỏ vải không đẹp không mua shop này nữa
2,giao hàng không đúng màu gọi dt thì không nge
2,không đúng màu trên ảnh
2,quần jeans không bền mới mặc vài lần bị rách
2,đặt màu đen mà ship hàng đéo gì không biết
2,không đúng màu trên ảnh
2,quần jeans không bền mới mặc vài lần bị rách
2,chất liệu nón không như mong đợi nhưng giá tiền rẻ không hi vọng nhiều khi đặt hàng
2,mình đổi cái đầm này lại vải không đẹp
2,giao hàng không đúng theo mẫu
2,đeo kính một lúc bị mỏi mắt hơi đau đầu nhẹ phần gọng cũng lỏng lẻo
2,hàng không giống hình hàng vải xấu tệ luôn luôn qgiá vậy quá đắt
2,đường may còn lỗi nhiều phần túi áo mới mua thì rách thế còn bé chả nhét được cái gì
2,không đúng như hinh
2,không đúng với quảng cáo lừa đảo người mua không uy tín
2,không đúng mẫuk giống hình
2,shop lừa đảo giao hàng không đúng đặt son mà shop giao cái gì đây chứ
2,giầy như hình nhưg đế nhanh mòn không dành chơi thể thao
2,nói tặng quà nhưng không tặng
2,hàng đẹp như hình nhưng chất lượng tệ lắm
2,vải quá nóng không phù hợp cho mùa hè mùa đông thì áo lại ngắn mặc vào lạnh rất khó mặc mà phải dựa vào thời tiết
2,váy không đúng như mô tả
2,giao hàng sai mẫu áo đổi trả hàng cũng phức tạp tư vấn kém
2,vải áo thô bị co lại sau khi giặt lần đầu trải nghiệm hơi thất vọng
2,mua hàng cẩn thận shop này lừa đảo bán hàng toàn giao thiếu hàng nếu lỡ mua nhớ quay lại video
2,giao hàng không đúng màu gọi dt thì không nge
2,hàng tệ tệ trừ chất liệu dệt kim đúng cực tệ thất vọng
2,hàng quá chán
2,giao sai mã nhận đơn xem kĩ trước khi đóng gói nhé chữ tín hang đầu đặt mã 2 giao mã 1
2,giao hàng không đúng màu gọi dt thì không nge
2,chất kem lỏng mùi không giống với mấy tuýp trước mình vẫy hay dùng nhắn tin hỏi shop không được trả lời không biết đây bản cũ hay mới không biết phải hàng chính hãng hay không nữa
2,kem chống nắng rất đặc thoa lên không thấm vào da da mình trắng thoa lên cứ trắng bệt không kiềm dầu nói chung rất tệ sẽ không mua lần thứ 2
2,vải không đẹp như hình
2,kem chống nắng không phải hàng chính hãng
2,đặt màu đen giao màu xám shop này hay thật
2,mầu ok kiểu dáng ok mỗi tội chất vải thì hình chụp 10 hàng nhận được không nổi lấy 2 vải tệ quá chỉ xứng với giá 150k hết
2,làm ăn dối trá
2,đặt hàng cỡ s cỡ m sau đó cỡ rất lớn cỡ s không thể mặc vải sẵn đường may không tinh tế chỉ đủ 2 sao
2,nón giao thiếu phụ kiện kèm theo dù tiền thì trả đầy đủ chất liệu thì bình thường
2,chất kem lỏng không nâng tông khác shop lần trước mình mua hộp kem nhìn cũ lắm nhắn tin shop không trả lời bỏ không dám sử dụng luôn
2,không kết nối với điện thoại được chán quá
2,lừa bịp
2,chất liệu không đẹp giao hàng lâu
2,đặt 1 trắng 1đen giao
2,đây không phải chất liệu giống nhau
2,mua giày nhờ thấy sợi dây màu xanh dạ quang đẹp mà shop lại để sợi dây xám
2,vải mềm mại thoải mái
2,hàng kém chất luong vải lót cũng ren nhin tháy cả da bụng không giống nhu mô tả 2 áo truoc đo mình mua
2,giao hàng không đúng màu gọi dt thì không nge
2,giao hàng không đúng màu gọi dt thì không nge
2,váy không đúng như mô tả hình ảnh trong trang bán hàng váy nẹp lưng váy thật không nẹp kiểu bán kèm với áo dài chứ không phải váy công sở
2,áo không giống như trên hình với lại đứt chỉ
2,không hài lòng
2,hàng kém chất luong vải lót cũng ren nhin tháy cả da bụng không giống nhu mô tả 2 áo truoc đo mình mua
2,kính nhìn thời trang nhưng quá mỏng manh cảm giác sẽ dễ gãy mắt kích cũng dấu hiệu trầy xước
2,hàng mới mà bị chầy xước bẩn như này sao
2,đặt sáu cái quần short jean nam lửng nhưng mà toàn dao dại vụn lừa đảo
3,nhìn dáng dáng nhỏ mình 54kg mặc chặt nhưng chất liệu hơi nóng mình giặt mấy lần thấy chất vải hơi sờm hình ảnh mang tính chất minh họa dáng hơi ngắn
3,không che được vết xăm như quảng cáo
3,giống trong hình
3,đường chỉ bên hông rất xấu như hàng lỗi
3,tr oi giao hơi thất vọng 1 xíu vải mỏng áo thì ngắn quá mũ nhỏ nữa huhu thôi thì mua rồi với giá này thì thấy cũng ổn nói chung tiền nào của đó
3,chất liệu tạm được đăng hình với thông tin giày da nam aseco 32 mã 32m608 mà giao so hàng gia công đế cứng nên đăng mô tả đúng thực tế bán như này khác nào lừa khách hàng
3,độ bền hơi mỏng thoải máicũng ok phong cáchmàu đen 2 bên sọc nhìn giống ctrai nhé hơi xấu
3,chất liệu thun pha nylon nhiều không phải thun cotton nên không mềm mịn co dãn không tốt không hút mồ hôi chất này mà làm quần lót mặc bí bách lắm 40k quần mắc không đáng mua
3,giao không đúng mẫu đặt chán shop làm ăn quá
3,áo mặc thoải mái nhưng phần cổ áo hơi chật
3,quần vải bò ok chiều dài thì vừa nhưng bụng quá rộng lấy 2 cái cùng sz l mà vòng bụng khác nhau cái rộng ít cái rộng nhiều
3,thất vọng vải mỏng áo thì ngắn quá mũ nhỏ nữa huhu thôi thì mua rồi với giá này thì thấy cũng ổn nói chung tiền nào của đó
3,dây hơi bẩn giày nhiều chỗ bị ố bẩn
3,shop đưa đôi giày không giống lắm
3,dùng chán quá biết vậy không mua
3,áo mặc nóng quá
3,quần chất lượng ổn nhưng giá hơi cao so với chất lượng
3,che khuyết điểm điểm không oke
3,dầy nhanh mòn quá
3,giày chật quá thì làm sao để đổi lại shop ơi
3,áo rất ngắn dài 47cm k túi như hình vải mềm nên không đứng áo form k đẹp chất vải áo thì ổn màu như hình
3,vải mỏng
3,nhìn xấu hơn các shop khác mẫu nhìn cũ mắt kích đểu
3,áo vừa vặn nhưng hơi bí khi mặc lâu
3,giao hàng không đúng số đề nghị đổi lại số lớn
3,phần thun bị bum tróc hết rồi ạ
3,giầy không giống hình
3,áo quá nhỏ so với số không nên mua trừ hao nhiều
3,chiều cao cân nặng quần lưng thun không được đẹp lắm
3,quần quá xấu giao không đúng mẫu đặt 1 loại giao loại khác
3,sao thấy gửi mã vậy
3,vải thun nỉ thường bận tạm chứ không đẹp chổ in giặt chịu khó kéo ra trước khi phơi không sẽ bị dính
3,đế giày chất liệu vải rất mềm nên cảm giác không chắc chân lắm sau khi sử dụng vài ngày lớp lót bị bong tróc tạm hài lòng
3,chưa chống nắng được mùi thì hắc hơi nghi ngờ về chất lượng
3,vải mỏng không đẹp như hình tiền nào của đó nhé
3,gói hàng hơi ẩu giày bị dính dơ
3,viền hoạ tiết sao k để màu đen hoặc trắng mang đôi giày xám mà nhìn như con bóng chợ đáng sợ thôi kệ 30k nên cũng k trách nhiều
3,không giống hình ảnh kiểu dáng cũng như chất vải nói chung tiền nào của nấy
3,shop đưa đôi giày không giống lắm
3,vận chuyển rất chậm
3,kinh nhìn cũng được nhưng chưa đeo thử nên không biết thế nào
3,tui mặc áo thun trắng thoa cái này đi chơi đổ mồ hôi kem nó chảy dính áo vàng khè luôn bực vô cùng
3,đã xem kích thước eu 39 tương đương việt nam nhận hàng nhỏ xíu cho con gái mang hơi rộng chút cháu số 36 khen giày đi êm thôi để dành cho nó
3,kính đúng giá tiền nhưng không thêm phụ kiện kèm
3,hang mong không vo quân
3,áo đúng nhưng tay áo một gắn một dài
3,không túi
3,kính chống nắng ổn nhưng không đủ che sáng tốt như mong đợi
3,đẹp tiền nào của nấy
3,giao không đúng màu vải không tốt lắm
3,form nhỏ 2xl nhưng 73kg mặc bị chật tay hơi ngắn
3,chất lượng như mong đợi chiều cao rất ngắn rất thất vọng
3,giao hàng khá lâu đặt hàng từ nước ngoài mà nhà bán hàng lại địa chỉ giao hàng tại hà nội chất liệu vải độ dài quần y mô tả hình ảnh quảng cáo khác xa so với thực tế nhận in hình sai hoàn toàn không giống như mô tả nên cho shop 3 vì sai hình in nhé hình quảng cáo in full tới lai quần còn hình nhận được chỉ tới khuỷu chân thôi shop bán hàng tử tế lại
3,không che được vết xăm như quảng cáo
3,da mình bình thường mà dùng không thấm nỗi ngủ dậy mặt nặng nổi mụn nước li ti ráng giảm lượng cũng không thấm được tay thoa cong cũng nhớt luôn khỏ chịu phải đi rửa
3,kem đợt này hạt lợn cợn không tan
3,áo cũng được nhưng mà tay hơi dài mặc chưa được thoải mái lắm
3,viền hoạ tiết sao k để màu đen hoặc trắng mang đôi giày xám mà nhìn như con bóng chợ đáng sợ thôi kệ 30k nên cũng k trách nhiều
3,nón dễ thương nhưng giao sai màu hơi thất vọng
3,chưa chống nắng được mùi thì hắc hơi nghi ngờ về chất lượng
3,nhìn xấu hơn các shop khác mẫu nhìn cũ mắt kích đểu
3,giày đẹp tốt chất lượng tốt test thử sân banh nhưng sai màu rồi rất bức xúc đặt 2 đôi nhưng giao 2 đôi màu cam thì làm sao nhưng vì lỡ xé mất phiếu trả hàng rồi không biết làm sao lần sao mình sẽ đặt nhưng phải giao cho đúng màu
3,ở sau đính màu đen giặt không ra
3,đồng hồ như đồ chơi của con nít
3,nhìn thì được nhung đế dán da dán
3,giao hàng nhanh thật nhưng hàng không đúng mẫu mua mua mẫu sọc sao giao hàng nhận không sọc z shop
3,không đúng như trong hình
3,sp tạm ổn vs giá tiền 2 vì đóng gói 2 vì mùi nhựa đế giầy mùi nhựa quá kinh khủng ám mùi vào tay giầy êm 1 1 lót giầy k đảm bảo đeo vào dút ra bung cmn lót đế tổng cộng 1 đánh giá cho sp
3,vải nóng tiền nào của nấy không nhãn mác gì được cái kiểu dáng đẹp trẻ trung
3,áo nhìn ổn nhưng tay áo hơi dài so với thân áo
3,hàng hơi bi lỗi xiu nha shop
3,nhìn dáng dáng nhỏ mình 54kg mặc chặt nhưng chất liệu hơi nóng mình giặt mấy lần thấy chất vải hơi sờm hình ảnh mang tính chất minh họa dáng hơi ngắn
3,eo hơi rộng
3,nhìn xấu hơn các shop khác mẫu nhìn cũ mắt kích đểu
3,chat luong tot nhung gia hoi cao
3,đặt màu đen giao màu xanh clmm
3,tr oi giao hơi thất vọng 1 xíu vải mỏng áo thì ngắn quá mũ nhỏ nữa huhu thôi thì mua rồi với giá này thì thấy cũng ổn nói chung tiền nào của đó
3,nón đẹp nhưng giao hàng chậm hơn dự kiến
3,bình thường
3,giày chật quá thì làm sao để đổi lại shop ơi
4,thiết kế quần baggy jean rất đẹp đảm bảo chất lượng tốt nhất với giá cả hợp lý
4,shop giao hàng khá nhanh áo vải gió mỏng nhưng sẽ hơi nóng còn khá nhiều chỉ thừa chất lượng như vậy so với giá tiền khá phù hợp
4,áo vải mềm dễ chịu nhưng hơi mỏng phù hợp mặc mùa hè
4,chất lượng vải vẻ mỏng mặc mùa hè sẽ nóng phù hợp giá sale 100k các mẹ cân nhắc nhé mẫu mã đúng tặng shop 4 sao
4,áo cũng được đặt tay ngắn về tay dài
4,nón thiết kế đơn giản đẹp nhưng dễ bị dơ khi đội lâu
4,tạm ổn vì giá phổ thông nên gia công chưa cẩn thận lắm
4,giày tạm được
4,kính kiểu dáng hiện đại đeo thoải mái nhưng hơi dễ lỏng vít
4,vải đẹp chất lượng
4,khá tốt nhưng chỉ mùi nồng như rượu thay vì mùi nhẹ màu ok đúng mẫu chọn nhưng tiếc không lì rất dễ trôi chị em nên cân nhắc nhé
4,hơi to
4,không nhu hình ngắn quá thấy dai mới mua dai chút nữa thì đẹp giao hang dễ thương bọc hàng cũng được
4,em bận tí mà anh shipper nóng quá đang mắt mà hối thiệt áo thì tuyệt mà anh shipper nóng quá
4,đầu tháng đặt cuối tháng giày form hẹp nhất phần mũi chân hơi nhỏ đi bị đau ngón chân đế giày không mềm tiền nào của đó
4,chất liệu bình thường vẻ ngoài ổn dễ dàng phối cùng các trang phục khác
4,hơi to
4,mắt kính to hơn kỳ vọng
4,chat lượng tam on phu hop voi gia tien
4,sp tuyệt vời cổ rất ôm chân dây buộc khá chắc điều may phần cổ còn nhiều chỉ dư giao hàng nhanh
4,quần jean đa năng cho mọi dịp quần jean trắng đen hợp thời trang vừa vặn hoàn hảo cho việc mặc hàng ngày
4,không đúng mấy nhé cũng đc
4,sài ok lắm nâng tông một chút cũng thơm shop giao nhanh 2 ngày nhưng mà anh shipped giao hơi chậm
4,chất liệu da mềm nhưng xấu
4,giao hang tot hang tam on so voi gia 404k con ben hay khg phai dung moi biet
4,nhận được hàng đúng mẫu mặc vừa nhưng một vài chỗ buột chỉ
4,tuyệt vời cho trang phục công sở dịch vụ khách hàng xuất sắc giá trị tốt cho số tiền bỏ ra
4,vết keo dính loè loẹt trên giày kèm theo một số vết bẩn nhỏ hàng chính hãng
4,giày mang êm tốt trong tầm giá
4,đẹp
4,nón thiết kế đơn giản đẹp nhưng dễ bị dơ khi đội lâu
4,"sản phẩm dùng tạm, nói chung cũng không hi vọng gì nhiều vào giá này"
4,giày mang êm tốt trong tầm giá
4,chất liệu da mềm nhưng xấu
4,vỏ nhìn vẻ rất môi trường cute nhé cơ mà mã qr nhưng dùng zalo hay wechat đều không thể quét ra được không biết phải hàng pha ke khum
4,hàng đẹp nhưng không hộp mình phải gửi trả sẽ còn ủng hộ
4,áo nhỏ hơn trong hình
4,dùng cũng tạm được mua rồi thì đành phải đeo thôi
4,giày đẹp như hình giao hàng nhanh nhiệt tình
4,giày đúng mẫu màu quảng cáo mang vào êm chân giá chất lượng như vậy mình đề xuất nên mua ạ
4,chất liệu vải canvas thoải mái dịch vụ khách hàng xuất sắc chất lượng cao giá cả hợp lý
4,áo cũng được đặt tay ngắn về tay dài
4,ở hà nội nhưng giao về hcm rất nhanh giày đẹp rất thích điều qc lớp mềm giữa đế nhưng cảm nhận không thấy nhưng mqng vào rất thích
4,đặt hàng màu đỏ nhưng khi giao màu vàng nên trừ 1 sao nhé
4,giày mang êm tốt trong tầm giá
4,nón rộng thoáng khí nhưng hơi khó làm sạch
4,hàng tạm được nhung dính vết dơ không giật ra lần sau giao hàng cho khách phải chú ý
4,vải dày nha trời mặc dô mùa nóng không ok lắm mặc mùa lạnh thì vẫn nóng nha cả nhà nhm tương đối dống hình ạ
4,áo màu đẹp form chuẩn nhưng phần cổ hơi cứng
4,không phiếu trả hàng
4,dùng ổn hợp lý với tầm giá này
4,giặt thấy bị phai màu ban đầu khá nhiều chất liệu co giãn mặc tương đối được
4,shop uy tín hàng y chang mẫu nhưng quần dìm dáng nên ai tầm 1m7 thì nên mua nha
4,giao hàng hơi lâu đóng gói kỹ càng chất liệu tốt váy đẹp nên mua nha mọi người
4,hàng ok phù hợp với giá tiền rẻ nên không mong đợi gì hơn
4,chất liệu vẻ hơi mỏng
4,giày thể thao nữ ok
4,đẹp khá ổn với tầm giá
4,chất liệu da mềm nhưng xấu
4,áo đep chỉ giao hơi lâu thôi đẹp lên bỏ qua giao hàng lâu
4,vải hơi mỏng nhưng xinh lắm
4,vải không co giãn mặc khó chịu chất xấu
4,hàng đóng gói rất đẹp quả nhiên người bán gửi gắm rất nhiều tâm tư tình cảm trong lúc gói hàng hộp không dấu hiệu bị móp chứng tỏ bộ phận vận chuyển nâng như nâng trứng hứng như hứng hoa xin nghiêng mình cảm ơn vì tất cả thiết kế linh hoạt phù hợp với mọi lứa tuổi vừa vặn thoải mái khi mặc
4,hàng đúng nhưng nhận hơi lâu
