rating,review
1,nhìn 2 mẫu khác nhau quá shop bán không uy tín shop làm ăn chán quá shop lừa đảo anh em né shop này ra nha đang hình bán hình khác lửa đảo nhé mọi người
5,sẵn màu đen xám hoàn hảo cho thể thao lối sống năng động chất xấu vãi đừng mua
5,thoải mái
5,hàng tốt như shop mô tả giao hàng đúng hạn như xác nhân trên đơn hàng xin cám ơn shop nhiều nhé mong shop sẽ nhiều mặt hàng tốt rẻ để mình thể đặt hàng tiếp tục trong tương lai sau này
5,sự thoải mái mát mẻ vải mỏng chút lổi không đáng kể đánh giá shop tót
5,chất liệu dày dặn bền bỉ
5,phong cách
5,thiết kế ống rộng vải co giãn cao cấp dây thắt lưng co giãn thoải mái
5,chiều cao cân nặng shop tư vấn nhiệt tình giá rẻ so với thị trường giao hàng nhanh đúng đủ số lượng đánh giá 5 sao
5,vừa vặn hoàn hảo cho mọi dáng người thiết kế ống rộng chất liệu vải bò cao cấp thời trang phong cách dây lưng co giãn thoải mái
5,đa năng cho cả nam nữ hoàn hảo cho các hoạt động thể thao quần jogger chất lượng tuyệt vời
5,hàng ok quan nỉ bông giá với chất vải hợp lý mặc rộng tí thoải mái
5,chiều cao cân nặng
5,hoàn hảo cho phong cách thể thao đường phố vừa vặn thoải mái cho cả ngày quần short đa năng cho mùa hè
5,vải nhẹ thoáng khí thiết kế đơn giản cho phong cách tối giản
4,chất liệu nhẹ thoáng khí dễ giặt ủi mau khô
5,hoàn hảo cho phong cách thể thao phố thiết kế đơn giản cho vẻ ngoài tối giản được làm từ chất liệu chất lượng cao chất liệu nhung tăm sang trọng
5,hàng hơi rộng chất lượng tốt
5,chất liệu tốt nha mọi người phong cách đẹp lắmbền không phai màu sau khi giặt dây thun co giãn mang lại sự thoải mái thiết kế ôm sát tôn dáng giá trị tuyệt vời cho giá cả
5,vật liệu cứng tốt dễ mặc với dây kéo ở cuối quần một số túi zip nhỏ
5,hàng nhận được nhanh chóng trong tình trạng tốt như trong hình quảng cáo chất liệu quần nhẹ mát cảm ơn người bán rất tốt
5,chất lượng tốt thể chạy hoặc làm việc nhận được với bao bì tốt
5,vừa vặn ok vừa ý nha mọi người hàng đúng quảng cáo
5,nhanh chóng làm khô vải hình dạng thoải mái dễ dàng để làm sạch chất lượng tuyệt vời linh hoạt cho các hoạt động khác nhau
5,vật liệu ok mặc dù nó một chút mỏng may phải được sử dụng trong một thời gian dài trước khi chỉ bị sờn hoặc đáng giá
5,được tặng móc khóa khá ok
5,sản phẩm như hình vải dày
5,vật liệu tốt
5,chất liệu không rõ lắm không được mềm mại như cotton cưng
5,chất liệu vải thoáng khí thoải mái thiết kế in hình độc đáo thời trang
5,chất liệu vải cũng được nhưng hơi mỏng tí thôi
5,đóng gói cẩn thận giao hàng trong dự kiến sản phẩm ổn áp so với giá cả tặng sop 5 tặng shipper 5
5,không đẹp so voi hình
5,vải mỏng ai cần diện không nên mua rẻ trong tầm giá đóng gói cẩn thân
5,chất vải tương đối vẻ dễ bám bụi kiểu dáng hợp với người lớn bé nhà mình 15 tuổi nên không hợp xin lỗi chưa chụp hình
5,quần tạm ổn trong tầm giá nên mua giá trị tuyệt vời cho giá cả dáng thẳng tôn dáng vải thoải mái nhẹ
5,chất liệu bền bền lâu thích thiết kế rất thời trang giao hàng nhanh đóng gói cẩn thận chất lượng tuyệt vời với giá cả phải chăng
5,quần jean chất lượng cao với giá cả phải chăng vừa vặn hoàn hảo chất liệu co giãn chất liệu denim bền chắc phù hợp cho việc mặc hàng ngày
5,quần jean chất lượng cao với giá cả phải chăng vừa vặn hoàn hảo chất liệu co giãn yêu thích thiết kế ôm sát
5,giao hoi bị sai màu nhưng tạm chấp nhận giao hàng nhanh giá cả hợp lý
5,độ bền chưa sử dụng nên chưa biết buồn 5 đặt màu sọc xanh lá cây shop giao xanh dương khích lệ vẫn tặng 5 sao
5,hoàn hảo cho các hoạt động thể thao chất liệu cotton cao cấp lựa chọn tuyệt vời cho người năng động giá trị tuyệt vời cho giá thành
5,quá đẹp
5,quần đẹp giá rẻ nữa chất lượng ok phù hợp mặc đi tập thể dục thể thao đi chơi nữa nói chung hàng ok nha cảm ơn shop thật nhiều nha
4,vừa vặn quần vừa vặn giao hàng thân thiện điểm trừ quần vải rất mỏng dây rút quần làm lệ may luôn vào cạp chứ không rút được
5,kết cấu rất tốt thoải mái chờ lâu
5,quần cargo thời trang thiết kế chân rộng mang phong cách thời thượng thiết kế chân rộng mang phong cách thời thượng quần cargo thời trang
5,giao hàng chậm nhưng gói chậm nhưng gói chậm nhưng gói chậm nhưng gói chậm nhưng gói chậm nhưng gói chậm
5,vải đẹp chất lượng tốt sẽ không thất vọng với giá tiền
5,chất liệu tốt
5,chất liệu denim bền
5,rất hài lòng nhưng khóa trang trí không màu vàng như ảnh giớt thiệu lúc mua
5,rất nhanh được rồi không thất vọng
5,chiều cao cân nặng chất liệu mềm mại giá cả của áo này rẻ mua mặc cho thoải mái mùa hè này nóng quá cảm ơn shop nhiều tặng cho năm sao
5,tạm được hơi nhỏ
5,thoải mái khi đeo cả ngày phù hợp cho mùa hè dáng vừa vặn cho vẻ ngoài vượt thời gian
5,không phai màu hoặc lem màu dáng vừa vặn cho vẻ ngoài vượt thời gian thoải mái khi đeo cả ngày
5,không phai màu hoặc lem màu thoải mái khi đeo cả ngày phù hợp cho mùa hè
5,chất liệu tốt
5,chất liệu
5,quần vải đẹp nhưng dây rút lưng dở quá shop giao sai màu đặt màu xanh đen màu xanh lá nó chói chang quá so với độ tuổi của chồng mình
1,khủng khiếp không chính xác như yêu cầu hoàn lại tiền không thể nhập lại
5,mẫu đẹp chất mát
5,quần jogger thoải mái thời trang vải nỉ ấm áp dày dặn dây rút điều chỉnh phù hợp thoải mái
5,thiết kế ống rộng tạo phong cách thời trang chất liệu cotton mềm mịn chữ nhật thêu chất lượng cao dây rút điều chỉnh phù hợp thoải mái
5,đúng loại quần vừa ok
5,quần jean ngắn giao sau vài ngày mua
5,đặt hàng thái tốt hơn may không tốt vải không nên được sử dụng trong một thời gian dài các mũi khâu ở rất xa
5,bền sử dụng lâu dài
5,lý tưởng cho bóng rổ bóng đá chất liệu chất lượng tuyệt vời bền lâu dài hoàn hảo cho các hoạt động thể thao vải thoải mái co giãn giá trị tuyệt vời cho giá cả
5,nhận được các mặt hàng hoàn chỉnh không thiệt hại giao hàng nhanh din kahit na tuần thánh cảm ơn người bán
5,chất lượng tốt giá rẻ đây một trăm sao để đi đến ngôi sao để được nó đến 100 điểm đầy đủ 5 sao
5,quần chất lượng cao cấp màu đen đa năng hoàn hảo cho các dịp trang trọng thoải mái khi đeo cả ngày
5,phong cách hàn quốc thịnh hành hoàn hảo cho các dịp trang trọng được làm với sự chú ý đến từng chi tiết
5,quần vải rất mỏng vải không co giãn tiền nào của nấy 50k 1 cái
5,vừa vặn thời trang thoải mái không nhăn luôn trông gọn gàng quần chất lượng cao cấp màu đen đa năng màu đen đa năng quần chất lượng cao cấp phong cách hàn quốc thịnh hành hoàn hảo cho các dịp trang trọng hoàn hảo cho các dịp trang trọng phong cách hàn quốc thịnh hành
1,chất liệu mô tả thì chất liệu kaki dày dặn form đứng ship thì ship cho đúng cái quần vải mềm oặt ra yêu cầu trả hàng thì không cho trả shop làm ăn mất uy tín quá
5,vải xấu quá không đẹp như trên hình quảng cáo
5,mỏng nhẹ thoáng mát đáng mua để mặc ở nhà còn mặc ra ngoài nên chọn loại vải dày dặn hơn ảnh mang tính chất nhận xu
5,bền lâu bền
5,hàng đúng mẫu giao hàng nhanh chóng chất liệu hoi mong nghe mắc thay quần lót bên trong cán nhắc khi mua
5,bền lâu bền
5,nhanh khô thoáng khí lý tưởng cho chạy bộ tập gym nhanh khô thoáng khí
5,hoàn hảo cho người năng động quần short thể thao linh hoạt thiết kế thời trang hiện đại thiết kế chống trượt giúp cố định tốt hơn
5,hàng tốt trong tầm giá độ bền thì chờ thời gian sữ dụng mới đánh giá được nói chung rất đáng để mua
5,mua hàng của shop nhiều lần mọi người yên tâm nha
5,thích hợp cho yoga phòng tập thể dục thiết kế eo cao hợp lý thích hợp cho đi xe đạp các hoạt động ngoài trời thiết kế thời trang hợp thời trang cung cấp sự linh hoạt tốt cho thể dục
5,một tuần được coi không chậm từ trung quốc các nhân viên vận tải lịch sự ra lệnh 9 xà cạp eo 28 hông 40 đặt trên vải chặt chẽ mềm mại căng như một chiếc áo thể thao nhưng không thoáng khí nếu máy giặt túi giặt sẽ tốt hơn bảo quản vải sử dụng lâu dài
5,vải dày dặn giá cả hợp lí cạp cao để vẻ ngoài tôn dáng hoàn hảo cho học sinh thoải mái khi mặc cả ngày
5,hàng giao nhanh gói hàng cẩn thận
5,tạm thời thấy khá ok quần mặc thoải mái thể nới rộng eo được vải không được dày nhưng cũng không vấn đề gì để dùng 1 thời gian xem độ bền ra sao
5,tăng cường sự tự tin với quần này chất liệu thoáng mát thoải mái bền bền lâu vừa vặn hoàn hảo với đai quần thể điều chỉnh nâng tầm phong cách với quần này chất liệu co giãn cao cấp tốt đa năng phù hợp cho nhiều dịp
5,đa năng phù hợp cho nhiều dịp bền bền lâu vừa vặn hoàn hảo với đai quần thể điều chỉnh
5,túi quần đoạn ở trên thông vào bên trong thể gãi chym hoặc chỉnh quần sịp tùy thích nhưng không nên cho người khác bỏ tay vào túi quần mình
5,giá trị tuyệt vời so với giá tiền thoải mái sang trọng chất liệu vải tuyệt vời
1,sai lầm hàng không giống mẫu chất vải siêu xấu giao sai màu không bao giờ lần 2 mọi người không nên mua shop này
5,một trải nghiệm rất tệ không hài lòng một chút xíu nào
5,quần hợp với giá thành giao hàng nhanh đây lần thứ 2 mua hàng của shop chưa khiến mình phải thất vọng mọi người nên thử trải nghiệm
5,hàng tốt hàng chất lượng
3,hàng giao đúng thời gian dự kiến đúng mẫu mã trên web mô tả đóng gói cẩn thận chất lượng tạm được
5,shop giao hàng nhanh chất vẻ ổn không biết giặt thì vị nhăn nhàu không nhưng cũng ok
5,shop giao hàng nhanh đóng gói cẩn thận chất cũng ok ủng hộ shop
5,hợp thời trang phong cách chất liệu thoải mái bền lựa chọn tuyệt vời cho phụ nữ ngoại cỡ
5,sự thoải mái thiết kế tôn dáng sang trọng quần short đa năng cho các dịp khác nhau hoàn hảo cho các chuyến đi chơi mùa hè lựa chọn tuyệt vời cho phụ nữ ngoại cỡ
5,tuyệt vời cho việc vận động chất liệu thoải mái co dãn phong cách đa năng thời thượng thời trang thoải mái
1,giao hàng như quần què người ta vậy đó
5,uy tín lắm shop ok
1,không giống hình chút nào
5,dịch vụ khách hàng tuyệt vời giao hàng nhanh chóng quần đa năng cho trang phục hàng ngày
5,vải thoáng khí thoải mái quần đa năng cho trang phục hàng ngày dịch vụ khách hàng tuyệt vời giao hàng nhanh chóng
5,vải nhanh khô cho người năng động vải thoáng khí thoải mái dịch vụ khách hàng tuyệt vời giao hàng nhanh chóng vải nhanh khô cho người năng động
5,vừa vặn thoải mái khi mặc
5,kỹ thuật thiết kế tuyệt vời đa năng dễ phối đồ vừa vặn hoàn hảo chất lượng tuyệt vời
5,lý tưởng cho thể thao mặc hàng ngày kỹ thuật thiết kế tuyệt vời
5,giao hàng hơi lâu mà được cái shop shiper thân thiện nhiệt tình
5,lý tưởng cho trang phục đi làm văn phòng lựa chọn tuyệt vời cho mùa thu
5,quần khá xấu giống hàng chợ không giống như hình mức giá này mua được hàng tốt hơn
5,thương
5,phong cách mọi thì đều ok đẹp tầm giá này mà mua được vậy thật sự rất hài lòng mà đặt ghi sáng giao ghi tối lần sau đặt thêm cái shop giao đúng nhé
5,đa năng dễ dàng tạo kiểu túi trước sâu tiện lợi hoàn hảo để thư giãn tại nhà
5,giao hàng nhanh chóng đúng như quảng cáo để sử dụng thử rồi mới biết được tốt hay không nha các bạn
5,vừa vặn hoàn hảo vật liệu chất lượng cao vật liệu chất lượng cao vải mềm mịn phong cách trẻ trung thiết kế hợp thời trang
5,vải mềm mịn dễ dàng pha trộn kết hợp vật liệu chất lượng cao thiết kế hợp thời trang vừa vặn hoàn hảo tuyệt vời cho các hoạt động ngoài trời
5,ok hàng giao như mẫu
5,shop giao nhanh chóng đầy đủ đúng mẫu đóng hàng cẩn thận mua được với giá sale rất tuyệt lun thanks shop
5,shop uy tín nhân viên giao nhầm mầu shop hỏi tài khoản để hoàn trả tiền ngay cảm ơn shop
5,quần đẹp nhé mọi người shop gửi hàng rất nhanh từ hà nội 3 ngày tới mua vài ở shop này rồi rất uy tín
5,hàng đẹp đúng vừa ý luôn shop ơi
5,quần ok may chuẩn săn được sale 90k nên cũng không đòi hỏi gì mà quần đẹp nên mua
5,sự thoải mái vải denim chất lượng tốt màu đen hợp thời trang giá trị tuyệt vời cho giá cả đa năng dễ dàng tạo kiểu đa năng dễ dàng tạo kiểu giá trị tuyệt vời cho giá cả vải denim chất lượng tốt màu đen hợp thời trang giá trị tuyệt vời cho giá cả vải denim chất lượng tốt đa năng dễ dàng tạo kiểu giá trị tuyệt vời cho giá cả đa năng dễ dàng tạo kiểu
5,hơi thất vọng xíu nhưng mà thấy cũng ổn hơi rộng
5,thiết kế phong cách hợp thời trang thiết kế ống rộng cho sự thoải mái
5,cửa hàng cung cấp phản hồi trò chuyện tuyệt vời người bán nói tốt dễ thương rất hài lòng với giao dịch mua này không thất vọng
5,chất lượng tốt giá rẻ đây một trăm sao để đi đến ngôi sao để được nó đến 100 điểm đầy đủ 5 sao
5,quần đẹp ạ vải ok đóng gói giao hàng ok nói chung ok hết ạ lần sau sẽ ủng hộ tiếp
5,mua về mặc mà chưa kịp mặc đứa cháu mặc thử thấy vừa nên lấy mất rồi
5,shop đóng gói nhanh đặt 1010 thì 2010 nhận hàng quần vải mỏng với giá sale còn 62k quần 1 lớp thôi mặc ở nhà này nọ cho mát mùa nóng thì được giá giảm thì mua tạm chấp nhận chứ giá gốc thì hơi mắc nha
2,chất lượng vải quần xấu không giống mô tả nhận quần về chán quần phom bé mua cho chồng nhưng không vừa
5,đóng gói cẩn thận chất lượng ok đúng như hình ảnh giao hàng nhanh
5,sản xuất tại việt nam họa tiết caro thời trang bền lâu dài
5,đặc 2 cái giao không đúng màu cả 2
5,giao hàng nhanh chóng đóng gói cẩn thận nhưng giao hai màu khác nhau đặt xanh sáng bee giao xanh đen màu den
5,chất liệu dày bền chất liệu dày bền
5,hàng rất ok mình mua lần thứ tư rồi vải đẹp kiểu dáng rất đẹp giao hàng nhanh các bạn nên mua nha
5,hàng chuẩn đúng như quảng cáo đóng gói cẩn thận giao hàng nhanh nhân viên giao hàng nhiệt tình sẽ mua ủng hộ shop về sau
5,quần jogger thoải mái thời trang thiết kế in đồ họa độc đáo phong cách thời trang hợp xu hướng
5,thoải máivừa vặn thông thường cho trải nghiệm mặc thoải mái
5,tất cả các mặt hàng được đón nhận hàng nhận được như đặt vận chuyển khá nhanh
2,quần xấu quá
5,tại sao cái shop hay đến như vậy mà người việt nam chưa ai biết tới luôn
5,phong cách phù hợp cho mọi mùa phù hợp cho mọi mùa đa năng dễ dàng tạo kiểu hoàn hảo cho các dịp bình thường thiết kế phong cách thoải mái hoàn hảo cho các dịp bình thường
5,chất lượng rất ok như trong giới thiệu sẽ ủng hộ shop
5,tốt chất vài ngon
5,hàng tốt
5,mình mới nhận hàng quần giống ảnh đẹp
5,túi khóa kéo tiện lợi thoải mái phong cách đa năng cho các hoạt động thể thao giá trị tuyệt vời cho giá cả
4,quần jean đa năng cho mọi dịp quần jean trắng đen hợp thời trang vừa vặn hoàn hảo cho việc mặc hàng ngày
4,màu sáng nhẹ nhàng cho vẻ ngoài thường ngày quần jean đa năng cho mọi dịp thiết kế nhật bản thời trang phong cách vừa vặn hoàn hảo cho mặc hàng ngày
5,quần jean bền lâu bền dây chun ở eo tạo cảm giác thoải mái vải jean thoải mái co giãn vải jean thoải mái co giãn thiết kế gối rách phong cách
5,mua rất nhiều lần mua đi mua lại mua được giá khuyến mãi rất rẻ nhưng mặt rất ok
5,vừa vặn hoàn hảo cho mặc hàng ngày màu sáng nhẹ nhàng cho vẻ ngoài thường ngày quần jean trắng đen thời trang
5,eo vừa phải giúp tôn dáng vải denim chất lượng cao đa năng cho mọi dịp thiết kế phong cách hợp thời trang
5,họa tiết in đẹp mắt tuyệt vời cho các hoạt động giải trí đơn giản phong cách chất liệu waffle thời trang
5,hoàn hảo cho mùa hè tuyệt vời cho các hoạt động giải trí thời trang thoải mái chất liệu waffle thời trang
5,cao 1m63 nặng 55kg mặc 29 vừa y nè giao hàng cực nhanh phần cạp nó hơi ngắn so với tưởng tượng của tui còn lại thì chất đẹp dáng lên ổn lắm
5,may kiểu ông nội bây quần không vắt sổ túi thì cạn làm ăn như con c ai dám mua hàng nữa má bây mua về bỏ chứ mặt gì làm ăn cẩu thả dối trá đồ lườn gạt
2,treo đầu dê bán thịt chó mọi người không nên mua không hiểu lazada sao không quản lý được cứ để các shop bán toàn hàng không đúng như chào hàng lừa dân
5,quần đẹp mua 2 cái đều ưng ý
5,quần dây rút mang đẹp ok
5,chất liệu thun
5,giao hàng trong tình trạng tốt bao bì theo thứ tự chất lượng tốt giá trị tốt giá cả hợp lý giao hàng nhanh
5,quần được giao trong tình trạng tốt
5,quần quá đẹp shopp rep tin nhắn nhanh nhiệt tình sẽ ủng hộ típ shop uy tín nên mua nhaa mọi ng
5,ý tưởng quà tặng tuyệt vời cho bạn bè gia đình quần đẹp thoải mái hoàn hảo cho tất cả các mùa thiết kế linh hoạt dành cho cả nam nữ
5,vừa vặn thoải mái thư giãn giá trị tuyệt vời cho giá cả uy tín
5,chất vải đẹp
5,quần tây chất lượng tuyệt vời không nhăn luôn trông gọn gàng giao hàng nhanh nhận được trong tình trạng tốt
5,quần hơi mỏng quần tây nhưng thực chất thun form không đứng
5,quần kaki jogger rất đẹp như hình ảnh mô tả của shop mình mua rồi nên giờ mua thêm đặt thêm 1 cái quần kaki short mà đặt đơn nhầm màu chat riêng với shop nhờ đổi màu dùm xong nhận hàng cũng không được đổi kaki jogger thì 5 còn kaki short thì 3
5,đa năng hợp thời trang chất liệu mềm mại mịn màng thiết kế hợp thời trang trẻ trung thoải mái phong cách
5,quần short chất lượng tuyệt vời yêu thích chất liệu co giãn này chất liệu mềm mại mịn màng thiết kế hợp thời trang trẻ trung
5,rất tệ
5,thoải mái phong cách quần ống rộng cho vẻ ngoài thời thượng
5,oke đẹp giống như quảng cáo xin cảm ơn shop
5,thiết kế đen trắng cổ điển quần ống rộng cho vẻ ngoài thời thượng
5,hoàn hảo cho việc mặc hàng ngày thiết kế đen trắng cổ điển dễ dàng kết hợp với nhiều áo phù hợp
5,shop giao đúng mẫu đúng màu mọi người nên mua nhé hình ảnh minh hoạ
5,quần xịn mịn lắm nhé lót bên trong quần đen ngắn hơn quần xanh cơ mà vẫn oke nhé nên mua nha
5,vải không thấm nước 43kg cao 1m55 mang không vừa vì nhỏ con nít cấp 1 mang thì vừa mua về 5 cái để vứt chứ không mang được hình ảnh mang tính chất nhận xu
5,thiết kế quần ống đứng độc đáo vừa dặn đóng gói kỹ giao cũng nhanh
5,họa tiết hoạt hình thời trang thiết kế quần ống đứng độc đáo lý tưởng cho hoạt động thể thao
5,quần nhe bền túi bư bỏ cả thế giới vô túi
5,vải dù tốt nhe túi to
5,dây thun co giãn giúp ôm vừa vặn thoải mái quần soóc đa năng cho mùa hè vải thoáng mát thoải mái
5,hình ảnh mang tính chất nhận xu shipper nhiệt tình thân thiện tặng shop shipper 5 sao thanks
5,chất liệu co giãn để dễ dàng di chuyển đa năng phong cách vải chất lượng cao
5,giao hàng nhanh chóng vừa vặn thoải mái chất liệu cao cấp phong cách linh hoạt thời trang
5,vừa vặn hoàn hảo dáng vẻ tôn dáng đa năng dễ dàng tạo kiểu hoàn hảo cho các dịp trang trọng màu đen cổ điển vừa vặn hoàn hảo dáng vẻ tôn dáng
5,đa năng dễ dàng tạo kiểu màu đen cổ điển tuyệt vời cho trang phục văn phòng vải chống phai màu
5,hoàn hảo cho các dịp trang trọng thiết kế thanh lịch không bao giờ lỗi thời tuyệt vời cho trang phục văn phòng
5,chất liệu mềm mịn thoải mái đai thun co giãn giúp vừa vặn thoải mái
5,nụ cười đi trước vía học giỏi theo ngay khai xuân đón năm mới cùng lay’s phiên bản tết ngon giòn giã mang nụ cười rộn ràng vía học giỏi cực mạnh vì nụ cười trên gói lay’s được tổng hợp từ nụ cười của nhiều người học giỏi nhanh tay lấy vía học giỏi về nhà để đón tết như ý nào homies lay’s tết này cười vui lấy vía
5,giá rẻ mà còn đẹp vãi chất nha co giản nhẹ giao hàng nhanh sẽ ủng hộ vào lần sau
5,quần đẹp nhé hình ảnh mang tính nhận xu nhé
5,ok túi tiện lợi để đựng đồ kiểu dáng thẳng tạo phong cách cổ điển quần lịch sự thoải mái thiết kế ôm gọn cho vẻ ngoài thời trang thiết kế ôm gọn cho vẻ ngoài thời trang thiết kế ôm gọn cho vẻ ngoài thời trang quần lịch sự thoải mái túi tiện lợi để đựng đồ kiểu dáng thẳng tạo phong cách cổ điển thiết kế ôm gọn cho vẻ ngoài thời trang quần lịch sự thoải mái kiểu dáng thẳng tạo phong cách cổ điển thiết kế ôm gọn cho vẻ ngoài thời trang
5,độc đáo thu hút mắt đa năng cho cả vòng tay dây chuyền thiết kế đẹp thanh lịch beads gỗ chất lượng cao hoàn hảo cho việc cầu nguyện thiền định mạng lại năng lượng tích cực hoàn hảo cho việc cầu nguyện thiền định
5,chất lượng tuyệt vời rất được khuyến khích
5,cho đổi lại size lớn hơn
5,giao hàng nhanh người bán đáng tin cậy
5,nhận được trong tình trạng tốt vật liệu mịn thoáng mát thoải mái
5,thoáng khí thoải mái thiết kế đa năng phù hợp tuyệt vời hoàn hảo cho tập luyện mùa hè vải khô nhanh thời trang hợp thời trang dây thắt lưng đàn hồi cho phù hợp thoải mái phong cách hợp thời trang dễ dàng để làm sạch
5,chat liệu vải xấu bị lem màu
4,thoải mái thời trang thoải mái thời trang thoải mái thời trang thoải mái thời trang thoải mái thời trang
5,quần jogger linh hoạt cho cả nam nữ giá trị tuyệt vời so với giá yêu thiết kế tia sét thoải mái thời trang ấm áp thoải mái cho mùa đông
5,nhận được hàng không hài lòng chúc nào vì gửi quần không giống mẫu quần đặc
5,chất lượng không tốt vắt xổ không gọn gàng
5,giá không đủ đắt để mặc nếu nó không phải rất dày nhưng nó không phải mỏng ở đường may may không phải rất gọn gàng
