rating,review
1,ghét kinh khủng đặt tiền bốn bộ đồ hơn bốn trăm mà giao một bộ váy một cái quần váy báo giả hàng thì shop bảo sẽ bù hàng mà cả tháng nay bốc hơi luôn cướp tiền khách hàng làm ăn dối trá
5,thiết kế phong cách hợp thời trang thiết kế phong cách hợp thời trang chất liệu cotton mềm mại thoáng khí bao gồm bảo hành tiện lợi dáng chữ a tôn dáng
5,lý tưởng cho việc mặc khi mang bầu
5,phù hợp giá mềm
5,chiếc váy đa năng cho công việc các dịp bình thường thiết kế cổ áo sơ mi cổ điển
5,chất vải đẹp ôm body lần sau sẽ ủng hộ shop thêm
5,váy đẹp nha mọi người vải mềm họa tiết dễ thương giao hàng nhanh
5,cái viền cổ hơi ngứa nên mình tháo ra luôn vẫn đẹp lắm lại còn rẻ mát nữa chứ
5,thiết kế cổ tròn thời trang chi tiết thêu tinh tế hoàn hảo cho trang phục hàng ngày váy dễ thương cho bé gái thiết kế cổ tròn thời trang chi tiết thêu tinh tế
5,thoải mái thoáng khí chi tiết thêu tinh xảo hoàn hảo cho trang phục hàng ngày thiết kế cổ tròn thời trang hoàn hảo cho trang phục hàng ngày
5,thiết kế hoa đẹp mắt chi tiết thêu tinh tế phù hợp cho độ tuổi 27 tuổi thiết kế cổ tròn thời trang
1,giao hàng không như trong hình shop này lừa đảo treo đầu dê bán thịt chó mọi người không nên mua đặt hàng shop này
5,dễ mặc phù hợp với nhiều dịp
5,đẹp lắm nha mọi người chất dày dặn lâu lắm mới mua được đồ ưng nhân viên
5,vải đẹp giao nhanh đầm giống hình dáng to hơn với mình màu đen bận siêu trắng da
5,ok rất đẹp
5,rất đẹp đúng mẫu hơi to so với mình nhưng không sao sửa lại xíu đẹp
5,lỗi 1 chút nhưng thấy vẫn đẹp
5,chất liệu chất lượng cao cho độ bền thiết kế thanh lịch cho các dịp đặc biệt vải mát mẻ thoải mái
5,vải mát mẻ thoải mái thiết kế thanh lịch cho các dịp đặc biệt đầm đẹp cho đám cưới
5,hình ảnh chỉ mang tính chất nhận xu chi tiết nơ lưng hút mắt
5,áo đầm đẹp họa tiết tươi sáng trẻ trung
5,áo đầm đẹp vải nhẹ mát không nhăn
5,áo đầm đẹp thời trang
5,đẹp lắm ạ đầm đẹp y hình luôn ạ
5,đẹp nha nhận hàng xem hàng cảm thấy tuyệt lắm đầm rất đẹp luôn ý ạ cảm ơn shop nhìu
5,đẹp lắm
5,vải đẹp may đẹp hàng rất ok cám ơn shop
5,đầm mặc nhẹ eo dáng vừa đẹp hoa văn nhã nhặn độ co dãn nhẹ nhưng không biết mặc mát không hàng đóng gói ổn tặng shop 5sao
5,áo mặc đẹp độ co dãn tốt
5,trời ơi mua đồ nhiều rồi mà lần này thất vọng quá áo quá rộng vải quá mỏng may quá sơ sài không thể mặc được rồi bây giờ không biết làm gì được mặc ngủ cũng không được đâu vải rất nực
5,chất liệu
5,giao hàng nhanh đóng gói cẩn thận hàng chính hãng lần sau sẽ ủng hộ thêm
5,màu trắng vải hơi mỏng nhưng rộng rãi giá rẻ tạm ổn chất lượng tạm chức năng tạm được
4,kiểu đầm đẹp mua cái màu xanh đợt này mua thêm đen mà cái đầm dính dơ quá trời vậy mà shop vẫn giao cho khách được nữa shop nên nhớ giá trị hàng rẽ cũng khách bỏ tiền mua chứ không phải hàng tặng bán phải phải tâm tí xíu
5,thoáng khí thân thiện với da thời trang thanh lịch chất liệu vải mềm mại thoải mái
5,đầm đẹp rất ok nhưng tay áo không dài như trong hình mà tay lỡ thôi nha
4,đầm đẹp mà hơi ngắn nếu dài 1 chút thì đẹp hơn áo mấy người lùn mặc đẹp hơn
5,đúng mẫu đẹp quá ưng ý luôn ạ
4,vải nóng ai mà thích mát không nên mua
5,đầm đẹp ok nha
5,đầm dài phong cách thời trang lý tưởng cho các dịp thường ngày
5,thiết kế baby doll dễ thương chất liệu mịn mượt thoải mái tuyệt vời cho kỳ nghỉ biển phù hợp cho bạn gái cao tầm 1m65 mình 1m55 nên phải cắt ngắn lên 10cm
1,váy rất xấu không giống ảnh hoạ tiết ít vải nóng mặc rất lộ nội y mọi người nên suy nghĩ kĩ khi mua
5,váy đẹp như mô tả vải thun co giãn ốm mập mặc thoải mái nhé
5,trước đó mình mua một cái màu đỏ để tặng chị sau đó mẹ mình muốn cái màu trắng đen nên mình mua thêm cái này
5,giá trị tuyệt vời cho giá tiền vừa vặn tôn dáng cho mọi dáng người lý tưởng cho các dịp thường ngày trang trọng
4,chất vải hơi nóng nhưng váy kiểu dáng đáng yêubé rất thích
5,vải với màu thì ok lắm nhưng đúng không thể sắc sảo như đồ shop được mình mua thử thấy hợp với giá tiền chứ không thể so sánh với hàng hãng cảm ơn shop giao nhanh lắm
5,thiết kế công chúa đáng yêu
5,phong cách phương tây sành điệu chất liệu cotton thoải mái
5,họa tiết hoạt hình dễ thương
5,hàng giao không đúng mẫu màu không đúng làm ăn đầu năm mất uy tín đặt nhung ma giao thun né shop này ra
4,đặt màu đỏ giao màu đen
5,mình đặt màu đỏ mà giao màu đensản phẩm cũng ok tiền nào của nấy thôi
5,shop giao đúng sản phẩm sản phẩm đẹp nhưng hơi chật giao hàng nhanh shipper nhiệt tình mọi người nên mua ủng hộ shop cho shop 5 hình ảnh chỉ mang tính chất nhận xu
5,áo rộng hơn mình nghĩ chất liệu vải kaki
5,hàng tốt chất vải đẹp lắm nên mua nha mọi người shop cute nữa cơ hội lại ủng hộ tiếp
5,m50 42kg áo mặc với váy khác cx đẹp lắm nha chất hơi mỏng nhưng lên dáng vẫn đẹp đang bị đau mắt nên đeo kính hơi lạc quẻ
5,tay ngắn mang lại cảm giác thoáng mát hoa văn thời trang nữ tính
4,vật liệu loại thể kéo dài rất thoải mái
5,nhận được hàng đúng mẫu đúng hình đóng gói cẩn thận trước khi giao đẹp mình sẽ quay lại ủng hộ thêm cảm ơn shop cho bạn sipber 5 nhiệt tình thân thiện hình ảnh chỉ mang tính chất nhận xu
5,hàng như mẫu vải đẹp kiểu dáng trẻ trung sẽ ủng hộ shop lần sau
5,hàng như hình thank shop hàng như hình thank shop hàng như hình thank shop hàng như hình thank shop
5,dễ dàng kết hợp phụ kiện chất liệu cotton chất lượng cao vải mềm mịn nhẹ nhàng thiết kế đa năng thời trang lý tưởng cho các bà bầu dáng vẽ tôn dáng nữ tính phù hợp cho các cỡ từ 40kg đến 80kg
5,nhận được hàng đặt từ người bán cảm ơn bạn rất nhiều
5,nhận được trong tình trạng tốt vật liệu khá ổn
5,váy đẹp nhé chất hơi nóng tuy hàng nc ngoài nhưng vài hôm hàng mk m540 cân mặc s thấy vẫn rộng bụng xíu ngoài nhìn đơn hơn nhiều trên ảnh mua với giá này quá đẹp lun
5,sản phẩm tốt trong tầm giá
5,đẹp hết nước chấm
3,giao hàng không đúng màu đặt vải nóng bán hàng không tâm
5,chất lượng tốt phù hợp giá tiền chất lượng ổn phù hợp giá tiền
5,họa tiết đơn giản đa năng chiều dài dưới đầu gối thanh lịch chất vảo dáng váy rất đẹp thiết kế dễ thương như tiên cánh vải cotton chất lượng tốt hình ảnh minh hoạ nhận xu
5,chất liệu cotton thoải mái tay áo bèo thời trang thiết kế dễ thương như tiên cánh chiều dài dưới đầu gối thanh lịch thiết kế dễ thương như tiên cánh chất liệu cotton thoải mái chiều dài dưới đầu gối thanh lịch
5,thun cột tóc khuyến mãi không phải đầm
5,màu đen cổ điển
2,lừa đảo người mua váy bằng comment về đây tóc à shop quá mưu mô gian dối hình ảnh chỉ mang tính chất minh họa
5,sản xuất tại việt nam chất liệu vải cotton chất lượng cao màu đen tạo nên vẻ ngoài thời trang mẫu hoa văn chữ cái độc đáo
5,chất liệu vải không đẹp dãn dáng may không đẹp không mua lần 2 nữa
1,vải xấu
4,hàng tạm được nhung dính vết dơ không giật ra lần sau giao hàng cho khách phải chú ý
3,chất vải cũng tạm chỉ may lỗi khá nhiều
3,áo thì nhỏ vải hơi mỏng trong hình thì đẹp ok nhưng rất tiếc ở ngoài thì quá tệ
5,chất liệu ổn số với giá tiền
3,váy đẹp nhưng shipper nói chuyện hơi quạo nha… chúc shop bán đắt
5,mềm mại thoải mái hoàn hảo cho trang phục bà bầu thiết kế búp bê em bé dễ thương kiểu dáng rộng rãi tôn dáng
5,thoải mái dễ chịu chất liệu mềm mại thoáng khí
5,áo ngực xếp ly đáng yêu eo ơi t thật sự rất thích cái đầm này luôn đó trời
5,hàng giống mẫu nhưng vải không được đẹp mình cảm giác nóng mà do mình mua đi đl nên cũng không đến nổi
5,cũng được
5,nhận hàng đúng như quảng cáo đóng gói kỹ lưỡng giao hàng nhanh ảnh video mang tính chất nhận xu nhé cho shop 5 sao
5,vải 2 lớp hơi mỏng không sao bầu nên mặc mát cũng được màu như hình
5,đầm đẹp giống như hình nhận hàng nhanh nói chung mình hài lòng mua lại rẻ nữa
5,thời trang hiện đại vừa vặn hoàn hảo
3,đặt màu đen mà gửi màu trắng
5,đúng mẫu nhưng vải nóng
1,quá tệ giao hàng không giống như mẫu
5,dễ mặc
5,đẹp ạ
5,vải co giãn cho sự vừa vặn thoải mái vải cotton mềm mại mịn màng hoàn hảo cho mùa hè với thiết kế rộng rãi váy bầu thời trang thoải mái
5,đầm bầu thời trang thoải mái lý tưởng cho mùa hè với thiết kế rộng rãi vừa vặn làm đẹp cho phụ nữ mang bầu
5,chất liệu co giãn để vừa vặn thoải mái
5,sale rẻ phù hợp với giá tiền chuẩn bị hàng giao hàng nhanh shipper nhiệt tình
5,màu trắng kem đẹp mắt đầm dáng đến gối sang trọng thiết kế hở lưng gợi cảm
5,chất liệu mềm chất lượng cao đầm bầu đẹp mắt kiểu dáng váy trẻ trung nhưng giao màu khác với khách đặt
5,chất lượng
5,đầm đẹp như hình
5,đầm xoè chất umi dày dặn đẹp vải umi mềm mịn kèm gắn cổ đầm túi dáng dài qua gối che khuyết điểm chân nên mua nha mọi người
5,ren đẹp dễ mặc thiết kế độc đáo chi tiết đẹp kiểu dáng hiện đại
5,đầm may kiểu dáng đẹp vải thun dày mịn co giãn đúng mô tả thêm trâm cài đẹp ok shop cảm ơn nha
4,chưa mặc bị sờn rách rồi
5,tuấn ngọc kết hôn với ca sĩ thái thảo con gái của nhạc sĩ phạm duy vì vậy lữ liên phạm duy thông gia
5,đẹp ok ủng hộ shop
5,chiều cacân nặng giao hàng không đúng như hình áo thì đẹp mà ngắn chứ không dài như hình
5,hàng rất đep cho shop 5 sao sẽ tiếp tục ủng hộ dài lâu nha nha nha
5,rất đẹp
5,thiết kế độc đáo
5,đầm đẹp lắm nha nhìn cưng lắm luôn mặc lên ai cũng khen dễ thương lần sau chắc lấy thêm màu hồng hình ảnh mang tính chất lấy xu thôi
5,cảm ơn shop mình nhận được hàng rồi váy đẹp lắm shop ạ vải mềm mịn rất thích mến tặng shop 5 nhé yêu shop nhiều
5,váy rẻ đẹp xinh ship hàng nhanh chất vải mềm mát rất ưng sẽ ủng hộ shop thêm khi thấy mẫu phù hợp
5,váy xinh nha vải mát mình m53 mang vừa nè ai cao hơn thì mình nghĩ mang sẽ hơn bị ngắn chút nhé
5,giao hàng hơi lâu xíu nhưng chất lượng sản phẩm tuyệt vời với mức giá nhé
5,bầu 4th 55kg ngực 92cm bị chật ngực nha mọi người váy đẹp giá rất oke may kỹ ạ nhưng chật v1 tiếc ghê
5,hàng đẹp mặc thoải mái lắm mua lần 1 ròi mua thêm lần 2 với 3 cái luôn thiết kế thanh lịch dành cho các bà bầu
5,đồ xinh giao hàng nhanh cho shop 5
5,đồ ôm body thun gân mặc lên đỉnh lắm shop ơi
5,vải đẹp dáng đẹp giá lại quá rẻ sẽ tiếp tục ủng hộ shop nha cho 10đ
5,đầm dáng aline theo xu hướng chất liệu mềm mại thoải mái hoàn hảo cho buổi tối đầm hồng thanh lịch vừa vặn tốt với dây đeo điều chỉnh đường may tỉ mỉ chất liệu mịn màng thoáng khí
5,shop đóng gói kỹ càng hàng vận chuyển nhanh shipper dễ thương
5,đầm maxi tôn dáng dễ dàng phối đồ vải mềm mại thoáng khí thiết kế đơn giản nhưng thanh lịch
5,chất mỏng
5,đóng gói cẩn thận giao hàng siêu nhanh shipper nhiệt tình 5 sao cho shop
5,váy đa năng phù hợp len giãn mua lúc giá khuyến mãi hơn 43k nhược điểm cổ áo sâu hở ngực phù hợp dáng người nhỏ nhắn
5,hàng tặng kèm khi mua đầm mình cũng không xài dây thun nhỏ xíu hà
5,chất liệu vải cao cấp dễ mặc shop đóng gói rất đẹp mở ra thiện cảm liền lại còn quà tặng cám ơn shop
5,đầm cũng ok nè mà đầm cái mùi vải hoi quá để giặc sạch mặc thử xem sao
1,chất lượng kém
5,đầm đẹp vải dày dặn shipper vui vẻ nhiệt tình hài lòng cảm ơn shop
5,hàng đẹp mặc vừa y
5,chất liệu giống mô tả
5,đầm đẹp quá ổn so với tầm giá không bị mỏng đâu chất vải thích lắm mọi người cứ mua nhé
5,vải mỏng dễ rút sợi mặc lên dáng cũng ổn giá cũng rẻ
5,hàng hơi mỏng khóa may mình mặc bị phồng ở phần dưới gáy
5,áo đẹp lắm
5,hàng đúng mẫu
5,tự tin hẳn khi mặc đầm hoa nhí hồng bạn bè thích gửi đặt dùn 3 chiếc khác
5,thiết kế thanh lịch nữ tính bạn bè ai cũng thích nhờ mua dùm 3 chiếc nữa
5,váy đẹp như hình hơi tối màu hơn hình xíu chất vải ok mình mặc vừa in dài quá đầu gối
5,chất liệu thoải mái co giãn chất lượng tuyệt vời với giá cả phải chăng giao hàng nhanh cảm ơn shop
5,dễ mặc phù hợp với nhiều dịp chất liệu vải cao cấp
4,hàng khá tốt đẹp ổn mặc mát giao hàng nhanh
5,qua dep nen mua nha moi nguoi
5,giao hàng lâu đầm mỏng nhưng cũng đẹp ok
5,ấm áp thoải mái cho mùa đông
5,đầm đẹp
5,rất ưng ý sẽ mua ủng hộ tiếp
5,giáo hang ok còn hàng thì không đúng mầu
5,giao hang đúng mẫu nhưng mai 2 đường viền nhúng thấy gớm
3,nhìn dáng dáng nhỏ mình 54kg mặc chặt nhưng chất liệu hơi nóng mình giặt mấy lần thấy chất vải hơi sờm hình ảnh mang tính chất minh họa dáng hơi ngắn
5,váy đẹp lắm shop nhé chất mềm mát
4,hình thức cũng ổn vì hợp với dáng người của mình chất vải xịn hơn thì tốt tiền nào của ấy
5,chất lượng không mong đợi như ảnh chiều cao 160cm 68kg thể vừa cỡ 2xl nhưng không thể che bụng
5,hàng ok vừa zise vải mềm mại thiết kế kim cương tuyệt đẹp cổ áo tròn đa năng váy ôm sát thân hình màu đen tôn dáng
5,đầm đẹp vải đẹp mềm mại kiểu dáng y hình mong sẽ mặc vừa phù hợp
5,nhận được hàng rồi okie giao hàng nhanh chóng shipped vui vẻ nhưng vải hơi mỏng nhẹ vừa túi tiền tiền nào của nấy
5,vải mềm mại chống nhăn đầm đa năng phù hợp với nhiều phong cách eo dây rút tiện lợi chất liệu nhung cao cấp
5,trên hình thì thấy dày với bóng nhưng mà ngoài thì vải mịn điều nó hơi nhỏ xíu mình cao m6 50kg lận nên còn hơi ngắn nói chung vậy cũng ok nà
5,đẹp hơn mình nghĩ chất vải oki đẹp
5,với giá tiền này thì đầm ok lúc đầu tưởng vải phi bóng ai ngờ vải thun nhưng đâm cũng ok mình 42kg mắc vừa y luôn nha
3,chất lượng như mong đợi chiều cao rất ngắn rất thất vọng
5,mua sale giá rẻ đầm cũng ok nhé miij người rộng thoải mái hơi dài mặc ở nhà cắt ngắn lên xíu cho gọn
5,chất liệu tuyệt vời rất thoải mái nhưng vải hơi mỏng cảm ơn lazada nhiều nhé
5,đầm đa năng phù hợp với mọi dịp vừa vặn làm tôn lên dáng người chất liệu tuyệt vời rất thoải mái chất liệu chất lượng cao không nhăn nhúm dễ dàng
5,giữ mát trong thời tiết nóng váy đa năng cho mọi dịp thiết kế đẹp hoàn hảo cho mùa hè
5,rất đẹp mặc lên chụp hình xuất xắc lắm lun giá lại ok đi biển chuẩn lun ạ
3,giao không đúng màu
5,đầm rất đẹp đường may khéo sẽ ủng hộ lần sau tặng 5 sao cho shop
5,chất liệu vải cao cấp phù hợp với nhiều dịp thiết kế độc đáo dễ mặc hình ảnh để lấy xu
5,áo may đẹp khéo vải mặc rất thoải mái đặt nhầm màu nhưng shop cho đổi lại giao hàng nhanh chóng mua 2 lần tặng shop 5 sao
5,mua màu này mà đưa màu tối thui cho người ta cái đầm màu cho bà già mặc shop xảo trá làm ăn gian dối không nên mua uổng tiền nha mọi người
5,ok đẹp nhưng side hơi nhỏ 5
5,đăng hình mô tả thấy váy dài lắm mà nhận được chỉ qua khỏi gối xíu thôi
5,màu đẹp
5,vải mỏng
5,váy đẹp giao hàng nhanh
5,thiết kế thanh lịch hợp thời trang vải lụa sang trọng cổ tròn thoải mái kèm quà tặng
5,hoàn hảo cho văn phòng tiệc tùng vải lụa sang trọng cổ tròn thoải mái thiết kế thanh lịch hợp thời trang váy đa năng cho mọi dịp
5,cổ tròn thoải mái vải lụa sang trọng thiết kế thanh lịch hợp thời trang độc đáo bắt mắt
5,nhận hàng ưng quá trơi ưng chất vải đẹp như mua ngoài shop vậy ưng cái bụng dã man
5,chất liệuok
5,ren đẹp chất liệu vải cao cấp dễ mặc sức hút của phái nữ
5,không hợp
5,dáng hơi nhỏ bình thường mặc l nhưng mẫu này l hơi ôm nói chung cũng ok
1,áo thêu lỗi chất liệu vải tệ cho 1 sao
1,rất tệ về hình thức chất lượng
5,đầm dáng đẹp đúng mẫu hơi rộng 1 chút với lại ở phần trên mỏng mang vào đâm vào người ngứa với hơi cảm giác châm chích vào người hơi đau nhẹ nha lỗi nhẹ ở 1 vài nơi ở phần vải mỏng nha
5,hàng đẹp lắm cả nhà ơi mùa đi chơi đi tiệc đều được sẽ ủng hộ shop đều
5,phong cách hàn quốc với chút kiểu pháp lý tưởng để che bụng dáng váy alie tôn dáng thiết kế cổ tròn đẹp mắt
5,video để nhận xu giao nhanh vải hơi cứng dáng rộng nên thoải mái
5,hàng nhận được đóng gói kỹ sạch sẽ giống quảng cáo nhưng chất liệu thô cứng không được rũ nên mặc vào thùng thình không ra dáng của kiểu váy này
5,tuy vải hơi mỏng nhưng với giá tiền như vậy rất hợp mặc vào rất đẹp nên mua chụp ảnh một lần nhaa
5,hàng xinh ơi xinh giao đủ 2 set mọi người nên mua
5,phù hợp cho các bà bầu cỡ lớn chiều dài dưới gối để giữ sự kín đáo dễ dàng di chuyển váy dáng dài to phù hợp cho các bà bầu mặc cũng mát mẻ ok lắm nha
5,váy thích hợp mặc ở nhà vải không đẹp lắm hàng nút hơi dài dễ dàng di chuyển thoải mái sang trọng
5,váy dáng suông đơn giản nhưng thanh lịch thoải mái sang trọng thiết kế linh hoạt cho mọi dịp
5,dễ dàng di chuyển chất liệu mát thoáng khí phù hợp cho các bà mẹ ngoại cỡ vải cotton siêu mềm co giãn đúng kiểu mình thích
5,màu hồng nhạt rất đáng yêu mềm mại thoải mái màu hồng nhạt rất đáng yêu màu hồng nhạt rất đáng yêu màu hồng nhạt rất đáng yêu
5,mềm mại thoải mái hoàn hảo cho giấc ngủ màu bơ độc đáo mát mẻ thoáng khí cổ vuông đẹp
5,đẹp quá shop ơi
5,kiểu dáng hiện đại chất liệu mịn mềm phù hợp với nhiều dịp lễ hội tặng shop dịch vụ giao hàng 5sao
3,đầm như cải lương ấy
5,tay áo năm phần tư thoải mái tốt để che bụng phong cách thời trang thông thường cho vẻ ngoài thoải mái chiều dài hoàn hảo cho mặc hàng ngày
5,vải mỏng đường may không đẹp mặc trong nhà thì ok
5,hàng hóa đến từ nước ngoài chờ đợi không lâu lắm chờ khoảng một tuần không quá lâu vải mỏng thoải mái phù hợp tổng thể tốt
5,váy đa năng phù hợp nhiều dịp phù hợp cho người cân nặng lên đến 75kg phù hợp cho phụ nữ mang bầu vải mát không nhăn
5,váy ok nha mọi người rộng rãi thoải mái
5,nên mua ạ shop tư vấn nhiệt tình shipper giao hàng nhanh tầm 2 hôm hàng liền tay nhé các chị 3 xinh lắm í em 555kg m52 mặc ok nhé
5,nhận được hàng váy đẹp giao nhanh tks shop tặng shop 5 sao
1,giao hàng sai không đúng bán hàng tào lao
5,váy suông thoải mái thiết kế dễ thương giao hàng nhanh chóng váy dễ thương cho học sinh tiểu học
5,giao hàng nhanh tư vấn nhiệt tình vải thấy hơi xờn 1 xíu chấp nhận được
5,đóng gói cẩn thận giáo hàng nhanh đặt hôm qua mà nay nhận được hàng vải dày dặn đẹp
5,váy đẹp mặc dễ thương thoải mái vải mềm mịn mang mát shop gửi hàng nhanh
5,chất lượng hết nước mắm cho shop 5 saomn ủng hộ shop nha
5,chất liệu thoải mái mềm mại phù hợp cho người hình dáng cỡ lớn đầm bodycon tôn dáng
5,giá trị tuyệt vời cho giá tiền hoàn hảo cho một buổi tối ra ngoài chiều dài midi thanh lịch
5,phù hợp với nhiều dịp thiết kế độc đáo dễ mặc sức hút của phái nữ hiệu ứng giảm cân cắt đẹp chi tiết đẹp kiểu dáng hiện đại
5,giặt ủi xong dễ thương như hình áo thun đen ít co giãn liền váy không phải thun lưng thun nhuyễn 5 sợi phia sau được
5,chất vải đẹp váy mặc đi tiệc ai cũng khen xinh ưng lắm nha shop
5,hàng đẹp y hình chất lượng
5,đầm hoa đẹp mắt
5,dam thun thuong thoi tai re ma
5,ok áo đẹp cho shop 5sao nhé
5,hàng đẹp nhé
5,chiều dài váy không như trong hình mô tả chất lượng phù hợp với giá tiền
5,hàng rất ok cám ơn shop
5,tốt
5,hàng nhận chưa mở nên chưa biết chất liệu vải hàng ship nước ngoài nên cực lâu
5,áo sơ mi bị nhỏ váy vừa vặn xinh xắn
5,áo sơ mi thiết kế nhỏ
5,sam bị tóm can thiệp thẩm mỹ qua ống kính chân thực của lan ngọc trong đám cưới midu
5,hàng tặng kèm khi mua đầm mình cũng không xài dây thun nhỏ xíu hà màu đen thời trang
5,màu hồng dễ thương màu trắng thanh lịch
5,màu chun cột tóc đẹp
1,bán đồ không uy tín hình ảnh hàng hoá khác xa nhau chất liệu kiểu dáng xấu quá thất vọng chất liệu mô tả đầm voan hàng gửi lại thun kiểu dáng khác xa với hình hoàn toàn
5,hoa màu như hình đăng nhưng trên thục tế thì khg đẹp vải móng
5,người đem hạnh phúc vẻ vang… mang theo gấm hoa cho nước nhà
5,kiểu dáng như hình vải thun phù hợp giá tiền
5,váy đẹp như hình ạ mỗi tô em hơi lùn nên không được đẹp như mẫu nhưng mà mà ai cũng khen vui rồi
4,chất lượng ổn nhưng khá mỏng
5,đẹp chất lượng tốt
5,dầm này vừa mà màu cũ quá nên thôi shop đề nghị sau giao mẫu mới mới đừng lấy mẫu cũ giao cho khách nữa nhan
5,váy giống hình nhưng mà bạn nào từ 47kg trở lên đến 55kg mặc thì được nha mình mới 42kg mặc bị bơi trong váy bị rộng cái vai với nách ấy
5,nói chung chất vải giá tiền hợp lý đầm rất to đến lúc đẻ vẫn vừa luôn ấy
5,chất liệu cao cấp hoàn hảo cho các dịp đặc biệt vừa vặn hoàn hảo
5,tạm
1,hàng gia không dụng mô ta
5,đặt màu trắng giao màu đen
5,hàng đẹp nha
5,chất lượng kém
5,chất vải khá ok 1 lớp nhưng không mỏng không lộ mấy
5,váy đẹp lắm nhưng vảy hơi mỏng một xíu cũng chưa mặc thử nên không biết thế nào nhưng với giá tiền này thì cũng khá tốt rồi ạ anh shipper cũng thân thiện nữa nhìn chung thì đánh giá 5 sao trước ạ
5,giao hàng nhanh váy vải hơi mỏng nha mọi người nên mặc áo quần ngẳn bên trong sẽ tốt hơn nhưng so với giá tiền thì cx đáng cho shop 5 sao nèk
5,không gióng ảnh cổ áo không thắt nơ
5,hàng rất okk luôn nha mọi người phù hợp với giá tiền luôn mùa hàng về cự sợ rách hay hư hỏng nhưng không sao mọi người ạ hàng rất ookkk luôn
5,áo khoát trong hình thì màu trắng mà ship mau đỏ
