rating,review
5,kiểu dáng váy aline thời trang chất liệu cotton thoải mái
1,chất vải thô mặc không giống hinh
3,chất liệu vải thô mặc nóng đường chỉ không đẹp không chắc chắn
5,đầm bầu thời trang
5,sản phẩm tốt
5,shop giao hàng đúng mẫu đúng màu chất liệu vải cũng ok nhưng mình 40 cân không mặc được hơi rộng nha
5,đẹp vải êm đáng ủng hộ shop
5,ok
5,vải chất lượng cao mát mịn khi tiếp xúc với da
5,ban đầu mua kiểu hên xui thôi không ngờ khi nhận thì thật sự giá rẻ so với hàng nhận
5,chất liệu có áo mới áo cũ
5,ok chất liệu ok
3,không phải chất liệu len chỉ vải thun thường nhé cả nhà tạm được thôi
5,thích hợp cho dịp khác nhau dễ mặc quyến rũ nữ tính hiệu ứng giảm béo vải mịn mềm váy trắng đẹp
5,đầm vải thun mỏng không xoè dáng aline tôn dáng nữ tính tay ngắn thoải mái
5,chất lượng hàng hóa rất tốt tốc độ vận chuyển hậu cần không tồi hàng hóa được đóng gói chắc chắn không hư hỏng
5,mua giùm nên cũng không biết sao nữa ạ không thấy nói gì nên chắc cũng ok
5,chất liệu ok
5,đẹp y hình
5,đẹp
5,mình cao 1m63 mặc không vừa bé 1m40 mặc vừa vải mềm mịn ai nhỏ tầm 1m50 thì mặc đẹp nha màu đẹp nhìn dễ thương
5,đầm rất đẹp nhá mọi người
5,thích hợp cho dịp khác nhau dễ mặc vải chất lượng tốt lót thoải mái đến đúng giờ
5,thiết kế váy đẹp mắt váy thời trang phong cách cổ tròn linh hoạt váy ôm body tôn dáng cổ tròn linh hoạt
5,váy xinh lắm nha mọi người đóng gói cẩn thận giao hàng nhanh lên mua nha mọi người sẽ quay lại ủng hộ shop ạ
5,nói chung với giá tiền này thì hàng cũng được chỉ toàn vắt sổ ngay tay áo còn bị sứt chỉ
5,hàng đẹp nên mua
5,nói chung đồ đẹp đó chỉ điều mình trừ hao nên giờ đồ nó rộng quá không biết làm sao đây giao hàng nhanh đồ lại đẹp nữa
3,giống trong hình 
5,vải không đẹp nhưng cũng ổn
5,nhanh
5,mềm mại thoải mái giao đúng hàng đóng gói cẩn thận
5,hàng ok
5,mặc tôn dáng lắm vải đẹp đường may cẩn thận sẽ tiếp tục ủng hộ shop
5,mua được giá sale nên hời lắm shop giao cực nhanh đóng gói cẩn thận nữa like like like
5,em ấy ngoài còn đẹp hơn hình mặc lên đẹp lắm tặng shop 5 sao
5,y như hình mih 55ky vừa lắm co thun phía sau nên bự người hơn mặc vẫn vừa nha
5,hàng không được đẹp nè
3,chất liệu
5,nhận được hàng rồi giao hàng rất nhanh chóng chất lượng rất ok
5,rất đẹp giá rẻ rất nên mua không gì để chê hết nhé phù hợp với nhiều dịp chất liệu mịn mềm dễ kết hợp
5,dáng đẹp chất liệu phù hợp với giá tiền giao hàng đúg ngày dự kiến
5,shop uy tín bán hàng đúng như mô tả đánh giá shop 5 sao dịch vụ tốt
5,vải hơi nóng chấp nhận được với giá tiền mặc lên rộng rãi thoải mái hình ảnh mang tính chất nhận xu
5,đầm cực xinh á
5,xuất xắc lắm ạ
5,không ưng so với tưởng tượng cho lắm
5,dáng đẹp nhé chất cng mát nói chung giá vậy ok rồi nó lười chụp hình cho shop 5sao
5,chất lượng ok hợp với giá tiền
5,đúng màu đúng size mặc đẹp cảm ơn shop
5,váy chất liệu ok giá hợp lý
5,mua thử cái màu đỏ mặc xem như thế nào nào không ngờ xinh vừa y luôn nên đặt thêm cái màu vàng còn xinh hơn nữa tính mua thêm mà hông mẫu khác mình thích sẽ ủng hộ shop tiếp
5,lần đầu tiên mua cái váy mà ưng hết sức un ak hình ảnh mang tính chất minh họa
5,kiểu dáng giống hình mình mua về thích nó hạt cườm nên mình mua hạt đính vào sửa chỗ tay áo cho nó đỡ già shipper giao hàng uy tín
5,mình mua 1 bộ đỏ trước đó thấy ưng nên phải mua thêm bộ vàng với giá 70k thì như vậy ổn không gì bàn cãi điều vải vàng hơi mỏng hơn đỏ bị nhăn nhiều hơn nhưng nhìn chung minh họa vẫn rây hài lòng
5,chất liệu vải mềm mát giao hàng nhanh may đẹp sẽ ủng hộ lần sau
5,váy bằng thun dỏm quá luôn thun chưa mặc chảy xệ giản rồi đường may cẩu thả thất vọng quá
5,thiết kế hoa đẹp mắt váy dài thanh lịch váy dài thanh lịch phong cách thường ngày linh hoạt
5,hình dáng váy chữ a tôn dáng hình dáng váy chữ a tôn dáng màu xanh tươi sáng màu đỏ lộng lẫy kiểu dáng thoải mái với đường viền vai
5,phong cách thường ngày linh hoạt kiểu dáng thoải mái với đường viền vai hình dáng váy chữ a tôn dáng họa tiết in ấn đẹp mắt
5,nếu mặc váy này không mặc bra thì sẽ lộ nhé các bạn nó rộng quá so với ảnh nhưng chất cũng khá ổn
5,shop giao hành nhanh váy dài ưng ý luôn chất vải cũng rất ok nữa sẽ mua thêm ủng hộ shop
5,váy xinh lắm nè mỗi tội lưng hở hơi sâu ấy nhưng với giá này chất lượng quá ổn rùi nha
5,tươi ngon đầy hương vị đóng gói tiện lợi từng gói tuyệt vời cho một bữa nhẹ nhanh chóng thơm ngon bổ dưỡng đóng gói tiện lợi từng gói
1,shop gian lận mua size l shop giao size xl mình 57 không mà giao cái đầm chắc 80kg mặc ak giao size lớn hơn rồi xé size cắt size áo làm ăn như vậy chắc bền
5,giao hàng nhanh chóng đáng tin cậy phù hợp với người cỡ lớn thiết kế thời trang thoải mái
5,giá trị tuyệt vời cho giá cả dáng vẻ tôn dáng thon gọn dịch vụ khách hàng xuất sắc
5,giao hàng nhanh chóng đáng tin cậy
5,nhận đầm lỗi nt cho shop không trả lời biết bán thôi còn không biết xử lý vấn đề khi gặp lỗi
5,tạm ổn nhưng giao hàng lâu lắm nha mọi người
5,giống hình đầm đẹp lắm không ngờ nó đẹp vậy lun á cho shop 5 sao nè lần sau sẽ ủng hộ shop nữa nhé
5,vải đẹp dáng đẹp nói chung hài lòng
2,không đúng mẫu không giống hình
5,hàng giao nhanh giao đủ dóng gói cẩn thận hợp giá tiền sẽ ủng hộ tiếp
5,gói hàng mình nhận được giống như hàng mình đặt hàng gửi đi rất tốt không gì sai sót nói chung mình rất hài lòng về hàng hóa
5,váy xinh chất liệu tạm ổn phù hợp với giá tiền mua lại lần 2 giao hàng nhanh
5,đầm rất dễ thương vải mềm mịn đúng dáng đường may tỉ mỉ rất hài lòng
5,chiều dài đến đầu gối phong cách kín đáo tay áo ngắn giúp thoải mái
5,lựa chọn tuyệt vời cho bà bầu
5,đầm giống mẫu
1,gửi hàng về 2 lần đều không giống hình ảnh sài bét hàng phếch
5,đầm xinh vải nặng tay mát dáng đẹp tôn dáng giao hàng siêu nhanh chỉ lỗi 1 chút ở đường may dễ bị bung
5,hoàn hảo cho tiệc sang trọng giống hình giống mô tả mút ngực áo đẹp đáng mua
5,tay ngắn tôn dáng
5,đầm đẹp lắm cảm ơn shop nhé
5,dễ dàng phối đồ đầm đen thời trang vải nhẹ thoáng khí lý tưởng để thư giãn tại nhà dáng aline tôn dáng
5,lý tưởng để thư giãn tại nhà hoàn hảo cho các buổi đi chơi bình thường tuyệt vời cho buổi đi dạo trên bãi biển hoàn hảo cho các buổi đi chơi bình thường
5,dễ dàng phối đồ lý tưởng để thư giãn tại nhà lý tưởng để thư giãn tại nhà lý tưởng để thư giãn tại nhà
5,mình nhận được áo đầm của shop hàng mẫu mã ok dễ thương giao hàng nhanh nhân viên giao hàng dễ thương trải nghiệm kết quả tốt sẽ ủng hộ shop lần sau nha tặng shop 5 sao
5,họa tiết sọc đen trắng thời thượng vải mềm mịn nhẹ nhàng thoải mái sang trọng
5,hàng đẹp chuẩn xịn nhé giao hàng đúng mẫu đúng sai không thể hàng lại quá xịn vậy
5,thích hợp cho đi chơi thường ngày không dày
5,nhận được trong tình trạng tốt vật liệu mềm thiết kế đẹp
5,vải dày dáng đẹp lắm mọi người nên ủng hộ shop nhé mình sẽ mua thêm màu xanh 
5,giao hàng nhanh đồ đẹp hơn so với giá tiền ôm body lắm nên mua 1 chiếc để mặc nhiều dịp
5,vải dày mịn co giãn tốt lên dáng đứng dáng đẹp mình m65 47kg mặc dài qua gối nhé mng xinh quá xinh
5,quyết định rinh 2 em cho đủ màu thay đổi đầm xuất sắc lắm shop ơi mình sẽ ủng hộ shop dài dài nhé
5,đầm dày đẹp vải mịn giá rẻ nữa ship hàng siêu nhanh nhé rất đáng mua mình hơi mập chút
5,mình nhận được rồi ôm dáng rất đẹp ạ không cần sửa gì mặc đi cưới luôn mặc rất hợp ạ
5,váy đẹp bởi bìa vải mềm thoải mái khi mặc khá phù hợp một chút mở mặc sau của chương trình để gợi cảm
5,vật liệu đẹp
5,váy xinh chất kiệu mềm mát vợt sale off giá quá hời ạ cảm ơn shop nha
1,khuyên mọi người đừng mua hàng ở shop này 1 hàng giao chất lượng kém 2 phản hồi shop thì thái độ phục vụ không tốt 3 không xem nội dung hình ảnh khi phàn nàn 4 số điện thoại cho giả mạo tốt nhaất nên tẩy chay
5,đẹp mặc ok
5,áo váy này không đúng vói mẫu quảng cáo vải dày thô cổ áo thì khoét bé nói chung không đep
5,phù hợp cho nhiều dịp hoa văn tạo nét quyến rũ thời trang hàn quốc đang thịnh hành tay ngắn rất dễ thương
5,váy đa năng phù hợp cho mọi dịp hoàn hảo cho buổi dạo chơi thường ngày họa tiết sọc thời trang vải thoáng khí nhẹ nhàng
5,áo đẹp lắm ạ
5,mới nhận được nhưng vẻ khác so với hình
5,đầm đẹp nhưng ngắn quá
3,chất liệu chất liệu vải quá tệ đừờng may ẩu nói chung đặt hàng lần đầu tiên thấy không hài lòng với sản phẩm
5,chiều dài trên đầu gối tạo phong cách thời trang lý tưởng cho váy bầu chiều dài đến đầu gối cho sự lựa chọn linh hoạt
4,chất lượng vải vẻ mỏng mặc mùa hè sẽ nóng phù hợp giá sale 100k các mẹ cân nhắc nhé mẫu mã đúng tặng shop 4 sao
5,váy đầm đẹp rẻ nữa mặc rất mát gì sẽ vô mua ủng hộ shop tiếp ạ
2,vậy mà cũng giao cho khách được
5,rất xinh nha giao hàng lại nhanh nữa săn 140k mà đầm vậy đẹp lắm mình cao 1m63 mặc tới gần gót chân
5,váy đẹp như hình ạ mỗi tội em hơi lùn nên không được đẹp như mẫu nhưng mà mà ai cũng khen vui rồi
5,đầm đẹp chất vải đẹp mặc lên lên dáng chuẩn
5,hàng nhận được trong tình trạng tốt chất liệu voan trong suốt mỏng
5,đầm đẹp chất lượng lắm shop giao hàng nhanh chóng đóng gói cẩn thận
5,chiều dài hoàn hảo cho bụng bầu
5,ok đẹp nhưng side hơi nhỏ
5,chất liệu vải đẹp ok ok ok
5,vải mát mịn đẹp ạ hình ảnh chỉ mang tính chất nhận xu giao hàng nhanh
4,giao hàng hơi lâu đóng gói kỹ càng chất liệu tốt váy đẹp nên mua nha mọi người
5,màu hơi tối hơn so với hình
5,đầm đẹp như hình mua mặc thay đổi cũng được giá rẻ
5,vải mềm mịn thoải mái thiết kế váy đẹp mắt
5,váy đa năng phù hợp với mọi dịp
5,chất lượng cao tỉ mỉ trong từng chi tiết dễ dàng phối đồ với phụ kiện vải mềm mịn thoải mái
5,shop giao sai màu mình chọn mà 1 cái nên thôi vậy đổi trả phiền thêm vải thì ổn so với giá
5,đầm xoè tuyệt đẹp hình dáng chữ a tôn dáng thiết kế thanh lịch giúp che đi vòng eo
5,vải thun máy lạnh chất liệu thoải mái thiết kế thanh lịch giúp che đi vòng eo
5,hoàn hảo cho trang phục hàng ngày đầm đa năng phù hợp mọi dịp
5,đẹp giao hàng nhanh đóng hàng kĩ lưỡng mà còn rẻ nữa nên mua nha 43kg 1m63 mặc đẹp nha
5,dễ dàng kết hợp với nhiều phong cách giá trị tuyệt vời cho giá tiền phù hợp với nhiều dáng người
5,phù hợp với nhiều dáng người dễ dàng kết hợp với nhiều phong cách
5,hai nút gài bị mất một cái mặc thì cũng thoải mái
4,vảy mộng quá
5,chất liệu tốt 
5,hàng nhận được trong tình trạng tốt chất liệu dày thiết kế chấp nhận được
5,quyến rũ nữ tính hiệu ứng giảm béo vải mịn mềm
5,lên dáng đẹp quá luôn shop cái chất liệu vải dày dặn lắm luôn mặc tôn dáng quá chừng luôn cảm ơn shop nhiều nha
5,quá xuất sắc luôn shop ơi đồ gì mà đẹp quá luôn lên dáng khỏi phải bàn cãi luôn quá xuất sắc luôn shop ơi cảm ơn shop nhiều nha nhất định sẽ quay lại ủng hộ shop
5,không biết chê ở đâu luôn quá xuất sắc shop ơi chất liệu đẹp quá luôn cảm ơn shop nhiều nhé
5,chiều dài trên đầu gối
5,đầm vải nóng không hút mồ hôi ạ 
1,bán một đường giao một nẻo mọi người cẩn thận
1,đặt mẫu này giao mẫu khác làm ăn kiểu gì không biết nữa
5,thiết kế dễ thương cho các bé gái lý tưởng cho trang phục hàng ngày giá trị tuyệt vời cho số tiền bỏ ra
5,vải hơi mỏng nhưng so với giá thì ổn đóng gói giao hàng khá nhanh nói chung rất ưng ý vote 5 sao
5,kiểu dáng hiện đại thiết kế độc đáo dễ mặc
5,chất liệu thoải mái vừa vặn phù hợp thời trang phong cách nhận được nhiều lời khen hình dáng tôn dáng hoàn hảo cho mùa hè
5,đầm thun dây rút không ôm eo rộng rãi hàng hóa đóng gói kỹ thời gian giao hàng hơi lâu
5,thời trang phong cách chất liệu thoải mái hoàn hảo cho mùa hè
5,đầm thun dây rút không ôm eo màu xanh rộng rãi thoải mái hàng hóa đóng gói kỹ thời gian giao hàng nhanh
5,đầm đẹp đúng màu minh lại ủng hộ shop nữa rồi mong shop gủi lại ok nhu này nhé tang shop 5sao
1,hàng kém chất lượng không giống hình ảnh quá tệ
5,shop uy tín bán hàng đúng như mô tả  đánh giá shop 5 sao  dịch vụ tốt
5,đẹp lắm shop ơi
5,nhận được hàng rồi shop ơi mới đặt hàng hôm quá thôi mà nay giao rùi chất lượng tuyệt lắm shop ơi mặc rất tôn dáng tôn đã chúc shop mua máy bán đắt nhé
5,nhận được hàng rồi nhà shop ơi ngoài sức tưởng tượng luôn giá rẻ mà đẹp dã man shop bán hàng tâm tư vấn nhiệt tình giao hàng nhanh sẽ ủng hộ lần sau ạ
5,nhận hàng giao hàng hơi lâu không hài lòng lắm
3,chờ hàng không nhanh lắm vải quá mỏng mặc dính nếu muốn tiếp tục bán hàng thì nên đầu tư chất vải tốt hơn chụp ảnh đẹp tạo dáng đẹp mà vải kiểu này quả đáng tiếc cho người may người trong các kháu bán hàng vận chuyển
5,nhận hàng quá nhanh đầm quá đẹp luôn cám ơn shop nhiều ạ
5,mình đặt đầm màu hồng nhưng shop hết hàng shop nhắn tin cho mình báo hết hàng hỏi ý mình đổi đầm khác không shop bán hàng rất tâm mọi người ủng hộ shop nhé mình cãm ơn shop
5,phù hợp với nhiều dịp chất liệu vải cao cấp dễ mặc thiết kế độc đáo độ tinh xảo cao sức hút của phái nữ ren đẹp
5,giao hàng nhanh đóng gói cẩn thận không hư hỏng chưa thử thực tế làm việc tốt giới thiệu cửa hàng này vận chuyển vận chuyển trên toàn quốc rẻ hơn so với người khác
5,chất lượng vải mềm mịn thoáng mát kiểu dáng sang trọng phong cách thời trang hàng đưa đúng như mẫu
5,chức năng thiết kế phong cách tinh tế giá trị tuyệt vời cho giá cả họa tiết caro thanh lịch vải chất lượng cao thiết kế phong cách tinh tế giá trị tuyệt vời cho giá cả họa tiết caro thanh lịch
5,đầm giống hình vải ok
5,thanh lịch sang trọng váy đẹp cho các buổi tiệc chất liệu cao cấp đi kèm áo khoác phù hợp
5,màu hồng ngọt ngào đầm đẹp nha mình béo bụng dưới lắm mà mặc vào trông gọn gàng hơn điều khóa kéo không mượt lắm mình mua 2 bộ nhưng khóa kéo đều hơi rít kéo lên chưa mượt tay chất liệu mịn mềm hiệu ứng giảm cân dễ kết hợp kiểu dáng hiện đại
4,chất liệu vải đẹp giống mô tả
5,váy bao êm luôn nè mê lắm luon hehe
5,đầm đẹp vải dày mặc ôm dáng phù hợp giá tiền nên mua
5,đẹp hơi chật tí gợi cảm moi nguoi nen mua
5,chất lượng vải mềm đẹp kiểu dáng sang trọng hàng đưa đúng như mẫu
5,hàng hơi mỏng kiểu cổ không đẹp lắm mà nhìn cũng ok giá nào thì của ấy
1,lừa đảo ảnh đăng 1 kiểu gửi hàng cái váy giá trị chưa đến 100 không đừng ai mua hàng chỗ này nữa nhé lừa đảo trắng trợn
5,chất liệu mềm mại không chỉ thừa váy xinh lại túi nên rất tiện giao hàng khá nhanh shop tặng thêm cột tóc hài lòng khi nhận hàng
5,giao hàng khá nhanh sản phẩm ổn áp lắm nha shop tư vấn nhiệt tình nên mua nhé
5,nói một câu thật lòng mình cũng tín đồ của lazada nhưng đây lần mình hài lòng nhất về chất lượng cũng như toàn bộ của sản phẩm mình đặt quá tuyệt vời mọi người ạ
5,lần đầu mua hàng của shop mà thấy quá chất lượng luôn shop trả lời tin nhắn rất nhanh lịch sự mọi người yên tâm mua nhé
5,mấu sắc thật nhạt hơn trong hình cúc áo phía sau rất ngứa cổ đầm ngắn của shop không đẹp như đầm dài dịch vụ chuyển phát nhanh tiện lợi
5,váy rộng thoải mái
5,chất lượng của các loại khác như mộng của anh tập êm đềm em cũng không được
5,tuyệt vời cho mùa hè đầm linh hoạt phù hợp cho nhiều sự kiện thanh lịch nữ tính thiết kế độc đáo thời trang
5,váy khá giày dặn ổn so với giá tiền mặc thêm đồ bảo hộ trong thì không lo gì cả mua được giao hàng nhanh mữa
5,giao hàng nhanh đầm đẹp như hình mẫu nhưng mặc vào hơi ngứa
5,đầm đẹp dễ thương nha
5,vải đẹp dày dạng xinh
5,váy giống mô tả phù hợp với giá tiền giao hàng hơi lâu shipper thân thiện
5,đầm dài đến đầu gối tạo vẻ thanh lịch chi tiết nơ dễ thương đầm dáng a thời trang
5,đầm dài đẹp mặc lên tôn dáng đóng gói cẩn thận phù hợp để mặc mọi dịp
5,váy đẹp hơn mong đợi shop uy tín chúc shop ngày càng phát triển moi người ủng hộ shop nhé váy mặc lên gọn người đẹp lắm luôn tặng shop 5 sao
5,giao hàng nhanh đóng gói cẩn thận hàng nguyên vẹn chất liệu tạm ổn hy vọng bền
5,chất liệu rất tốt lại con rẻ
5,vải mềm mịn nên mua tuy nhiên màu đỏ giặt ra màu đỏ nhìn hơi ghê còn lại thì ok hình ảnh không liền quan
5,váy đẹp mặc lên rất thoải mái
5,hàng đẹp lên dáng chuẩn lắm nha
5,áo đẹp nhưng tay hơi chật nhân viên giao hàng vui vẻ thân thiện sẽ ủng hộ shop tiêp cảm ơn nha shop
5,đẹp mê ly luôn mua nhìu lần rồi chỉ chất vải này làm mình hài lòng nhất luôn chất lượng tuyệt vời
5,đẹp lắm cực kỳ hài lòng vải cũng mềm mát nữa má mình mê tít
5,nhận được hàng shop giao hàng nhanh đúng mẫu hẹn gặp lại shop lần sao
5,chất liệu mịn mềm
5,giao hàng nhanh đóng gói cẩn thận mua dùm cho người nhà cám ơn shop nhé
3,không đẹp
3,nhìn dáng nhỏ mình 54kg mặc chặt nhưng chất liệu hơi nóng mình giặt mấy lần thấy chất vải hơi sờm hình ảnh mang tính chất minh họa dáng hơi ngắn
5,đồ xinh xịn rẻ ok lắm
5,váy đẹp lắm shop nhé chất mềm mát
5,chất vải mỏng nhưng mặc lên không bị lộ vải mát dáng dáng cũng ok nên mua nha mọi người
5,mình nhận được hàng buổi sáng rồi nha shop đóng gói cẩn thận đẹp vận chuyển giao hàng rất nhanh luôn shop giao đúng màu đúng mẫu áo đẹp lắm vải mịn mát cảm ơn shop nhiều lần sau mình mua tiếp nữa
5,giao hàng nhanh đóng gói đẹp váy đẹp ném nhé nên mua mọi người ạ mình mặc vừa in xinh ném nhé
5,đầm vải đẹp dáng dang rất chuẩn nhân viên shop tư vấn rất kỹ giao hàng nhanh đóng gói kỹ rất đáng mua nha mọi người
5,nhận hàng được giống hình vải hơi mỏng ít chỉ thừa điều chỉnh lên xuống được
5,quần áo đẹp giao hàng nhanh chất lượng tốt mẫu đẹp ta sẽ tiếp tục ủng hộ cửa hàng vải mặc mát vải thun co giãn mặc dễ chịu
5,quá mỏng như xuyên thấu zậy á mọi người cân nhắc trước khi mua nha
5,chất liệu mềm mại dễ chịu
5,chất liệu thun poly kiểu dáng dễ thương
5,xịn lắm nha
5,đầm đẹp vải khá dày luồng dây hơi mệt nha mọi người
5,đẹp lắm nha lần sau ủng hộ shop tiếp
5,váy đẹp lắm nha mọi người
5,nhận được chiếc váy bên dưới chưa thử nên không thể bình luận về kết quả vải không quá tệ không làm cho chiếc váy trông rẻ tiền cảm ơn người bán
5,nên mua nha rất xinh luôn
5,giá cả hợp lý giao hàng nhanh chóng chưa thử nếu nó vừa
5,đầm mặc lên tôn dáng chân mình nhiều hoa mặc váy dài che chân tự tin hẳn đường may chắc chắn nha
5,nên mua nha mọi người dồ rất đẹp luôn nhận hàng mặc liền luôn giá cả hợp lý ai 45ký vừa
5,đẹp xuất sắc
5,đẹp vải co giãn tốt phù hợp giá tiền sẽ ủng hộ shop giao hàng dễ thương cho shop 5 sao xinh
4,họa tiết thời trang thoáng khí mát mẻ váy hơi nhỏ chỉ vừa người 55kg trở xuống
5,phù hợp cho công việc thoải mái cho mọi dịp váy dáng a thanh lịch
5,phong cách linh hoạt sang trọng chất liệu ổn vải mỏng hơi ngắn
5,hình ảnh không liên quan nhưng váy lanh chất đep đặt thêm sau khi sử dụng
5,thoải mái sang trọng đa dụng thoải mái chất liệu mềm mịn thời trang bầu độc đáo thời thượng
5,chất liệu mát thoáng khí chất liệu mát thoáng khí chất liệu mát thoáng khí chất liệu mát thoáng khí vải mềm mịn chất liệu mát thoáng khí
4,số với giá tiền thì ổn không gì để chê
5,ngon lành cành đào tươi mát như mua hè mà mở máy lạnh 16 độc ngon
2,đặt hàng cỡ s cỡ m sau đó cỡ rất lớn cỡ s không thể mặc vải sẵn đường may không tinh tế chỉ đủ 2 sao
5,chat lieu vai wa te khuyen shop dang hinh anh len dung voi thuc te nha te wa
3,đường chỉ bên hông rất xấu như hàng lỗi
5,dáng chữ a tôn dáng váy dài cho vẻ ngoài duyên dáng màu đen thời trang váy đa năng cho mọi dịp cổ áo sơ mi thanh lịch
5,chất liệu mềm mại thoải mái đầm dài tạo vẻ duyên dáng viền xếp ly dễ thương
5,thiết kế đầm đẹp mắt cổ áo sơ mi thanh lịch chất liệu mềm mại thoải mái
5,chất liệu mềm mại thoải mái chất liệu mềm mại thoải mái
1,shop giao sai hàng em nhắn tin shop không trả lời ạ
5,rất ok sẽ ủng hộ shop tiếp
5,đầm đẹp sẽ mua lại màu khác nữa chất liệu mềm mặc mùa hè này thoải mái
5,mik mua tiếp đầm mẫu hồng hai dây phong cách hàn quốc đẹp sang chảnh đường may cẩn thận ít chỉ thừa đóng gói cẩn thận giao hàng nhanh nhận xét shop 5 sao đợt tới ủng hộ shop tiếp mọi người nên ghé thăm mua sắm shop nhé hình ảnh mang tính tượng trưng để nhận xu
5,áo khá ok vải cũng ổn giá rẻ phù hợp với giá tiền tuy nhiên mình thấy mình mặc cái này lên trông mình mập hơn hay sao ấy nch vẫn đẹp
5,váy không dài như hình vải nóng
5,chất liệu mát rút mồ hôi
5,hàng giống y hình chất đũi mặc thoải mái không lo nhăn từ 42kg mặc vừa nhưng hơi dài so vợi người 150cm nha
5,chất vải tốt giá ok sẽ quay lại mua tiếp ủng hộ shop
5,hàng y hình chất váy mềm mịn mát cầm nặng tay sợ với giá tiền thì rất ưng ạ sẽ ủng hộ shop tiếp
5,váy đẹp vải đẹp giao hàng nhanh cảm ơn shop nhiều ạ
5,giao hàng vết bẩn cũng giao hàng giao hàng cho khách không kiểm tra hàng rồi cứ giao thật xui xẻo khi mua hàng bên này lần đầu tiên quá thất vọng
5,đúng mẫu đẹp
