rating,review
5,tông màu nhẹ nhàng tinh tế họa tiết hoa đáng yêu nhẹ nhàng thoáng khí mình hài lòng cảm ơn shop
5,tông màu nhẹ nhàng tinh tế nhẹ nhàng thoáng khí đường may rộng rãi thoải mái chất liệu lụa mềm mịn bán hàng uy tín dễ thương giao đủ số lượng sẽ ủng hộ shop tiếp cảm ơn shop nha
5,nhẹ nhàng thoáng khí họa tiết hoa đáng yêu đường may rộng rãi thoải mái sẽ ủng hộ shop tiếp shop uy tín shipper dễ thương
5,họa tiết hoa đáng yêu nhẹ nhàng thoáng khí lý tưởng cho việc mặc khi mang bầu tông màu nhẹ nhàng tinh tế
5,áo rất đẹp tuy màu hơi tuoi hơn trong hình rất vừa ý màu ttown nên áo hơi đơn điệu
5,phong cách xe tăng rất hợp thời trang chiếc váy vừa vặn hoàn hảo
5,đầm cũng dễ thương vải hơi cứng nhưng mặc đẹp trẻ trung 5 sao nè
5,đầm đẹp lắm rất lịch sự dễ thương thích hợp bận đi học hoặc đi chơi giá phải chăng nữa
5,giao hàng nhanh đóng gói cẩn thận vải hơi nóng dáng đẹp mình rất ưng nhưng mình nghĩ dời hàng thun nhúng xuống tầm 4cm cho vừa eo thì sẽ đẹp hơn chứ hiện tại thun nhúng đang ở gần ngực mình quá nên hơi giống đầm baby doll hihi tùy hình dạng cơ thể mỗi người thể điều chỉnh lại cảm ơn shop
5,hàng rất đẹp
5,mình nhận được áo bị rách vải hơi thô mình cảm thấy chưa được hài lòng mong shop kiểm ta hàng kĩ trước khi giao cho khách hàng video mang tính nhận xu
4,hàng tới nhưng màu khác với trong hình màu hơi tối thấy cũng ok
5,đầm rất đẹp vừa ý đúng mẫuđặt 3 cái được 2 cái đúng 1 cái không hài lòng
5,chất liệu nilon nhiều nên sẽ nóng mùa hè
5,tay áo bèo thời trang váy shift đơn giản nhưng phong cách màu be trung tính chất liệu cotton thoải mái
5,kiểu dáng rộng phù hợp thiết kế tinh tế thời trang đầm sơ mi đa năng chất liệu thoáng mát thoải mái kiểu dáng rộng phù hợp
5,váy maxi dễ thương mát mẻ nhẹ nhàng cho mùa hè hàng mỏng nhẹ phù hợp giá tiền giao hàng hơi lâu xíu
5,tuyệt vời cho các dịp đi chơi kiểu dáng rộng phù hợp thiết kế tinh tế thời trang thiết kế tinh tế thời trang đầm sơ mi đa năng
4,nhìn chung cũng được đều vải hơi mỏng so với loại khác đầm sơ mi đa năng váy đẹp cho mùa hè
5,mới nhận hàng chưa mắc không biết đẹp không vsir hơi nóng nên giá này khong đòi hỏi hơn được
5,chất liệu tốt n thiết kế thường ngày phù hợp để mặc ngoài trời n
5,giao hàng không đúng mẫu mua váy mà giao đồ bộ làm như cc
1,lên đồ thì đẹp mua về không đúng mẫu tôn vải thung em đặt hàng trên đây toàn hàng tôn tiền ma về mặc không được làm sau lần sao dám đặt nữa
5,giao hàng không đúng mẫu
5,hình dáng aline tôn dáng đầm đa năng phù hợp cho các dịp thường ngày không gây mồ hôi khi vận động nhiều
5,đầm đẹp y như mẫu mua lần 2 này mình mua dùm c làm chung vải dày dáng chuẩn dài qua gối rất lịch sự trẻ trung tặng shop trên cả 5 sao cảm ơn shop cảm ơn shipper ạ
5,vải cotton thoải mái lý tưởng cho việc mặc hàng ngày thiết kế ba lỗ độc đáo lý tưởng cho một buổi đi chơi bình thường hình ảnh minh hoạ nhận xu
5,dây buộc tóc khá ổn nhưng đừng đưa vào đánh giá chung với đầm để tránh cho người mua bị hiểu lầm dây tóc với váy
5,lý tưởng cho việc mặc hàng ngày lý tưởng cho một buổi đi chơi bình thường chiều dài dưới đầu gối đa năng tuyệt vời cho ngày hè
5,đặt màu này đem màu kia
5,sang lắm ạ màu trắng ngà ngà chớ không phải trắng tinh vải dày dặn y ảnh không chi để chê
5,đẹp may kỹ đáng mua
5,ok hài lòng
5,không đẹp vì không phải vải phi lụa như hàng thun
5,đúng mẫu đủ số lượng mặc vừa khít chất lượng thì tiền nào của nấy không phải lăng tăng cám ơn shop giao hàng rất nhanh
5,vải thun nhưng không co giãng nhìu lên dáng thì rất đẹp
5,nhận hàng rùi thấy kiểu dáng với chất liệu không ưng ý
5,cảm ơn người bán
5,rất tốt rất tốt rất tốt rất tốt rất tốt rất tốt rất tốt rất tốt rất tốt rất tốt rất tốt rất tốt rất tốt
5,kiểu dáng ok
5,shop giao hàng đúng mẫu đung màu chất liệu vải cũng ok nhưng mình 40 không mặc hơi rộng nha
5,chất liệumềm mỏng dễ thương bé rất thích
5,ok lắm nek
5,vải mềm mịn thấm hút mồ hôi tốt đường kim mũi chỉ đẹp ít chỉ thừa shop giao hàng nhanh
5,mua được cái váy ưng ý quá tr lướt mấy shop rồi quyết định mua hàng của shop quả không thất vọng giá rẻ mà chất lượng tuyệt vời
5,chất váy mềm mại mặc rất thoải mái nha giá lại rẻ nữa sẽ tiếp tục ủng hộ shop
5,mình mua 2 cái 1 mận 1 nu cái màu nu mềm mại thích hơn màu mận dày hơn nói chung chát thoáng mát rẻ mọi người nên mua nhé
5,shop tư vấn nhiệt tình shop còn tặng quà kèm lời nhắn dễ thương lắm á yêu shop
5,vải dày dặn đẹp
5,voi gia tien nay thi hang cung ok roi giống mau ma chat lieu vai cung dep cho shop 5 sao
5,đẹp so với tầm giá người giao vui vẻ dễ thương hình ảnh mang tính chất nhận su kk
5,vải thun dày dặn kiểu như hình dây thắt nơ điều hơi ngắn so với hình cảm ơn shop cảm ơn shipper tặng shop 5 sao ạ
5,chức năng váy màu be rất đẹp hạt cườm ngọc đính áo đẹp nhưng hơi lỏng lẻo
5,chức năng đẹp 10đ không nhưng 
5,chất lượng chất lượng tuyệt vời để dáng áo 2 năm nhưng nhỏ so với bé lưu ý shop nên để số không chiều cao để dễ lựa chọn
5,dáng chữ a tôn dáng độ co giãn thoáng khí tuyệt vời váy xanh thời trang
5,đường may được chế tác cẩn thận cổ áo tròn thanh lịch dáng chữ a tôn dáng
5,đầm suông thời trang
5,đầm dễ thương lam vải cũng mịn ok túm lại hài lòng con gái sẽ rất thich
5,chất lượng kiểu đang đep
5,chát vải không dẹp tyd nào nhìn hinh ảnh thi dep lung linh vải như vải thường không dám mặc luon xu ghê
4,vải ok nk mà đê iểm nhấn nts cuối đai eo với chân váy dưới bị phùng
5,mua deal 5k mà shop giao hàng nè chất cũng ok nha mọi người cái tay xòe nhé ưng shop lắm
5,nhìn ok sợ với tầm giá chưa mặc nên chưa biết nóng kg hy vọng ok
5,đam đẹp quá
5,đầm xinh mắc dễ thương lắm shop hihi
4,shop giao sai mẫu không báo trc với khách tuy nhiên giao nhanh chất vải khá đẹp mong shop hãy ib với khách trc khi đổi
5,nhận được chiếc váy bên dưới chưa thử nên không thể bình luận về kết quả vải không quá tệ không làm cho chiếc váy trông rẻ tiềncảm ơn người bán
5,dễ mặc sức hút của phái nữ chất liệu vải cao cấp thiết kế độc đáo
5,so với giá thì ok mac cung duoc
5,hàng rất rất đẹp nhe mọi người nên mua
5,đầm đẹp y hình nhưng nói cho ce biết 40ki đến 43ki mặc thì ok mình 48ki mặc bị chật noi chung 45ki trở lại ok tặng shop 5sao vì đầm đẹp
2,không đúng mẫuk giống hình
5,thêm một chút nghịch ngợm đầm dễ thương với chi tiết tinh tế thoải mái phong cách tạo vẻ tươi trẻ sôi động
5,chuẩn bị hàng nhanh đầm rất đẹp tư vấn nhiệt tình nhân viên giao hàng thân thiện 5 sao
5,nên mua nhé mọi người
5,váy nói chung ok rất thích nhưng hơi rộng 1 tý
4,đầm mà sao kiểu áo khoác thế ngồi xuống hở hết
5,váy mỏng so với giá tiền cũng ổn
5,tâng bốc vừa vặn vải cotton thoải mái chất liệu cao cấp trang phục đa năng cho mọi dịp tùy chọn màu đỏ táo bạo rực rỡ hoàn hảo cho trang phục thường ngày hoặc trang trọng
5,hoàn hảo cho trang phục giản dị hoặc trang trọng phù hợp với dáng ôm màu đen cổ điển màu đặc cho vẻ ngoài vượt thời gian chiều dài midi thanh lịch chất liệu cao cấp tùy chọn màu đỏ đậm rực rỡ
5,dịch vụ tốt chất lượng tốt người bán rất nhạy giao hàng nhanh rất khuyên bạn nên
5,mình cao 1m6 lưng ngăn nên mang nó hơi dài như hình chắc đem ra tiệm cắt lên nhìn chân dài hơn do lưng mình ngắn vải đẹp dáng chuẩn so với giá quá okayla
5,đẹp y hinh
5,ok đẹp
5,váy voan vải ổn so với giá tiền nha dịch nên giao hàng hơi lâu nhưng tư vấn khách nha
5,váy như hình giao hàng nhanh
5,váy xinh xỉu y như ảnh vậy dáng váy đẹp khá chuẩn mỗi tội khoá váy khó kéo hay bị kẹt thôi ———— a
5,đầm cỡ 48kg trở lại mặc đẹp nhé thun mát giá như thế này ok ạ
5,hợp với giá tiền vải nóng
5,đầm mặc dễ thương lắm vải dày dặn mềm mình mặc vừa in luôn cảm ơn shop nhé mọi người nên mua nhé
5,đầm cũng ổn nói chung được
5,chất liệu lụa cao cấp thiết kế thời trang phù hợp cho công việc giải trí chiều dài dưới gối tôn lên vóc dáng váy đa năng phù hợp cho nhiều dịp
5,đầm rất xinh vải cũng ok moi người nên mua nhé
5,rất đẹp luôn nha không quá dày cũng không quá mỏng chất đẹp hoa văn đẹp 10 điểm
5,đẹp với bạn
5,chất vải đẹp dày dặn cho shop 5 sao nhưng mình 65 kí hơi chật chút hình ảnh mang tính chất nhận xu
5,váy dệt kim chất lượng cao
5,sao em đặt váy mẫu này mà giao mẫu kia vậy shop không ok rồi
5,rất đẹp lắm shop ơi
5,thật tuyệt vời shop quá thân thiện sẽ ghé gian hàng của shop
5,mình mua 2 mẫu shop giao 1 mẫu 2 màu mà lở không quay clip nên thôi rút kinh nghiệm lần sau hàng ổn so với giá tiền
5,đầm đẹp lắm ạ
5,đầm linh hoạt cho bất kỳ sự kiện nào đường may ôm sát tôn dáng chất liệu mềm mịn thoải mái thiết kế tà xẻ độc đáo
5,hàng quá xuất sắc luôn shop ơi
5,nói chung tiền nào của đó cũng khá ok số với tiền vì nó rẻ mới nhận hàng chưa mặc thử
5,hàng hơi mỏng giá ổn nên mua bha mọi người giao hành nhanh lịch sự lắm ạ mua lẹ nào mọi người ơi 
5,vải mềm mặc mát shop đóng gói cẩn thận shipper nhiệt tình giao hàng cũng nhanh mùa này mặc rất thoải mái
5,chất liệu mỏng nhưng nó ổn n
5,salon vòng cổ thiết kế phù hợp vẻ đẹp đường viền vật liệu mềm mại ánh sáng phù hợp vẻ đẹp đường viền
5,hàng rất tốt
5,cảm ơn shop rất đẹp bé rất thích
5,váy áo đẹp vải tốt giao hàng chậm trễ hơn dự kiến 3 ngày
5,hình elsa in thì ok hơn may
5,áo đẹp vải mịn
5,nhận hàng vải kiểu không phải len dáng dẹp nói chung ọk
5,đẹp xuất sắc giao hàng nhanh nữa gần đi biển rồi mới đặt sợ không kịp shop giao vừa kịp vượt mong đợi
5,mình nhận được rồi sốp ôm dáng rất đẹp ạ không cần sửa gì mặc đi cưới luôn mặc rất hợp ạ
5,đưa lộn màu đặt nude đưa đỏ
5,chức năng vải đẹp nha tất cả đều ok nhưng hơi rộng quá so với mình nha haha bù lại vải mát ok
2,chất lượng xấu
1,giao sai mẫu
5,đầm xinh quá cảm ơn shop
5,sản phẩm đúng mẫu mã
4,ok so với giá tiền
5,hàng y hình mỗi tội hơi rộng vì mình hơi gầy
5,đặt mẫu này giao mẫu khac