rating,review
5,hoàn hảo cho mùa hè với tay áo ngắn vẻ ngoài giản dị nhưng sành điệu hoàn hảo cho trang phục hàng ngày thiết kế thoải mái phong cách chất liệu cotton mềm mại thoáng khí
5,chất lượng của vải tốt
5,màu xanh dương hồng tươi đẹp thiết kế vneck thời trang chất liệu chiffon nhẹ nhàng thoải mái
5,giá trị tuyệt vời cho giá tiền hoàn hảo cho việc mặc hàng ngày thoải mái
5,hàng ok mà hơi rộng mà vẩn ổn chất liệu ok giao hàng tích cực ổn định còn ra sao thì mặc mới biết nếu hàng ok sẻ ủng hộ
5,áo vừa y luôn chiều dài áo ngắn 1 tí nữa đẹp vải vẻ mịn chưa mặc nên đánh giá độ bền ra sao sau
5,thoải mái cho các hoạt động giải trí ngoài trời
5,quần áo mỏng cỡ l giống như cỡ s nhìn trọng lượng 50 hoặc 60kg nhưng rất mỏng
5,cảm ơn chúa quần áo về com ey rất cám ơn người bán
5,vật liệu 81
5,thời trang thoải mái phong cách đa dụng cho mọi dịp đường may hoàn thiện hoàn hảo
5,hoàn hảo cho mặc hàng ngày hoàn hảo cho mùa hè với tay áo ngắn chất lượng tuyệt vời với giá cả phải chăng
5,chất liệu mềm mại cotton thoải mái khi mặc
3,hàng ô kê mẫu áo lá xanh
5,không giống như mô tả dù sao cũng ít tiền bỏ qua
5,voucher 20 k
5,áo đóng gói cẩn thận giao hàng nhanh áo bo nơi ngực thả phía dưới nên người gầy mặc đẹp hơn
5,áo đẹp vải mát mà giao hàng hơi lâu mười điểm nha hình ảnh chỉ mang tính chất nhận xu
4,áo mỏng le
5,nhận hàng ok mặc vừa vặn chỉ cổ hơi sát quá cổ thêm sâu hạ xuống chút thì vừa đẹp nói chung mặc rất ok tặng shop 5
5,nhận được nhận được chuẩn bị cho mẹ hy vọng cô ấy thể phù hợp
5,vật liệu không tốt như vậy thiết kế không đẹp cắt cưa không tốt nhìn khác với hình ảnh nthất vọng
5,hàng đẹp hài lòng
5,chất liệu thun co giãn
1,quần áo giặt một lần hình vẽ bị cởi rồi
5,phù hợp cho nhiều dịp mịn màng chống nhăn
5,chất liệu vải lụa cao cấp thoải mái mát mẻ phong cách hàn quốc chính hãng phong cách hàn quốc chính hãng
5,vải cũng được nhưng áo hơi ngắn mặc không đóng thùng được hơi thất vọng
5,thoải mái mát mẻ phong cách hàn quốc chính hiệu thiết kế hiện đại phong cách mịn màng chống nhăn thoáng khí thấm hút mồ hôi vải lụa chất lượng cao phù hợp cho nhiều dịp khác nhau
5,màu cam tươi sáng thiết kế thời trang năng động họa tiết nổi bật màu tím hấp dẫn màu đen sang trọng
5,áo chất ổn đường may kỹ giá rẻ sẽ quay lại ủng hộ lần sau chúc shop buôn may bán đắt
5,áo chất đẹp lắm mặc đi chơi hay đi làm đều ok nhé
5,áo dày dặn shop đóng gói cẩn thận giao hàng nhanh chóng tư vấn nhiệt tình ai còn đang phân vân thì nên mua nhé
5,vừa nhận hàng mình vào đánh giá rồi áo đẹp hơn tưởng tượng của mình luôn shop giao hàng nhanh chóng rất tận tình
4,không giống mẫu
4,hàng không đúng mẫu
4,không giống trong hình hơi thất vọng
4,áo đẹp nhưng hình in dính lên trên nhưng hàng rẻ nên thông cảm
5,đẹp
5,áo đẹp
5,áo đẹp vải minh mát nói chung ok
5,không nghĩ với mấy chục nghìn lại mua được cái áo ổn như thế chất mát form rộng
5,vải đẹp chất lượng tốt giá cả quá rẻ cho một cái áo
5,vật liệu tốt tay nghề giá trị đồng tiền nó phù hợp chặt chẽ không bị cắt rời thể một chút chặt chẽ nếu không được sử dụng để phù hợp chặt chẽ
5,giống như mô tả
5,áo đẹp như mô tả
5,áo đẹp chất vải ok nên mua
5,mới vừa nhận hàng 97 ngàn nhưng cái áo nhỏ xíu mặc không vừa vui lòng cho đổi lại cái áo khác rộng rãi hơn
4,nhìn cũng oke chất vãi không giống hình
5,áo đẹp chất vẻ nóng nhưng ưng ý cảm ơn shop
5,hàng đẹp quá tuyệt vời mua rất nhiều lần rất hài lòng về giá chất lượng của shop này 5
5,shop giao hàng nhanh đóng gói kĩ càng chất vải áo phù hợp với giá tiền pha nilon nhưng không đáng kể chất áo này khá phù hợp mặc vào mùa hè
5,giao hàng nhanh đóng gói tốt tốt cho mùa hè mặc
5,vải cotton màu xanh lá cây ấm áp thoải mái phong cách thời trang phổ biến phù hợp cho bé trai 6 đến 10 tuổi
5,chất lượng ok
5,thun mát đẹp
5,áo tôn dáng đẹp vải bình thường màu không giống như trong hình nhưng trông cũng tạm được
5,shop giao hàng nhanh màu áo giống như hình lần sau sẽ ủng hộ shop tiếp
5,chất liệu bình thường
1,áo bị rách không đúng màu
5,hàng ok đẹp
5,màu đẹp lắm nha shiper thân thiện nhiệt tình ảnh chỉ nhận xu
5,vải rất ok săn sale được giá rẻ màu sáng form đẹp mua shop nhiều lần vì giỏ hàng uy tín nên sẽ ủng hộ shop thêm nhiều lần nữa
5,áo đẹp giao hàng nhanh phom áo đẹp 5 sao cho shop sẽ ủng hộ tiếp ạ
5,giá trị tuyệt vời cho giá tiền dễ phối với nhiều trang phục khác nhau thiết kế đa năng phù hợp nhiều dịp
5,vải mỏng áo may ẩu bị rách nách hình ảnh chủ mang tính chất nhận xu
5,giao áo kiểu này làm sao mà mặc
5,hàng rẻ đẹp mọi người mua đi
5,vải thoáng mát thoải mái chất liệu vải mỏngvừa vặn hoàn hảo cho cân nặng dưới 60kg
5,áo màu như hình chất tạm ổn áo rẻ nên không đòi hỏi cao tiền nào của nấy
5,áo nhìn ổn giá cả rẻ như vậy ok rồi mặc cũng đẹp lần sau sẽ ủng hộ
5,hoàn hảo cho mặc hàng ngày cảm ơn bạn sellar
5,chất lượng kém không đúng hàng
1,đặt áo như hình trên ra áo trắng
1,như tả què đặt 1 đường giao 2 nẻo luân đảo đi con nữa m đẻ con éo lổ đít
5,hàng lỗi
5,hàng giao đúng mẫu đặt áo màu đẹp chưa sử dụng chưa biết độ giãn như thế nào xài rồi đánh giá tiếp tặng cho shop năm sao người giao hàng nhiệt tình vui vẻ
5,đóng gói cẩn thận giao nhanh hàng tốt như quảng cáo sẽ ủng hộ
5,áo đẹp dễ thương nên mua
5,áo như hình nên mua
5,chất liệu đẹp thoải mái
3,vải thun mỏng chất liệu thun nóng không thấm hút mồ hôi
5,giá cả ngon bổ rẻ vải mềm thoáng khí
5,vừa vặn thoải mái
5,sắc thái sống động họa tiết in độc đáo
5,rất hài lòng
5,trọng lượng nhẹ thoáng khí hoàn toàn phù hợp giá trị tuyệt vời cho tiền
5,mềm mại thoải mái giao hàng nhanh chóng giá trị đồng tiền
5,dễ dàng để trộn kết hợp thiết kế thời trang giá trị tuyệt vời cho tiền
1,vải xù lông rất tệ vậy còn bị rách lủng vải nói chung không nên mua
5,xong rồi
5,áo bằng vải poly mềm mát hạn chế nhăn mua giá khuyến mãi quá tốt
5,áo bằng vải poly mềm mát hạn chế nhăn mua giá khuyến mãi quá tốt
5,phong cách hợp thời trang bền lâu dài hoàn hảo cho việc mặc hàng ngày vải chất lượng cao
5,chất liệu thoải mái thoáng khí
5,rất đẹp
5,chất lượng tốt áo xinh lắm ạ
5,đẹp nha vải đẹp
5,áo đẹp lắm chất vải rât ok 10 điểm cho sản phẩm nhé
5,chất liệu cotton thoải mái
5,được
1,chất liệu không như trong hình xấu lắm mọi người ạ
1,vải mỏng đểu cho vào máy giặt giãn màu nhạt
5,ok nhận được hàng đúng như đơn đặt mua
5,không thấy gì để chê ạ tuy hơi khó mặc với form người mình
5,áo đẹp lắm mặc rất sang giá phải chăng shop bán hàng tâm giao hàng nhanh mình mua hai cái luôn rất đẹp mọi người nên mua nha chất liệu tốt
5,mình mua nhiều lắm rồi chất liệu mỏng nhẹ mặc thoải mái nha giặt nhanh khô lấy tạm ảnh không liên quan
5,hoàn hảo cho các hoạt động ngoài trời vải cotton chất lượng cao thoáng khí thấm hút mồ hôi thoải mái mỏng nhẹ nhanh khô
5,áo chất mát đẹp lắm nên mua nhưng phom hơi rộng mọi người cân nhắc chọn cho vừa
5,mình sẽ típ tục mua hàng nữa đồ rẻ mà chất lượng rất tốt
5,giao nhanh đóng gói chắc chắn
5,đẹp nha các bác tuy nhiên anh thanh niên nhà em bảo mặc hơi nóng một xíu nhưng thôi tiền nào của đó hợp với giá tiền
5,đồ giống hình sẻ ủng hộ shop nhiều
5,áo đẹp lắm đường may kỹ chất vải mềm mịn mặc mát
5,hàng đúng mô tả vải mềm mịn giao hàng nhanh xứng đáng 5 sao
5,shop giao nhanh áo đúng mô tả ok
5,chất lượng tuyệt vời shop giao nhanh
5,giao hàng nhanh nhân viên tư vấn nhiệt tình
2,áo mỏng quá chất lượng kém giá cao
5,đa năng thời trang chất liệu chất lượng cao yêu thiết kế độc đáo hoàn hảo cho bất kỳ dịp nào
5,áo đẹp vải mát from đẹp dáng ôm tóm lại đẹp hoàn bị đ mọi người ưng
5,mua mấy cái mỗi cái này gọi được nhưng chất nóng nhé giá tiền phù hợp với áo không đòi hỏi phải gì
5,phối màu thời trang đa năng thời trang yêu thiết kế độc đáo
5,thiết kế đơn giản thời trang vật liệu cotton mát mẻ thoải mái
5,áo thun đẹp mát mặc rất hợp cho mùa hè đi tập thể dục cũng rất thấm mồ hôi
5,chất liệu vải cotton mỏng
5,đẹp quá xuất sắc luôn 5 sao
5,vải hơi mỏng nhưng chấp nhận được tiền nào của nấy cho shop 5 sao
5,hàng chất lương cao
5,nhận hàng rồi ok đẹp ship giao hàng thân thiện hài lòng với lời nói của ship de mến tặng ship 10 sao nhé
5,áo đẹp vải mặc rất thoải mái chứ không dày nha mọi người
5,giao hàng nhanh áo trắng vải mỏng áo đen vải được dầy hơn cổ áo đen may bị méo tạm được
5,kiểu dáng đẹp vừa ôm người sẽ ủng hộ tiếp tăng shop 5 sao nhé mọi người nên mua
5,thiết kế thời trang hiện đại chất liệu mềm mại thoáng khí
5,co giãn thoải mái
5,quần co giãn rất thoải mái mọi người nên mua nhé
5,vải chất lượng cao vừa vặn thoải mái vừa vặn thoải mái vừa vặn tôn dáng cho mọi loại cơ thể vừa vặn tôn dáng cho mọi loại cơ thể vừa vặn tôn dáng cho mọi loại cơ thể vừa vặn tôn dáng cho mọi loại cơ thể vừa vặn tôn dáng cho mọi loại cơ thể vừa vặn tôn dáng cho mọi loại cơ thể vừa vặn tôn dáng cho mọi loại cơ thể vừa vặn tôn dáng cho mọi loại cơ thể vừa vặn tôn dáng cho mọi loại cơ thể
5,hàng chất lượng cao giá trị tuyệt vời cho giá cả
5,vải nilon mỏng dính luôn nhận hàng bóc ra thấy chất lượng vải hơi thất vọng
3,vải nilon mỏng dính luôn nhận hàng bóc ra hơi thất vọng
5,quần đa năng cho nhiều dịp khác nhau quần jogger phong cách thoải mái
5,hoàn hảo cho trang phục hàng ngày hoàn hảo cho các hoạt động thể thao
5,dịch vụ khách hàng tuyệt vời giao hàng nhanh chóng quần đa năng cho trang phục hàng ngày
5,vải nhanh khô cho người năng động vải thoáng khí thoải mái quần jogger thời trang hợp mốt
4,quần dày dặn lắm nhe không ngờ luôn giá oke
5,vừa vặn hoàn hảo
4,quần đẹp lắm mọi người ơi nhưng nên căng nhắc độ rộng của nó nha mọi người tại thật sự nó rất rộng lắm ý mọi người
5,thiết kế thời trang phong cách thiết kế đen trắng thời trang vừa vặn tuyệt vời với kiểu dáng thông thường mẫu sọc chéo độc đáo
5,chất liệu nỉ bông thoải mái lý tưởng cho phong cách hàn quốc thời thượng mẫu sọc chéo độc đáo lý tưởng cho cả nam nữ
5,quần giá rẻ quần y hình nhé chất vải không mỏng hình như nào thì mặc lên y vậy được cái giao nhanh nên mua nhiều cũng ổn
5,nhận được hàng rất tiêu chuẩn nha mọi người
5,lý tưởng cho thể thao nghỉ ngơi chất liệu vải chất lượng cao cực kì thoải mái khi mặc suốt cả ngày đa dụng cho mọi mùa vừa vặn hoàn hảo với đai co giãn phù hợp cho cả nam nữ chất liệu bền co giãn
5,ba màu cơ bản để lựa chọn hoàn hảo cho các dịp bình thường quần jeans cổ điển với phong cách hiện đại
5,hàng đẹp chất lương sippo tuyệt vời vui tính
5,thiết kế đa năng cho nhiều lứa tuổi quần jeans cổ điển với phong cách hiện đại
5,shop giao đúng hàng đúng mẫu mã hàng quốc tế nhưng không quá lâu
5,chất liệu thoáng mát thoải mái đường may hơi hàng chợ chút cải thiện thì ok hơn
5,thất vọng đặt hàng 3xl giao xl
5,bền bền lâu vải mát thoáng khí thiết kế thời trang để tạo vẻ ngoài thời trang giá trị tuyệt vời cho giá tiền hoàn hảo cho các hoạt động thể thao
5,quần đẹp lắm ạ shop đóng gói cẩn thận giao nhanh sẽ giới thiệu bbe mua sản phẩm của shop
5,không phải chất nỉ tương đối ổn
1,hàng không giống như trong mẫu mà còn hàng qua sử hàng này thì ai mặc được shop làm ăn mất uy tín quá mọi người không nên mua nha đồ cũ thôi
5,ok túi dài để điện thoại thoải mái vải hơi mỏng hơn đợt đầu mình mua
5,chất liệu chất liệu tốt mềm mại
5,hài lòng hàng hóa không bị hư hỏng thể sẽ đặt hàng một lần nữa
5,vải tốt trang bìa quan trọng cửa hàng rất nhanh rất hài lòng
5,rất tốt không tốn kém gói ấn tượng tốt
5,quần bóng căng nhìn đĩ đực lắm anh em anh em nên mua nha quần lộ cả đùm
5,vừa vặn hoàn hảo cho chuyến đi xe máy hình dáng mượt mà giảm cân
5,quần đẹp nhé mọi người mình mua tặng nên không hình ảnh nhưng mặc lên vừa xinh hihi
5,chất liệu tạm ổn chấp nhận được
5,mua quần về mình không cần dem di sửa từ lưng tới ống luôn vừa ngín như sinh ra dành cho mình quần đẹp dài vừa phủ đôi harness boots quần ống rất ôm nhất ở phần đùi nó bó khá sát luôn ấy còn ở bắp chân thì ôm vừa như hình do quần da nên mỏng đũng quần hơi ngắn nên luc mặc hơi kích chỗ ấy cộm len hơi phản cảm được cái giãn tốt với mặc phối với boots trôg chiến vãi chưỡng ấy anh em mua nên cân nhắc chọn size cho đúng nhé
5,giao hàng nhanh gói hàng kỹ đặt một ngày nhân viên nhiệt tình
5,đặt quần nam mà giống quần nữa quá lưng thun phía sau nị đùn nên nam không nên mua mà nữ mua mặc đúng hơn á shop ơi con gái lấy mặc đúng dáng nữ chứ không phải quần cho nam ả mang tính minh hoạ vì chưa mặc mới thử à
5,thiết kế phong cách thanh lịch bền lâu dài dây thắt lưng co giãn cho sự vừa vặn hoàn hảo dây thắt lưng co giãn cho sự vừa vặn hoàn hảo dây thắt lưng co giãn cho sự vừa vặn hoàn hảo dây thắt lưng co giãn cho sự vừa vặn hoàn hảo quần đa năng cho mọi dịp quần đa năng cho mọi dịp dây thắt lưng co giãn cho sự vừa vặn hoàn hảo
5,thiết kế sang trọng thanh lịch quần đa năng phù hợp với mọi dịp lý tưởng cho phong cách hàn quốc dây chun co giãn tạo cảm giác vừa vặn
5,quần đẹp 5 sao nha ưng ý
5,đặc quần nam mà giao quần nữ
5,hài lòng với sản phẩm sẽ ủng hộ tiếp
3,sản phẩm chất không như mình nghĩ quần kiểu lụa chứ không phải form cứng như hình mặc trong nhà tạm ổn được mỗi cái giao hàng nhanh chất liệu giống áo giữ nhiệt
3,mình đặt màu đen mà giao màu xanh shop cũng không một lời nhắn gửi kèm theo chất liệu cũng ổn nhưng chị 3 sao vì màu này con mình không thích
5,hoàn hảo cho cả trang phục trang trọng bình thường
5,giao hàng nhanh chóng hình ảnh chỉ mang tính chất minh họa để lấy xu
5,thiết kế ôm vừa giúp tôn dáng
5,dễ dàng phối với nhiều trang phục khác nhau đơn giản nhưng thời trang hoàn hảo cho mùa hè chất liệu cotton thoải mái màu rất đẹp gói kĩ càng form cũng đẹp nhưng nếu 165cm 60kg mặc sẽ đẹp hơn
5,chiều cao cân nặng 165cm 65kg
5,quần mỏng nhão
5,thời trang thoải mái dễ dàng giặt bảo quản thiết kế đa năng cho cả nam nữ
5,giống y như hình
5,quần khá thoải mái
5,dày dặn hợp với chất lượng
5,thoải mái ok vừa vặn ok độ bền chưa biết
5,thích thiết kế mát mẻ thời trang vừa vặn trông tuyệt vời
5,hoàn hảo cho lối sống năng động hoàn hảo cho lối sống năng động chất lượng tuyệt vời với giá cả phải chăng
5,màu xanh rất sống động
5,giao đúng hàng đủ số lượng chất lượng sử dụng mới biết thế nào
5,vai hơi mỏng nhưng mặc vừa thoải mái giá rẻ cảm on shop
5,hàng xấu quá giao không giống hình mẫu ai chưa mua không nên mua
5,chúc may mắn
5,tốt
5,phù hợp cho cả nam nữ thiết kế ống rộng đang thịnh hành hoàn hảo cho vẻ ngoài giản dị hợp thời trang
5,tuyệt vời cho việc vận động dây thun co giãn để ôm vừa vặn lý tưởng cho thể thao yoga
5,vừa vặn tôn dáng cho mọi loại cơ thể
5,quần vải nặng tay mịn mát độ bóng bóng cái màu đen chật hơn cái màu xám đen 2 túi 2 bên hông luôn
5,màu đen vải mỏng thiết kế đơn giản tối giản hoàn hảo cho việc mặc hàng ngày phù hợp cho mọi mùa
5,vải thoải mái co dãn tốt phù hợp cho mọi mùa giá trị tuyệt vời cho số tiền bỏ ra
5,hoàn hảo cho việc mặc hàng ngày vừa vặn tôn dáng tuyệt vời đa dạng dễ phối đồ
5,thiết kế phong cách hoàn hảo cho các hoạt động thể thao không nhăn ngay cả sau khi sử dụng lâu
5,vừa vặn tuyệt vời vải mềm co giãn hoàn hảo cho các hoạt động thể thao
5,tuyệt vời cho các hoạt động ngoài trời thiết kế phong cách quần thể thao chất lượng cao chất liệu chống gió cao cấp
5,mua hơn size nên mang thoải mái co dãn tốt chất thun trong lớp nỉ ấm áp
5,đúng quần nỉ đẹp lúc trước mùa shop khác giao quần thun không phải nỉ
4,sản phẩm ok nha
5,vừa vặn đặt màu hoa mai nhưng trông giống màu kem hơn thích hợp cho mặc giản dị hàng ngày
5,nhận được hàng trong hộp thư cảm ơn người bán cảm ơn đại lý giao hàng
5,chất lượng tuyệt vời không nhăn nhúm dễ dàng
5,chất liệu ổn
5,quần khá ổn
4,quần hơi rộng vải mỏng không như mong đợi
5,mặc gọn nhưng đường chỉ không chắc chắn dù sao cũng phù hợp giá tiền
4,vải hơi tệ một chút
5,không phải chất jean nên không co dãn nhưng quá ổn mình m59 nặng 56kg mặc khá ok sẽ mua tiếp màu khác để thay đổi
5,chất liệu giống như lụa cao cấp
5,vãi mõng mặc mát màu cũng được nhưng đường may 2 bên bị giựt lên nên không được đẹp
5,giao hàng nhanh mẫu mã tạm đường may không cẩn thận chỉ thừa nhiều
5,bí hơi mặc quá nực chỉ mặc ngủ được thôi mặc đi đâu hay chỉ mặc rồi ngồi học bài thôi thì bí hơi nổi ghẻ nha mọi người ai ở máy lạnh thì suy xét tui lỡ dại ham mua đồ rẻ mà mua tận 4 cái của shop một lượt lỗi tui hết nên trừ 1 sao thoi
5,tuyệt vời cho cả nam nữ thiết kế thoải mái thời trang
4,quần hơi khác so với ảnh 58kg trở nên thì mặc size trên xxl vải hơi mỏng nhưng với giá tiền thì mình thấy cũng hơi chát
5,tùy chọn giao hàng nhanh chất lượng cao thủ công việt nam chất lượng cao thủ công việt nam chất lượng cao thủ công việt nam
5,đây lần mua thứ 3 tốt giá ổn
5,nói chung tạm ổn giá giè phải mất một tuần mới nhận được hàng sẽ ủng hộ shop lần tới ạ
5,màu không được đẹp lắm nói chung tạm ổn giá cả hợp lí sẽ tiếp tục ủng hộ shop
5,hoàn hảo cho đàn ông trung niên phong cách cổ điển bền vững phong cách đa dạng cho mọi dịp
5,quần đẹp may kỹ không chỉ thừa giao hơi lâu xíu được tặng khẩu trang đẹp nhé hàng quốc tế
5,chất liệu ok
5,hoàn hảo cho mùa hè quần short đa năng cho mọi dịp thiết kế hiện đại hợp thời trang thoải mái phong cách
5,rất thoải mái thoải mái phong cách vải nhanh khô dễ dàng làm sạch bảo trì quần short đa năng cho mọi dịp
5,đa dạng dễ phối đồ đa dạng dễ phối đồ vừa vặn hoàn hảo hoàn hảo để thư giãn tại nhà hoàn hảo để thư giãn tại nhà bền lâu dài
5,túi lớn với không gian thoải mái thích hợp cho mặc mùa hè thích hợp cho trang phục công sở giản dị thiết kế kiểu thắt lưng thể điều chỉnh
5,eo đàn hồi phù hợp phong cách thiết kế với thắt lưng điều chỉnh thích hợp cho mặc mùa hè nhiều phong cách dễ dàng để mặc một sợi chỉ may nhẹ nhưng quan trọng nhất gửi bạn thể phải chờ rất lâu
5,màu vàng thời trang giao hàng nhanh chóng chất liệu denim bền thiết kế ống rộng màu vàng thời trang
5,chất liệu cotton thoải mái màu đen cổ điển màu xanh nhạt độc đáo màu vàng thời trang
5,giao hàng nhanh chóng phong cách mỹ cổ điển màu xanh nhạt độc đáo màu đen cổ điển
5,nên mua
1,bán hàng không có tâm tuy giá rẻ nhưng cũng không nên giao đồ rách thái độ thì bất cần nếu chọn được 0 thì sẽ đánh giá không có nào mới xứng đáng với shop này
5,tốt mua tiếp nhé shop
5,chất liệu rất rất ok
5,thời trang phong cách vừa vặn thoải mái phong cách linh hoạt
5,đa dạng dễ dàng phối đồ giá trị tuyệt vời cho tiền bỏ ra thiết kế thoáng khí thời trang
5,vẻ ngoài bóng bẩy hiện đại kết cấu mịn mềm vải mát thoáng khí hoàn hảo cho mùa hè
5,vừa vặn chất lượng tuyệt vời kiểu dáng mượt mà hiện đại thiết kế thoáng khí thời trang đa dạng dễ dàng phối đồ
5,tác phẩm này không thể được mua ở thái lan với mức giá này tất nhiên chắc chắn phải một bản nâng cấp mua ngay khuyên bạn nên đặt hàng nhiều hơn
5,chất liệu vải mềm mịn đẹp
5,giá trị tuyệt vời cho số tiền bỏ ra phù hợp cho việc mặc hàng ngày giá trị tuyệt vời cho số tiền bỏ ra
5,dễ dàng phối hợp với nhiều trang phục đặt 5 cái thì 1 cái loại vải khác 2 cái mỏng hơn thun khác không phải cotton
5,mua 4 cái màu hồng mà shop gửi 4 màu khác nhau sao ta shop hết màu cũng không nhắn mình 1 tiếng gì hết
5,hàng đẹp cực kì chấy dày dặn nói 17k không ai tin ạ giao hàng cũng nhanh đóng gói đẹp nói chung hợp tìn
5,sẵn màu đen xanh nâng cao hiệu quả tập luyện với quần này nâng cao hiệu quả tập luyện với quần này nâng cao hiệu quả tập luyện với quần này nâng cao hiệu quả tập luyện với quần này vải thoáng khí thoải mái
5,thoải mái rộng rãi chất lượng tuyệt vời với giá cả phải chăng hoàn hảo cho việc mặc hàng ngày vải mềm mại nhẹ nhàng
4,rất phù hợp co giãn hoàn hảo cho mùa xuân mùa thu thiết kế logo thời trang hợp thời trang
5,linh hoạt thuận tiện cho việc di chuyển thoải mái khi mặc
5,chiều cao cân nặng quần hơi mỏng với giá này mình mua quần khác dày dặn ok hơn rất nhiều hihihi nhưng cũng được mặc áo phông rộng nữa ok
5,hoàn hảo cho mùa hè với chất liệu thoáng khí lý tưởng cho các hoạt động ngoài trời thiết kế đơn giản tinh tế
5,chất liệu vải mỏng mặt mát
5,hàng quá mỏng gây thất vọng nhiều
5,hàng rất mỏng tệ lắm thất vọng nhiều
2,chất lượng kém vải như vải màn thất vọng
5,hoàn hảo cho vẻ ngoài thời trang không chút cẩu thả vải chất lượng cao ôm vừa vặn
