rating,review
5,ok quần đẹp chắc chắn vải hơi mỏng giá rẻ hợp lý mọi người nên mua ủng hộ shop nhân viên giao hàng nhanh lịch sự vui vẻ
5,chất lượng tốt giá rẻ đây một trăm sao để đi đến ngôi sao để được nó đến 100 điểm đầy đủ 5 sao
5,ôm vừa vặn thoải mái vải mềm mịn quần thể thao chất lượng cao dễ mặc
5,chất liệu vải tốt màu giống như ý thích điều chờ đợi khá lâu nhưng không sao nói chung ok
5,chất liệu bò giấy
5,vải nhanh khô chất liệu cao cấp amazing good job shop
5,amazing good job shop
5,thoải mái khi mặc cả ngày lý tưởng cho các hoạt động thể thao vải co giãn cao
3,giao hàng quá lâu quần may không đẹp bị rút chỉ vải thì mỏng không giống như quản cáo
5,vừa vặn thông thường cho vẻ ngoài cổ điển vải chất lượng cao
5,bền lâu bền màu đen thời trang chất liệu cao cấp quần co giãn thoải mái
5,chất vải tốt giá sale ổn mình vẫn luôn ủng hộ đồ của shop đồ shop dễ mặc đóng gói cẩn thận xinh xắn lắm nha 5 cám ơn shop nha
5,nhận được đồ thử ngay áo mặc vào êm mát mẻ thoải mái chất vải êm lắm rất thích sẽ ủng hộ shop nhiều hon
5,công nhận giao nhanh túi đóng gói cẩn thận chất lượng cũng tốt so với giá cả thì quá ổn shop phục vụ nhiệt tình lưu shop lại lần sau mua
5,bền lâu dài mẫu kiểm tra độc đáo màu đen nhiều màu vừa vặn kiểu dáng đẹp vải cotton thoải mái
5,tốt n n
5,giao hàng chậm chất liệu mỏng nhưng thoải mái lý tưởng cho nam giới trung niên
4,khuy áo không bị xuyên thủng n ban nhạc cao su được gọi quần jean
5,chất vải xịn sò lắm quần form đẹp
5,vải quần thì ok nhưng đường chỉ may xấu quá không vat so lần sau ủng hộ nữa mong shop sẽ giao hàng đẹp hơn
5,vẻ ngoài thời trang hợp xu hướng phù hợp cho cả công việc trang phục thường ngày
5,quần mình mua quần màu đen 2 quần này không phải
5,quần đẹp lắm ạ shop đóng gói cẩn thận giao nhanh sẽ giới thiệu bạn bè mua sản phẩm của shop
5,quần thun kỉu này quá đắt chất liệu vãi quảng cáo thấy khác đêm về khác
5,hoàn hảo cho thể thao mặc hàng ngày yêu thích thiết kế ống rộng túi tiện lợi để lưu trữ thoải mái phong cách hoàn hảo cho thể thao mặc hàng ngày
5,phù hợp chặt chẽ chiều cao 178 trọng lượng 85
5,thiết kế ống rộng tuyệt vời cho hoạt động biển hoàn hảo cho mùa hè chất liệu chất lượng cao
5,quần tây phong cách hàn quốc thời trang nhưng may chắp lệch số ống to ống bé cái dài cái ngắn chán
5,vừa vặn thoải mái quần thời trang thoải mái tuyệt vời cho các hoạt động thể thao
5,thích hợp cho bé trai 315 tuổi thích hợp cho dịp bình thường vải chất lượng rất tốt độ đàn hồi cao để phù hợp
5,vải chất lượng rất tốt giá cả phải chăng thích hợp cho mùa hè thích hợp cho cậu bé 315 tuổi thoáng khí mồ hôi thiết kế thời trang thời trang
5,mình nghĩ với chất liệu này thì không được đẹp lắm đối với form quần tập thể thao mặc thường thì được thun dãn tốt dành cho người 5565 kí vận chuyển hàng nhanh
5,giao hàng khá nhanh đóng gói cẩn thận quần mềm mỏng khá dễ nhăn mặc thoải mái
5,chất liệu mềm mại co dãn giá trị tuyệt vời cho giá tiền vận chuyển nhanh chóng người bán đáng tin cậy
5,vải mỏng manh hình ảnh thì dày nhưng thực tế vải quá mỏng mặc chữa cháy thì được chứ mặc thường dễ làm đồ lau nhà
5,hàng giống hình nhưng không được đẹp như hình chất liệu vải thường chất lượng trong tầm tiền
5,vải cảm thấy mềm mại mịn màng phù hợp tuyệt vời vải thoải mái hoàn hảo cho kinh doanh chính thức mặc
4,tuyệt vời cho trang phục công sở dịch vụ khách hàng xuất sắc giá trị tốt cho số tiền bỏ ra
5,shop giao hàng kì quá đặt màu đen giao màu xám sao vải thì ok rồi đó
5,thời trang hợp xu hướng thiết kế ống rộng dây thắt lưng co giãn cho sự thoải mái vải mềm mại thoải mái
5,chất liệu mềm mịn thoải mái đai thun co giãn giúp vừa vặn thoải mái
5,màu đen linh hoạt lý tưởng cho các dịp thường ngày hút mồ hôi tốt
5,bền lâu dài dễ dàng phối với các trang phục khác vừa vặn thoải mái cho mọi mùa
5,rẻ hơn tất cả các cửa hàng được tìm thấy vận chuyển rất nhanh dịch vụ tốt
4,vải mềm thoải mái khi mặc nhưng may không gọn gàng phải tự cắt nó
5,thiết kế đơn giản tối giản kiểu dáng rộng thẳng tạo vẻ thư giãn quần short thời trang thoải mái
5,vải nhanh khô một điểm cộng thiết kế đơn giản tối giản hoàn hảo cho thể thao các hoạt động ngoài trời
5,sẵn sàng di chuyển hình dáng công thái học vải thoáng mát thoáng khí thích hợp cho các môn thể thao mùa hè
5,quần thời trang thoải mái thiết kế hiện đại hợp thời trang quần dài cho bảo hiểm đầy đủ hơi đàn hồi cho phù hợp thoải mái
5,nhận được đẹp giống như rất nhiều không bị hư hỏng giống như trong trang bìa ở tất cả
5,thiết kế phong cách hợp thời trang thiết kế phong cách hợp thời trang bền lâu dài
5,thoải mái khi mặc cả ngày bền lâu dài dễ dàng kết hợp với nhiều trang phục khác nhau
4,giặt thấy bị phai màu ban đầu khá nhiều chất liệu co giãn mặc tương đối được
5,sản phẩm ok
5,thiết kế hiện đại mỏng thiết kế hiện đại mỏng vừa vặn thoải mái hoàn hảo cho trang phục hàng ngày chất lượng với giá cả tuyệt vời thiết kế hiện đại mỏng thiết kế hiện đại mỏng
5,nhận được hàng như hình mẫu fom rộng rãi ok nhưng chất liệu vải mỏng quá để sử dụng cho quần nam
5,nói chung với giá này thì quá rẻ rồi chỉ vài chục nghìn mà mua được cái quần dài
5,quần asrv quần nam quần dài nam quần dài nam quần nam quần nam quần nam quần mỏng thoáng khí đa năng màu trơn quần thường ngày
5,giá trị tuyệt vời cho tiền phong cách hàn quốc phong cách vải thoáng khí cho không khí nóng vải thoáng khí cho không khí nóng quần short thời trang thoải mái
5,mua hàng của shop nhiều voucher giảm giá
5,chất liệu thun
5,quá đẹp luôn thấy ổn nha shop nhiều đồ đẹp chất liệu ok
5,giới thiệu cửa hàng này tất nhiên không thất vọng chất lượng tốt rẻ tiền tốt
5,đường may bền chắc cho sử dụng lâu dài thiết kế đơn giản nhưng thời trang lý tưởng cho việc tập thể dục trong phòng tập
5,vải chất lượng cao cho cảm giác sang trọng chất liệu mát thoáng khí đa năng cho cả thể thao mặc hàng ngày
5,thiết kế mượt mà thời trang chất liệu vải co giãn mang lại sự thoải mái vừa vặn tốt cho mọi dáng người
5,dễ dàng ghép nối với bất kỳ hàng đầu hoàn hảo cho người lớn trẻ tuổi vật liệu bền co giãn thiết kế thời trang linh hoạt
5,giá trị tuyệt vời cho giá cả vải co giãn thoải mái lý tưởng cho việc mặc hàng ngày
5,lý tưởng cho việc mặc hàng ngày mịn màng mát mẻ khi mặc
5,đa dạng dễ phối đồ đa dạng dễ phối đồ vừa vặn hoàn hảo hoàn hảo để thư giãn tại nhà hoàn hảo để thư giãn tại nhà bền lâu dài
5,ok mua dùm nên không biết đánh giá gì chủ yếu kiếm xu thôi giao hàng nhanh
5,vải mềm thoáng khí quần short bền quần short đa năng cho trang phục hàng ngày giá trị tuyệt vời cho giá cả vải chất lượng cao cho sự thoải mái tối đa quần short hoàn hảo cho mùa hè thiết kế cổ điển vượt thời gian quần short thời trang thoải mái
5,nhận hàng
5,quần short thời trang thoải mái vải chất lượng cao cho sự thoải mái tối đa vải mềm thoáng khí phong cách hiện đại hợp thời
5,dễ dàng kết hợp với các trang phục khác nhau hoàn hảo cho vẻ ngoài giản dị vừa vặn ôm sát thời trang bền lâu dài dễ dàng kết hợp với các trang phục khác nhau dễ dàng kết hợp với các trang phục khác nhau dễ dàng kết hợp với các trang phục khác nhau
5,hơi rộng giá trị tuyệt vời cho giá cả bền lâu dài quần short đa năng cho trang phục hàng ngày dễ dàng kết hợp với các trang phục khác nhau
5,vải tốt nó ok thoải mái để mặc vải rất mềm giao hàng nhanh chắc chắn sẽ trợ cấp một lần nữa
5,phong cách hoàn hảo cho các dịp bình thường thiết kế phong cách thoải mái vải nhẹ thoáng khí thiết kế phong cách thoải mái vải nhẹ thoáng khí thiết kế phong cách thoải mái hoàn hảo cho các dịp bình thường thiết kế phong cách thoải mái thiết kế phong cách thoải mái vải nhẹ thoáng khí
5,thoải mái đẹp trai độc đáo thời trang ánh sáng thoáng khí hiện đại trung quốc phong cách thiết kế giá trị tốt cho tiền bền lâu dài
5,hàng bị rách 4 chỗ không thể mặc được lúc nhận hàng người giao hàng không cho xem bảo hàng nước ngoài chúng cháu chỉ biết giao thôi nếu đổi được thì cho đổi ngay nhé
5,vừa vặn thoải mái kiểu dáng rộng lớn độc đáo phù hợp cho tất cả các mùa đàn hồi tốt cho sự linh hoạt
5,thoải mái tốt vừa vặn tuyệt vời cho trang phục thường ngày
5,tốt tốt
5,quần dài thể thao túi khoá kéo tiện lợi shop nói vải dù nhưng thấy vải hơi giốg quẩn tây hơn giá rẻ nên cũng không biết bền không
5,bền bền bỉ thoải mái khi mặc hoàn hảo cho các hoạt động thể thao chất liệu chất lượng tuyệt vời lưng thể điều chỉnh với dây rút vừa vặn hoàn hảo thiết kế thời trang túi khóa kéo hai bên tiện lợi
5,thích hợp cho thể dục hoặc thể dục vật liệu thể mang lại cảm giác thoải mái thoáng khí giống như phong cách của chiếc xà cạp này
5,nhận hàng bận vừa ngưng vải thun lót không thích bận chắc để cho
5,siêu căng cho thoải mái cả ngày thiết kế quần harem thời trang màu đen đa năng đi với mọi thứ
5,chật bó khuyến cáo nhà sản xuất co xl dùng cho 65 đến 70kg mình 60k mà mặc không vừa giao hàng nhanh dùng cho người 50kg may ra vừa đánh giá 9
5,cổ điển bền bỉ chuyên nghiệp thanh lịch giá trị tuyệt vời cho tiền đa năng thời trang dễ dàng phối đồ kết hợp thoải mái nhẹ nhàng
5,đa năng thời trang chất liệu cao cấp bền lâu bền giá trị tuyệt vời cho tiền chuyên nghiệp thanh lịch
5,cửa hàng này ok chất lượng tốt giao hàng nhanh đóng gói tốt rất tốt chắc chắn sẽ trợ cấp cho cửa hàng này cảm ơn bạn rất nhiều
5,tệ chất liệu tệ
5,vải nhanh khô hoàn hảo để chạy đa năng cho trang phục hàng ngày
5,bền bền lâu thiết kế đa năng dành cho cả nam nữ
5,sự thoải mái vải chất lượng cao cấp lý tưởng cho các hoạt động ngoài trời thoáng khí thoải mái lý tưởng cho các hoạt động ngoài trời
5,thiết kế đa năng cho cả nam nữ
5,giá trị tuyệt vời cho giá cả
5,quần jogger thoải mái thời trang chất liệu cao cấp mang lại cảm giác thoải mái tuyệt vời thiết kế thời trang với vạch phản quang lý tưởng cho thể thao mặc hàng ngày
5,vừa vặn tuyệt đối thiết kế thời trang quần jogger chất lượng cao với giá cả phải chăng thiết kế thời trang với vạch phản quang
5,hang ok nỉ bông giá đi đôi với chất lượng mua rộng tí mặc thoải mái quần mặc di làm nên giá này rất ok rồi mặc mềm thoải mái không nóng lắm
5,chất liệu cao cấp mang lại cảm giác thoải mái tuyệt vời thiết kế thời trang với vạch phản quang
5,chất lượng tuyệt vời giá trị đáng đồng tiền hoàn hảo cho các hoạt động thể thao
5,hàng chuẩn chất vải mặc rất chi mát mặc thích rất ok
5,vừa ý
5,quần ống đứng thời trang thiết kế họa tiết hoạt hình độc đáo họa tiết hoa thêm chút thanh lịch
5,chất liệu ok 5 sao
5,chất liệu denim cao cấp
1,shop quá tệ đặt quân giáo áo anh em nên né à
1,địt mẹ đặt quần giao áo như con c
5,thiết kế thời trang hợp thời trang vải mềm mại thoải mái thích hợp cho các hoạt động đạp xe ngoài trời thích hợp cho yoga phòng tập thể dục
5,cung cấp sự linh hoạt tốt cho tập thể dục thích hợp cho đi xe đạp các hoạt động ngoài trời vật liệu linh hoạt thoải mái túi bên nhỏ thuận tiện cho điện thoại
5,u là trời đẹp xuất sắc đúng màu tra tình vải dày dặn đứng quần shop giao hàng siêu nhanh
5,hơi nhiều chỉ thừa nhưng vẫn đẹp chất vải mát mẻ 1 2 vết đen tí vừa với giá tiền quần đứng phom
5,vừa vặn thoải mái hoàn hảo phù hợp cho cả dịp trang trọng thường ngày vải co giãn dễ dàng vận động
5,phù hợp cho cả dịp trang trọng thường ngày không nhăn luôn gọn gàng
5,vận chuyển trong thời gian quy định chất lượng tốt dễ sử dụng
5,hoàn hảo cho cả dịp bình thường trang trọng vừa vặn thoải mái khi mặc quần đa năng phù hợp cho mọi mùa
5,hoàn hảo cho cả dịp bình thường trang trọng quần đa năng phù hợp cho mọi mùa
5,hoàn hảo cho nam giới trung niên vải bền thoải mái được làm bằng vải dày mềm
5,hàng nước ngoài giao khá lâu chất liệu vải phù hợp giá tiền form cũng đẹp
5,siêu mỏng nhanh chóng làm khô máy lạnh lưới cho thông gió điều chỉnh eo cho phù hợp hoàn hảo thích hợp cho mặc hàng ngày
5,thích hợp cho mặc hàng ngày chất liệu lụa satin thoải mái thích hợp cho mặc hàng ngày rất mỏng nhanh khô bền lâu dài vải giản dị
4,vải mỏng mặc nhìn thấy trong luôn ấy kiểu vải lổ lổ vừa vặn thoải mái với eo thể điều chỉnh vải siêu mỏng thoáng khí
5,hoàn hảo cho leo núi leo trèo quần thể chuyển đổi phù hợp với điều kiện thời tiết chất liệu nhanh khô hoàn hảo cho leo núi
5,chất liệu nhanh khô hoàn hảo cho leo núi thiết kế thời trang tiện dụng thiết kế thoáng khí giữ bạn mát mẻ quần thể chuyển đổi phù hợp với điều kiện thời tiết
5,thiết kế thoải mái phong cách thiết kế thoải mái phong cách chất liệu vải chất lượng tuyệt vời chất liệu vải chất lượng tuyệt vời
5,vải giống vải dù dày loại may võng vải nhanh khô túi khóa kéo tiện lợi
5,túi khóa kéo tiện lợi thiết kế đáy rộng thoải mái khi mặc nhẹ thoáng khí
5,được làm từ chất liệu denim chất lượng cao kiểu dáng cổ điển phù hợp cho mặc hàng ngày viền quần buộc dây tạo điểm nhấn thời trang
5,độ dày vừa phù hợp cho mặc quanh năm viền quần buộc dây tạo điểm nhấn thời trang thiết kế eo giữa để vừa vặn tôn dáng
5,túi khóa kéo tiện lợi yêu thích thiết kế phong cách tuyệt vời cho các buổi tập gym
5,quần xài ok chữ người yêu thêu sắc nét quần ôm gọn mặt vừa cho người 65 không tập gym
5,đẹp ôm gọn cho người 65 kg chỉ thêu chữ người yêu đẹp sắc sảo giá khá mềm
5,phong cách hợp thời trang vừa vặn hoàn hảo thoải mái chất liệu chất lượng cao bền lâu dài
5,ok túi dài để đt thoải mái vải hơi mỏng hơn đợt đầu mình mua
5,chất liệu chất liệu tốt mềm mại
3,giao hàng khá lâu đặt hàng từ nước ngoài mà nhà bán hàng lại địa chỉ giao hàng tại hà nội chất liệu vải độ dài quần y mô tả hình ảnh quảng cáo khác xa so với thực tế nhận in hình sai hoàn toàn không giống như mô tả nên cho shop 3 vì sai hình in nhé hình quảng cáo in full tới lai quần còn hình nhận được chỉ tới khuỷu chân thôi shop bán hàng tử tế lại
5,hình chỉ mình họa hàng ok còn chất lượng thì thời gian sẽ trả lời nói chung tổng thể thì ok
5,kiểu dáng
5,nên mua tăng size mặc ôm khít khó chịu quá
5,ai mua nhớ tăng size nha mặc ôm khít khó chịu à
1,vải thì cũng tạm nhưng quần giao thì bị đứt chỉ tùm lum quá kém
4,hơi bé
5,rách gối không đẹp lắm
5,rất đẹp vãi ok màu chuẩn tốt so với giá
5,đa năng thoải mái khi mặc phù hợp hoàn hảo cho mọi dịp
5,chất lượng rất tốt chất liệu dày jahitan kemas rất vừa vặn rasa mcm layak bayar 7990 punya chất lượng vận chuyển từ trung quốc đến kl mất khoảng 6 ngày không tệ chút nào bang cho buck vui lòng tự tin mua hàng sẽ cập nhật đánh giá này theo thời gian để đánh giá độ bền
5,người bán giao hàng rất nhanh hàng nhận được an toàn cảm ơn người bán rất tốt
5,nhận được quần bó sát bó sát trong tình trạng tốt
5,mua lần hai chất liệu màu giống như quảng cáo do hàng vận chuyển từ nước ngoài nên thời gian nhận hàng hơi lâu
5,nhận được hàng đúng như quảng cáo sẽ ủng hộ shop trong đơn hàng tiếp theo
5,bền lâu bền chất lượng tuyệt vời với giá thành vừa vặn hoàn hảo thoải mái khi mặc
5,nhận được hàng y hình chất liệu vải tốt nhưng hơi rộng lớn so với người 55kg sẽ ủng hộ shop thêm
4,chất lượng tuyệt vời với giá thành
5,vừa vặn thoải mái với dây thắt lưng co giãn vừa vặn thoải mái với dây thắt lưng co giãn
5,mình mua lại lần thứ ba rồi cảm ơn shop nhiều nhiều nhiều nhiều
5,chất liệu vải chất lượng cao bền bỉ vừa vặn hoàn hảo thoải mái khi mặc quần áo thời trang thoải mái
5,thoải mái nhưng thời trang thiết kế ống rộng cho vẻ ngoài hợp thời trang
4,vừa vặn tuyệt vời với nhiều lựa chọn cỡ lớn dễ dàng phối đồ linh hoạt trong nhiều phong cách
5,hoàn hảo cho phong cách đường phố bình thường thoải mái hợp thời trang
5,giá trị tuyệt vời cho giá cả dây thắt lưng đàn hồi cho một phù hợp thoải mái chất liệu vải lanh cotton thoáng khí1
5,độ bền ok thoải mái ok vừa vặn ok rất thích mang loại này
5,hàng giống mô tả
5,bền sử dụng lâu dài
5,được rồi cửa hàng dễ thương dịch vụ tốt với miễn phí vận chuyển giao hàng nhanh cho giao hàng ở nước ngoài
5,hàng đẹp nhé chất đẹp may cẩn thận mà giá cả quá hợp lý mặc mùa hè hay đông đều ok
5,quần đẹp nha shop may cẩn thận mặc hè hoặc thu rất phù hợp shop tốt
5,giá trị tuyệt vời cho tiền phong cách hàn quốc phong cách vải thoáng khí cho không khí nóng vải thoáng khí cho không khí nóng quần short thời trang thoải mái
5,quần short chất lượng tuyệt vời tuyệt vời để làm việc ra trọng lượng nhẹ dễ dàng để rửa dịch vụ tuyệt vời giao hàng cảm ơn
5,lý tưởng cho việc mặc hàng ngày dễ dàng phối hợp với bất kỳ trang phục nào thiết kế linh hoạt phong cách
5,thiết kế nhiều túi tiện lợi dễ dàng kết hợp với bất kỳ trang phục nào
5,vừa vặn thoải mái suốt cả ngày phù hợp cho hoạt động thể thao hàng ngày thiết kế nhiều túi tiện lợi phù hợp cho hoạt động thể thao hàng ngày
5,phù hợp cho hoạt động thể thao hàng ngày vải chất lượng cao mang lại sự thoải mái vừa vặn thoải mái suốt cả ngày
5,phù hợp cho hoạt động thể thao hàng ngày thiết kế nhiều túi tiện lợi
5,dễ di chuyển vải cotton thoải mái thiết kế phong cách
5,dịch vụ khách hàng tuyệt vời giá cả phải chăng nhẹ thoáng khí may đường tốt chất lượng vừa vặn tuyệt vời thiết kế thời trang
5,không biết chất liệu gì rất mỏng không đứng quần giống quần mặc ở nhà đường chỉ may lỏng lẻo
5,chất lượng hàng quá tốt đồ còn rất mới nhìn đẹp giá không mắc so với các cửa hàng khác dịp mình sẽ đến lại
5,thoải mái phong cách vải chất lượng cao giá trị tuyệt vời cho giá cả chất liệu thấm hút mồ hôi
5,tuyệt vời cho việc chạy bộ thoải mái phong cách tuyệt vời cho việc chạy bộ
5,vừa nhận hàng của shop sản phẩm này tuyệt vời nha rất đẹp giao hàng rất nhanh sản phẩm đáng đồng tiền nha
1,không hề giống mẫu trên hình 1 tí nào nhắn tin thì shop không trả lời thật sự không hài lòng
4,chất liệu vãi hơi mỏng tí nhưng ok
5,vải chất lượng cao cấp
5,shop đóng gói cận thận giao hàng nhanh chóng chất lượng số tuyệt vời
5,shop giao đúng mẫu đúng màu mình chọn quần đẹp lắm luôn mặc thử rất ok sẽ giới thiệu bạn bè mua sản phẩm của shop
5,thiết kế cổ điển đơn giản túi tiện lợi để lưu trữ các vật dụng nhỏ vừa vặn với kiểu cắt thông thường hoàn hảo để tạo ra vẻ ngoài cổ điển
5,thiết kế ống rộng cho vẻ ngoài thời trang quần đa năng cho các dịp bình thường vừa vặn với kiểu cắt thông thường
5,thiết kế ống rộng cho vẻ ngoài thời trang mặc thoải mái giao đúng mẫu mã đúng cỡ
5,tuyệt vời cho cả nam nữ
5,thiết kế linh hoạt cho nhiều dịp thoải mái rộng rãi quần lịch lãm thời trang hoàn hảo cho việc mặc hàng ngày thiết kế linh hoạt cho nhiều dịp thoải mái rộng rãi hoàn hảo cho việc mặc hàng ngày quần lịch lãm thời trang
5,quần pha nilong nhiều co giãn
5,rẻ đẹp
1,xấu
5,thiết kế theo phong cách hàn quốc tuyệt vời cho các hoạt động thể thao ngoài trời chất liệu co giãn thoải mái hình ảnh mang tính chất nhạn xu
5,ôm sát để tạo vẻ ngoài thời trang thiết kế theo phong cách hàn quốc lý tưởng cho việc mặc hàng ngày
5,phù hợp cho sinh viên chất liệu co giãn thoải mái lý tưởng cho thời tiết nóng
1,đặt 3 quần nhưng chỉ giao 2 cái còn thiếu cái màu xám giá mắc nhất của đơn hàng sao tin tưởng shop của lazada mall mà kỳ vậy 1 sao
5,lý tưởng cho thời tiết nóng tuyệt vời cho các hoạt động thể thao ngoài trời
5,chất liệu cotton chất lượng cao lý tưởng cho các hoạt động thể thao
5,quần quá mỏng mọi người ơi mua nên cân nhắc kĩ nhìn bên đây thấy bên kia quá mát chất liệu nhẹ thoáng khí thoải mái suốt cả ngày
5,quần siêu mỏng nhìn bên đây thấy bên kia vải nhanh khô tiện dụng chất liệu nhẹ thoáng khí
5,nhìn cũng đẹp nhưg thuộc dạg siêu siêu mỏng vải nhanh khô tiện dụng thoải mái suốt cả ngày
5,vừa vặn thiết kế thời trang tuyệt vời chất liệu nhẹ thoáng khí
4,nhỏ hơn thiết kế tiêu chuẩn đa năng thời trang in chữ độc đáo phù hợp với thanh thiếu niên thanh thiếu niên phong cách trẻ trung thời trang
1,mua 6 kiểu quần dài quần đùi khác nhau ở lazada chất lượng kém hoàn toàn khác ảnh chụp quá thất vọng về phí tiền
5,đa năng cho cả nam nữ vải kaki thoải mái hợp thời trang trẻ trung hợp thời trang trẻ trung
5,phù hợp hoàn hảo cho nhiều loại cơ thể
5,chất liệu cotton chất lượng cao lý tưởng cho các hoạt động thể thao
5,vừa vặn đúng như quảng cáo vải thoáng khí thoải mái vải thoáng khí thoải mái
5,mặc lên nhìn mắc cười lắm nó như quần con gái ống rộng mà vải mềm èo dang thể thao
5,quần mềm mỏng nhẹ như quần phụ nữ đường may tốt sezy chuẩn nhưng không thích hợp vời người gầy do vải mềm mỏng9
